category,title,body,origin
클라우드/빅데이터,"한국선 ""개인정보보호법 위반"".. 빅데이터 사업 올스톱
","데이터 전문 기업 파수닷컴은 지난해 말 온라인 쇼핑몰과 병원, 금융기관 등 10여 곳과 추진하던 사업을 모두 중단했다. 파수닷컴은 의료와 신용카드 거래 기록 등 빅데이터에서 개인을 식별할 수 있는 정보만 골라 지우는 기술을 갖고 있다. 이 회사는 2016년 공공 정보를 상업적으로 활용하는 정부 가이드라인 발표 이후 고객사들이 큰 폭으로 증가하고 있었다.","데이터 전문 기업 파수닷컴은 지난해 말 온라인 쇼핑몰과 병원, 금융기관 등 10여 곳과 추진하던 사업을 모두 중단했다. 파수닷컴은 의료와 신용카드 거래 기록 등 빅데이터에서 개인을 식별할 수 있는 정보만 골라 지우는 기술을 갖고 있다. 이 회사는 2016년 공공 정보를 상업적으로 활용하는 정부 가이드라인 발표 이후 고객사들이 큰 폭으로 증가하고 있었다.

하지만 참여연대 등 12개 시민단체가 지난해 11월 정부 가이드라인에 따라 빅데이터 사업을 시작한 한국인터넷진흥원 등 4개 기관과 현대차·SK텔레콤·삼성생명 등 기업 20곳을 개인정보보호법 위반 혐의로 검찰에 고발하자 곧바로 사업 계획을 접은 것이다. 한 업계 관계자는 ""정부가 시민단체 눈치를 보느라 법 개정은 엄두도 못 내고 가이드라인만 내놓았다가 벌어진 일""이라고 말했다. 과학기술정보통신부 관계자는 검찰 고발 문제와 관련, ""기업들이 빨리 결론을 내려 달라고 아우성을 치고 있지만 우리 입장에서도 할 수 있는 게 없다""고 말했다.

◇한국인 빅데이터는 해외 기업 서버에

21세기 석유로 불리는 데이터는 인공지능(AI), 사물인터넷(IoT), 자율주행차 등 4차 산업혁명의 핵심 자원이다. 하지만 스위스 국제경영대학원(IMD)이 발표한 디지털 경쟁력 순위에서 한국의 '빅데이터 사용 및 활용 능력'은 63국 중 56위로 최하위권이다. IMD는 한국의 빅데이터 활용 능력이 콜롬비아·터키·브라질·페루·멕시코 같은 신흥국보다도 떨어진다고 평가했다. 기술에 대한 규제 강도도 63국 중 44위로 지나치게 과도하다고 분석했다. 기술에 대한 규제 장벽이 낮은 국가일수록 순위가 높다.

실제로 한국 기업들은 개인정보법 등 각종 규제와 인프라(기반) 부족으로 전 세계적인 AI 경쟁에 뛰어들 기회조차 얻지 못하고 있다. 빅데이터 분석 AI를 개발하는 스타트업(초기 벤처 기업) 솔리드웨어는 지난해 개인의 예금 및 금융 자산 현황, 카드 사용 이력, 보험 상품 현황을 모아 AI로 분석해 최적의 금융 상품을 추천해주는 서비스를 개발하려다 포기했다. 현행 신용정보법에서 금융 빅데이터 수집·분석을 원칙적으로 금지하고 있기 때문이다. 빅데이터에 포함된 개개인의 동의를 일일이 받는 경우에만 예외로 허용하고 있지만 스타트업 입장에서는 사실상 불가능한 일이다.

박재현 솔리드웨어 대표는 ""개인정보의 당사자가 누군지 모르게 비(非)식별화된 빅데이터는 기업이 자유롭게 사용할 수 있게 규제를 풀어줘야 한다""면서 ""이대로 시간이 지나면 중국 알리바바처럼 막대한 자금력과 기술을 가진 글로벌 핀테크 강자들이 국내 시장을 장악하게 될 것""이라고 말했다.

금융 부정 거래를 적발하는 스타트업 더치트는 사기에 활용된 대포 통장 계좌에 대한 빅데이터를 구축했다. 문제가 있는 통장과 연관된 금융거래가 이뤄지면 곧바로 고객에게 '의심 계좌'라고 통보해준다. 하지만 정부는 이 서비스를 허용하지 않고 있다. 계좌 번호가 개인정보에 해당하는 만큼 당사자 동의를 일일이 받아야 한다는 것이다. 김화랑 더치트 대표는 ""범죄자에게 동의를 받아야 한다는 황당한 규정""이라고 말했다.

◇미래 산업 핵심 인프라 '클라우드'도 해외 업체가 점령

인공지능·빅데이터 사업의 핵심 인프라인 클라우드(가상 저장 장치) 분야에 대한 투자도 크게 부진하다. 미국 시장 조사 업체 시너지 리서치그룹에 따르면 지난해 기준으로 10만대 이상의 서버(대형 컴퓨터)를 운영하는 하이퍼스케일(초대형) 데이터센터는 전 세계 390곳에 이르지만 한국은 단 한 곳도 없다. 기업들이 당장 활용하기 힘든 데이터에 비용을 투자하는 데 큰 관심을 두지 않고 있기 때문이다. 상황이 이렇다 보니 국내 사용자들이 스마트폰, 소셜미디어 등을 이용하면서 만들어내는 데이터는 구글·마이크로소프트·페이스북 같은 해외 기업들의 서버에 차곡차곡 쌓이고 있다.

국내 클라우드 시장도 이미 아마존·마이크로소프트 등 미국 기업이 장악했고, 국내 대표 IT 서비스 업체들은 아직까지 계열사 데이터를 관리하는 수준에 그치고 있다. 아마존 등 해외 업체들은 단순히 원격 저장 장치를 제공하는 수준을 넘어서 AI로 한국 기업 고객사들의 빅데이터를 분석해 최적의 마케팅 기법과 고객 관리 방안을 제시해준다. 또 맞춤형 AI 소프트웨어 개발과 보안 서비스도 제공한다. 이들에 대한 한국 기업의 의존도가 계속 높아질 수밖에 없는 것이다.

김창경 한양대 과학기술정책학과 교수는 ""한국은 데이터라는 4차 산업혁명 시대의 주권을 이미 외국에 넘겨주고 있는 것""이라며 ""우리 국민의 데이터를 해외 기업에 돈을 주고 사와야 하는 일이 곧 벌어질 수도 있다""고 말했다."
클라우드/빅데이터,"빅데이터 분석 속도 1천배 빨라진다
","기존 기술인 '패턴 마이닝'은 대형마트의 상품 구매, 은행의 거래, 네트워크 패킷, 소셜 네트워크 등 다양한 분야의 빅데이터에서 반복적으로 나타나는 중요 패턴들을 찾아냈다. 대형마트 진열대의 상품 위치를 결정하고, 연령별 소비자의 이용 패턴에 맞는 신용카드를 추천하는 등 산업 분야에서 광범위하게 사용돼왔다. 점차 증가하는 패턴 마이닝의 중요성으로 지난 20여년간 수천 가지의 패턴 마이닝 기술들이 개발됐다. 그러나 빅데이터 패턴의 길이가 증가하면서 분석 가능한 패턴의 가짓수가 기하급수적으로 늘어났다. 때문에 수십GB가 넘는 빅데이터에 대해서는 컴퓨터 메모리 부족으로 분석에 실패하거나 시간이 너무 많이 소요돼 사용하는데 한계가 있었다.","그래픽처리장치(GPU)를 이용해 기존보다 1천배 빠른 성능을 나타내는 빅데이터 분석 기술이 개발됐다.

?대구경북과학기술원(DGIST)은 김민수 정보통신융합전공 교수팀이 기존 기술인 패턴 마이닝보다 10배~1천배 더 우수한 ‘지마이너’ 기술을 개발했다고 28일 밝혔다.

기존 기술인 '패턴 마이닝'은 대형마트의 상품 구매, 은행의 거래, 네트워크 패킷, 소셜 네트워크 등 다양한 분야의 빅데이터에서 반복적으로 나타나는 중요 패턴들을 찾아냈다. 대형마트 진열대의 상품 위치를 결정하고, 연령별 소비자의 이용 패턴에 맞는 신용카드를 추천하는 등 산업 분야에서 광범위하게 사용돼왔다.

점차 증가하는 패턴 마이닝의 중요성으로 지난 20여년간 수천 가지의 패턴 마이닝 기술들이 개발됐다. 그러나 빅데이터 패턴의 길이가 증가하면서 분석 가능한 패턴의 가짓수가 기하급수적으로 늘어났다. 때문에 수십GB가 넘는 빅데이터에 대해서는 컴퓨터 메모리 부족으로 분석에 실패하거나 시간이 너무 많이 소요돼 사용하는데 한계가 있었다.

기존 패턴 마이닝 기술들은 중간 길이의 패턴들을 구한 후 메모리에 저장해두고, 중간 길이보다 더 긴 패턴을 구할 때 저장해 둔 중간 길이의 패턴과 대조해 최종 패턴을 찾는 방식을 활용했다.

?지마이너 기술은 이와 달리 그래픽처리장치(GPU)의 수천 개 코어를 사용해 임시로 계산한 중간 길이의 패턴들을 조합하고 최종 길이의 패턴을 구하는 기법을 제안, 기존 기술 문제를 근본적으로 해결하는데 성공했다.

지마이너 기술은 기하급수적 개수의 중간 길이 패턴들을 메모리에 전혀 저장하지 않음으로써 기존 기술들이 고질적으로 가졌던 메모리 부족 문제를 해결했다.

아울러, 데이터를 메인 메모리에서 GPU로 스트리밍하는 것과 동시에 GPU의 높은 계산 성능을 이용해 패턴을 구함에 따라 느린 속도 문제도 해결했다.

지마이너 기술 및 처리 절차 흐름도. 1) 입력 데이터로부터 길이가 n+1인 후보 패턴들을 생성하면 2)후보 패턴들을 GPU로 복사한다. 3)입력 데이터를 GPU의 장치 메모리를 통해 비동기 방식으로 스트리밍하고 4)스트리밍되는 입력 데이터에 대해 GPU의 계산 코어들을 이용, 중간 데이터 활용 없이 곧바로 후보 패턴의 적합성 여부를 테스트한다. 5)후보 패턴에 대한 부분 테스트 결과를 수집한 뒤 6)수집된 부분 테스트 결과를 메인 메모리를 통해 비동기 방식으로 스트리밍한다. 7)수집된 부분 테스트 결과를 취합, 최종 테스트 결과를 도출한다.
지마이너 기술 및 처리 절차 흐름도. 1) 입력 데이터로부터 길이가 n+1인 후보 패턴들을 생성하면 2)후보 패턴들을 GPU로 복사한다. 3)입력 데이터를 GPU의 장치 메모리를 통해 비동기 방식으로 스트리밍하고 4)스트리밍되는 입력 데이터에 대해 GPU의 계산 코어들을 이용, 중간 데이터 활용 없이 곧바로 후보 패턴의 적합성 여부를 테스트한다. 5)후보 패턴에 대한 부분 테스트 결과를 수집한 뒤 6)수집된 부분 테스트 결과를 메인 메모리를 통해 비동기 방식으로 스트리밍한다. 7)수집된 부분 테스트 결과를 취합, 최종 테스트 결과를 도출한다.

?

이를 통해, GPU 한 개가 장착된 일반 가정용 컴퓨터 1대만으로 최대 수십 대의 컴퓨터를 사용해 데이터를 분석했던 기존의 분산·병렬 기술보다 작게는 10배에서 최대 1천배 빠른 분석 성능을 나타냈다. 기존 기술들이 분석 가능했던 데이터보다 더 큰 규모의 빅데이터를 분석할 수 있다. 또 GPU 개수와 비례해 성능이 향상되는 우수한 확장 성능을 나타낸다.

?

김민수 DGIST 정보통신융합전공 교수는 “다양한 산업 분야에서 축적되고 있는 빅데이터에 대해 메모리 문제 없이 초고속으로 빅데이터 패턴을 분석할 수 있는 원천 기술을 확보했다”며 “메모리 부족과 느린 속도라는 기술적 한계를 해결해 금융, 유통, IT, 바이오 등 여러 분야의 빅데이터 패턴을 분석해 기업의 효율적인 의사결정을 돕는데 활용할 수 있을 것”이라고 말했다.

?

이번 연구 결과는 정보과학 분야 국제 학술지 ‘인포메이션 사이언스' 5월호에 게재됐다. 전강욱 DGIST 정보통신융합전공 박사과정 학생이 제1저자로 참여했다."
클라우드/빅데이터,"더존비즈온, 기업 재무자료 빅데이터 연구 시작
","더존비즈온은 포항공과대학교 황형주 교수팀이 이끄는 포스텍 수리응용센터와 함께 ‘빅데이터 분석을 통한 인공지능 기업 신용평가모형 개발 연구’를 시작했다고 1일 밝혔다. 황형주 교수는 빅데이터 분석, 딥러닝, 머신러닝 등 인공지능과 관련된 다양한 프로젝트를 수행한 경험이 있는 이 분야 전문가다. 이번 연구는 더존비즈온이 가진 기업 세무, 회계 분야의 경험치와 포항공과대학교의 인공지능 연구 역량을 결합해 실제 산업 현장에 적용할 수 있는 시장 발전적 모델을 찾기 위해 진행된다.","더존비즈온은 포항공과대학교 황형주 교수팀이 이끄는 포스텍 수리응용센터와 함께 ‘빅데이터 분석을 통한 인공지능 기업 신용평가모형 개발 연구’를 시작했다고 1일 밝혔다.

?

황형주 교수는 빅데이터 분석, 딥러닝, 머신러닝 등 인공지능과 관련된 다양한 프로젝트를 수행한 경험이 있는 이 분야 전문가다.

?

이번 연구는 더존비즈온이 가진 기업 세무, 회계 분야의 경험치와 포항공과대학교의 인공지능 연구 역량을 결합해 실제 산업 현장에 적용할 수 있는 시장 발전적 모델을 찾기 위해 진행된다.


?

그동안 금융시스템 지원에서 소외됐던 중소기업의 정보비대칭 문제를 해결하고 이들의 금융 환경을 개선하는 것을 목표로 하고 있다.

?

연구가 완료되면 더존비즈온의 재무자료 빅데이터를 활용해 기존 신용평가 제도로 측정하기 힘들었던 일정 규모 이하 중소기업의 자가 경영진단이 가능해질 것으로 기대된다.

?

이를 기업 대출 등 금융권 심사과정에 적용할 경우, 1금융권 접근성이 낮았던 중소기업이 단순 재무제표 위주의 정량적 정보뿐 아니라 다양한 정성적 자료로 평가받을 수 있어 기업 신용평가에서 정보비대칭 문제를 개선할 수 있다.

?

또한, 소규모 기업을 대상으로 한 객관적 신용 측정 방법이 개발되기 때문에 기업의 재무현황, 경영 상태 진단, 부실 징후를 실시간 예측 가능할 것으로 보인다. 이를 통해 중소기업 등 위기 대응 역량이 부족한 기업들도 스스로 경영환경을 검증할 수 있고, 나아가 거래 상대 기업의 안정성과 신뢰도를 참조해 사전에 리스크를 줄일 수 있게 된다.

?

연구 결과가 보다 객관적이고 신뢰할 수 있는 새로운 기업 신용평가 모형으로 자리 잡을 경우, 향후 금융권에서도 이를 활용해 소규모 기업 지원을 원활히 하고 발생 가능한 부실에 빠르게 대응할 수 있을 것으로 기대된다.

?

더존비즈온 관계자는 “이번 연구는 기업 재무자료와 관련된 수많은 빅데이터 중 시장에 적용할 수 있는 실제 사례를 발굴하기 위한 첫 사례란 점에서 의미가 있다""며 “더존비즈온은 이번 연구를 시작으로 기업 세무, 회계 분야에서 쌓아 온 전문성과 그동안 축적된 빅데이터 응용기술을 활용해 4차 산업혁명 시대에 필요한 핵심 ICT 기술을 꾸준히 연구개발해 나갈 것”이라고 말했다."
클라우드/빅데이터,"펜타시스템, 한국고용정보원 빅데이터 분석사업 수주
","펜타시스템테크놀러지는 앞으로 9개월간 '고용보험 부정수급 빅데이터 분석 플랫폼 구축', '빅데이터 분석 및 예측모델 개발', '빅데이터 포털시스템 구축', '수사관리시스템구축 및 운영관리' 등 업무영역 개발과 구축을 수행한다. 한국고용정보원은 해당 인프라를 구축하고 분석 모델을 실업급여, 모성보호, 고용안정, 직업능력 업무까지 확대한다. 수사관리시스템을 구축해 수사업무 관리체계도 마련할 예정이다. 사업을 통해 고용보험 부정수급 적발 정확성과 수사효율을 높일 것으로 기대했다.","펜타시스템테크놀러지(대표 장종준)는 한국고용정보원 '부정수급 분석시스템 및 수사관리시스템 구축사업'을 수주했다고 28일 밝혔다.

?

펜타시스템테크놀러지는 앞으로 9개월간 '고용보험 부정수급 빅데이터 분석 플랫폼 구축', '빅데이터 분석 및 예측모델 개발', '빅데이터 포털시스템 구축', '수사관리시스템구축 및 운영관리' 등 업무영역 개발과 구축을 수행한다.

?

한국고용정보원은 해당 인프라를 구축하고 분석 모델을 실업급여, 모성보호, 고용안정, 직업능력 업무까지 확대한다. 수사관리시스템을 구축해 수사업무 관리체계도 마련할 예정이다. 사업을 통해 고용보험 부정수급 적발 정확성과 수사효율을 높일 것으로 기대했다.

?

펜타시스템테크놀러지는 앞서 올초 국가정보자원관리원 '빅데이터분야 우수기술지원기업'으로 선정돼 행정안전부 장관 표장을 받았다. 공공 빅데이터 분석 및 표준분석모델 구축 사업 활용을 위한 교육 등 ICT분야 기여 공로로 한국정보화진흥원 감사패도 받았다.

?

장종준 펜타시스템테크놀러지 대표는 ""빅데이터 인프라 구축에서 분석수행 및 활용까지 포괄적 서비스를 제공하는 사업수행 능력을 인정받고 있다""며 ""빅데이터 사업을 시작한 지난 5년 동안 약 40여개의 인프라 구축 및 분석 프로젝트를 수행했다""고 말했다."
클라우드/빅데이터,"규모 경쟁 치열··· 주요 클라우드 업체, 데이터센터에 투자
","클라우드 업체의 초대형 설비투자는 740억 달러에 달했던 2017년이 끝나고 새로 시작된 첫 분기에 이 같은 대규모 투자가 이어진 것이다. 시지에 따르면, 이 초고용량 설비투자의 대부분은 현재 420개 이상으로 증가한 데이터센터를 구축하고 확장하는 방향으로 나아가고 있다. 현재 클라우드 인프라 투자를 주도하는 5대 업체로는 구글, 마이크로소프트, 아마존 웹 서비스(AWS), 애플, 페이스북이며, 매 분기 상대적 순위가 상승하고 있다. 이들 업체의 초대형 설비투자는 전체 시장의 70% 이상을 차지한다. 시너지 리서치 그룹은 3월로 마감한 1분기에 5위 안에 드는 4개 업체의 설비 투자 수준이 사상 최고치에 달했다고 밝혔다. 여기에는 구글의 대형 원오프(one-off) 아이템도 포함된다. 시너지 리서치 그룹의 수석 애널리스트이자 연구 책임자인 존 딘스데일은 ""2017년에 초대형 규모의 설비투자가 두드러졌는데 2018년의 출발은 그 엄청난 숫자로 시작됐다”며 ""우리는 시장을 분기별로 모니터링해 클라우드 서비스, SaaS, 데이터센터의 과도한 규모 및 퍼블릭 클라우드 데이터센터 하드웨어에 대한 지속적인 투자를 꾸준히 목격했지만 올 1분기 설비투자 수치는 우리를 놀라게 했다”고 말했다.","시너지 리서치 그룹(Synergy Research Group)에 따르면 글로벌 초대형 클라우드 공급 업체들이 올 3월 말까지 3개월 동안 최소 270억 달러의 카펙스(자본투자)를 집행했으며 이는 전년 동기 대비 80% 이상 늘어난 것으로 집계됐다.

시너지 리서치 그룹의 최신 자료에 따르면 세계 최대 규모의 클라우드 공급 업체가 새로운 데이터센터 자산에 대한 투자를 늘리고 있으며 상위 업체 간의 규모 경쟁이 치열해지고 있다.

클라우드 업체의 초대형 설비투자는 740억 달러에 달했던 2017년이 끝나고 새로 시작된 첫 분기에 이 같은 대규모 투자가 이어진 것이다. 시지에 따르면, 이 초고용량 설비투자의 대부분은 현재 420개 이상으로 증가한 데이터센터를 구축하고 확장하는 방향으로 나아가고 있다.

현재 클라우드 인프라 투자를 주도하는 5대 업체로는 구글, 마이크로소프트, 아마존 웹 서비스(AWS), 애플, 페이스북이며, 매 분기 상대적 순위가 상승하고 있다. 이들 업체의 초대형 설비투자는 전체 시장의 70% 이상을 차지한다.

시너지 리서치 그룹은 3월로 마감한 1분기에 5위 안에 드는 4개 업체의 설비 투자 수준이 사상 최고치에 달했다고 밝혔다. 여기에는 구글의 대형 원오프(one-off) 아이템도 포함된다.

시너지 리서치 그룹의 수석 애널리스트이자 연구 책임자인 존 딘스데일은 ""2017년에 초대형 규모의 설비투자가 두드러졌는데 2018년의 출발은 그 엄청난 숫자로 시작됐다”며 ""우리는 시장을 분기별로 모니터링해 클라우드 서비스, SaaS, 데이터센터의 과도한 규모 및 퍼블릭 클라우드 데이터센터 하드웨어에 대한 지속적인 투자를 꾸준히 목격했지만 올 1분기 설비투자 수치는 우리를 놀라게 했다”고 말했다.

그는 ""오랫동안 클라우드 시장은 규모의 경제로 들어섰다. 여기 명백한 증거가 있다""고 덧붙였다.

시너지 리서치는 전세계 주요 클라우드 및 인터넷 서비스 업체 24곳의 설비투자와 데이터센터 면적 분석을 기반으로 한다. 여기에는 가장 큰 IaaS, PaaS, SaaS 제공업체와 소셜 네트워킹 및 전자 상거래 회사가 포함된다.

시너지 리서치가 이번 분기에 확인한 다른 초대형 지출원은 알리바바, IBM, JD닷컴(JD.com), NTT, 텐센트가 있으며 이들은 모두 시너지 리서치 보고서에서 상위 10위 안에 들었다.

그다음 순위에는 바이두, 이베이, 오라클, 페이팔, 세일즈포스, SAP, 야후재팬, 야후/오쓰(Oath) 등이 이름을 올렸다"
클라우드/빅데이터,"아크로니스, “클라우드 데이터 보호하는 데이터 클라우드 플랫폼 사업 고속 성장” 
","아크로니스 클라우드 스토리지 기반의 데이터 보호 디바이스의 수량은 지난해에 비해 200% 증가했으며, 기업 고객들의 숫자는 지난해에 비해 151% 증가했다. 아크로니스는 지난해 전세계 서비스 공급업체 2,000여 곳과 새롭게 협력관계를 맺었으며, 아크로니스 데이터 클라우드(www.acronis.com/en-us/cloud/service-provider/platform/) 플랫폼을 사용해 백업, 재해복구, 파일 공유 및 동기화 서비스를 제공하고 있다.","아크로니스(www.acronis.co.kr/)는 자사의 클라우드 스토리지 사용량이 39PB(페타바이트)를 돌파하는 등 클라우드 기반 스토리지, 백업, 재해 복구 서비스 비즈니스가 고속 성장하고 있다고 밝혔다.

아크로니스 클라우드 스토리지 기반의 데이터 보호 디바이스의 수량은 지난해에 비해 200% 증가했으며, 기업 고객들의 숫자는 지난해에 비해 151% 증가했다.

아크로니스는 지난해 전세계 서비스 공급업체 2,000여 곳과 새롭게 협력관계를 맺었으며, 아크로니스 데이터 클라우드(www.acronis.com/en-us/cloud/service-provider/platform/) 플랫폼을 사용해 백업, 재해복구, 파일 공유 및 동기화 서비스를 제공하고 있다.



아크로니스 데이터 클라우드 플랫폼은 의무 사용 기간이 없는 무료 체험판이 제공되며, 싱글 설치와 멀티-테넌트/멀티-티어 아키텍처, PSA 및 RMM 툴과의 네이티브 통합을 지원함으로써, 서비스 공급업체들이 보다 효과적이고 비용 효율적인 데이터 보호 솔루션을 활용할 수 있도록 돕는다.

서비스 공급업체들은 아크로니스 플랫폼의 이러한 장점을 활용해 합리적인 비용 내에서 손쉽게 기존 시스템을 교체할 수 있다고 업체 측은 설명했다. 이를 통해 최종 서비스 사용자들에게 고유의 니즈에 맞춤화 된 새로운 기능을 제공할 수 있다.

또한 선 투자 비용이 없고, 유연한 라이선스 모델과 아크로니스 호스팅, 하이브리드, 서비스 공급업체 호스팅 등 다양한 구축 모델을 제공함으로써 기존의 서비스 딜리버리 모델을 방해하지 않고 기존 인프라에 간편하게 적용할 수 있다.

또한 서비스 공급업체들은 아크로니스 데이터 클라우드를 기반으로 상향판매(upsell)가 용이하고, 적용이 간편한 데이터 보호 서비스를 공급할 수 있어, 새로운 시장에 진출하고, 신규 수익원을 발굴하는 한편 고객 만족도를 높이고, 이탈율을 낮출 수 있다.

이와 함께 퍼블릭 클라우드 워크로드를 보호하고자 하는 수요가 높아지고 있는 상황에서, 아크로니스는 마이크로소프트 오피스 365 메일함 보호 건수를 기준으로 1,000%의 성장률을 기록했다.

아크로니스의 존 자니 사장은 “아크로니스의 최근 투자는 하이브리드 클라우드 아키텍처에 강력한 이점을 제공하는데 집중돼 있다”며, “특히, 서비스 공급업체 고객들은 아크로니스 데이터 클라우드 플랫폼을 활용해 매출을 높이고, 비즈니스 혁신을 도모할 수 있고 앞으로도 업계의 동반 성장을 위해 연구 개발을 지속할 계획”이라고 말했다"
