category,title,body,origin
인터넷전문은행,"인터넷전문은행 자본금 늘리기 ""어렵다 어려워""
",케이뱅크는 지난 30일 출범 후 두 번째로 1500억원 규모 유상증자를 결의했다. 지난 8월 1000억원 유상증자 후 9개월만이다. 주금납입일은 오는 7월 12일로 넉넉하게 잡았다. 이번 유상증자가 성공적으로 마무리된다면 케이뱅크는 지난해 4월 출범 후 1년 3개월만에 자본금 규모가 5000억원으로 늘어나게 된다. 하지만 이번 증자가 계획대로 완료된다고 해도 출범 초부터 1조원 자본금 규모를 채우기에는 아직도 갈 길이 멀기만 하다.,"인터넷전문은행들이 자본금을 어렵게 늘려가고 있다. 각각 2500억원과 3000억원으로 은행으로는 작은 자본금으로 영업을 시작한 케이뱅크와 카카오뱅크는 각각 출범 1년 1개월과 9개월만에 두차례에 걸친 유상증자를 실시했다. 

 

은산분리 규제의 족쇄가 풀리지 않은 상태에서 주주들을 설득해가며 유상증자를 단행했지만 과정은 힘겹기만 하다. 결국 두번째 유상증자에서는 양사 모두 은산분리 규정 적용을 받지 않는 우선주 카드를 꺼내들었다. 최근 은산분리 규제 완화는 산업자본에 대한 특혜라는 시각 속에 논의조차 수면 아래로 가라앉은 모습이다.    

 

케이뱅크는 지난 30일 출범 후 두 번째로 1500억원 규모 유상증자를 결의했다. 지난 8월 1000억원 유상증자 후 9개월만이다. 주금납입일은 오는 7월 12일로 넉넉하게 잡았다. 이번 유상증자가 성공적으로 마무리된다면 케이뱅크는 지난해 4월 출범 후 1년 3개월만에 자본금 규모가 5000억원으로 늘어나게 된다. 하지만 이번 증자가 계획대로 완료된다고 해도 출범 초부터 1조원 자본금 규모를 채우기에는 아직도 갈 길이 멀기만 하다.

 

케이뱅크는 출범 초부터 빠른 시일 내에 1조원 규모의 자본금을 확충해 상품을 다양화하겠다는 계획을 세웠다. 하지만 출범 1년이 지난 시점에서 오는 7월 유상증자가 성공적으로 완료된다는 가정 아래 목표치 절반을 채우게 되는 셈이다.

 

케이뱅크는 지난해 8월 유상증자하는 과정에서도 일부 주주들이 이탈해 새로운 주주를 영입해야 했다. 이번 유상증자는 원래 지난해말이나 올해 초에 단행할 예정이었지만 결정하는데만 5개월 가량이 지연됐다.

 

카카오뱅크는 그나마 상황이 나은 편이다. 카카오뱅크도 지난달까지 총 두차례에 걸쳐 증자를 완료해 자본금을 1조3000억원 규모로 늘렸다. 지난해 9월 5000억원, 올해 4월 5000억원 등 자본금을 확충했다. 

 

그러나 카카오뱅크도 두번째 유상증자는 은산분리 규제를 받지 않는 우선주를 발행하는 등 만일의 사태에 대비해야 했다. 케이뱅크도 이번에 새로 발행하는 3000만주 중 600만주는 전환주다. 카카오가 실권주를 인수하기 편하도록 안전장치를 한 셈이다. 은산분리 규정에서 산업자본은 의결권있는 보통주의 경우 10% 이상을 소유하지 못하도록 했다.

 

한국투자금융지주는 두번째 유상증자에서 보통주는 지분율 58%만큼 참여했지만 우선주는 총 6000만주(3000억원) 중 1400만주만 인수했다. 이에 따라 한국투자금융지주 지분율은 보통주 기준으로는 58% 지분율을 그대로 유지했지만 보통주와 우선주를 포함한 주식에 대해서는 50%로 낮아졌다.

 

인터넷전문은행이 자본금 확충에 어려움을 겪고 이에 따라 공격적인 영업이 어려워지면서 당초 메기 역할을 하리라던 기대도 점차 시들해지는 분위기다. 

 

한 시중은행 관계자는 “출범 초기에는 고객 수도 큰 폭으로 증가하는 등 관심을 끌었지만 최근에는 별 차별점을 느끼지 못한다”며 “관심은 많이 사라진 분위기”라고 전했다. 

 

인터넷전문은행이 주주사인 KT와 카카오 등 IT업체 주도 아래 은행업 혁신을 가져올 것이라고 예측했지만 자본금 한계 속에 메기 역할도 초반 돌풍에만 그친 것이 아니냐는 평가다. "
인터넷전문은행,"케이뱅크, 한달만에 가산금리 올린 이유
","케이뱅크는 금리 상승분은 신규 대출자가 아닌 기간연장 시에만 적용되는 금리라고 설명합니다. 은행들은 신용대출 만기가 끝나기 전 기간 연장 여부를 결정할 때 대출자에 대한 신용평가를 다시 진행합니다. 신용도 변화를 평가, 판단하기 위해서죠. 이 과정에서 신용도가 악화되면 가산금리가 올라갑니다.","인터넷전문은행 1호 케이뱅크가 최근 개인사업자들을 대상으로 신용대출을 내어주는 일반가계신용대출 가산금리를 올렸습니다. 가산금리 상단을 연 5.43%에서 연 6.58%까지 올린 건데요. 무려 1%포인트나 올린 이유 궁금하시죠?

케이뱅크는 금리 상승분은 신규 대출자가 아닌 기간연장 시에만 적용되는 금리라고 설명합니다. 은행들은 신용대출 만기가 끝나기 전 기간 연장 여부를 결정할 때 대출자에 대한 신용평가를 다시 진행합니다. 신용도 변화를 평가, 판단하기 위해서죠. 이 과정에서 신용도가 악화되면 가산금리가 올라갑니다.

케이뱅크는 기존 대출자 가운데 기간 연장을 신청한 대출자의 신용도가 악화된 경우 연 5.43~6.58%의 가산금리를 적용하겠다는 것이죠. 지난해 9월 출시한 이 상품은 한도대출의 경우 만기가 1년이고 최장 5년까지 연장이 가능합니다. 오는 9월 만기가 돌아오는 고객들이 이를 인지하고 있도록 미리 공지했다는 겁니다.

최근 들어 케이뱅크의 가산금리 조정은 잦습니다. 이 상품도 한달 전 가산금리를 연 2.40~5.68%에서 연 2.10~5.43%로 낮췄는데요. 한달만에 상단을 다시 올린 거죠. 얼마 전에는 직장인K 마이너스통장 가산금리를 낮춘 지 2주만에 다시 올리기도 했습니다.
케이뱅크가 출시된 지 1년의 시간이 흘렀죠. 금리도 1년간 한 사이클을 돌았습니다. 대출에 미치는 각종 요인들이 무엇이 있는지 파악했고, 1년 만기 대출의 상환 시점이 돌아옵니다. 그로 인한 변화들이 서비스를 이용하는 대출자들에게 불편함과 부담으로 다가가선 안될 것입니다."
인터넷전문은행,"‘금융 메기’라던 케뱅, 시중銀 자회사 전락 위기
","케이뱅크는 생존을 위한 방안으로 카카오뱅크 모델을 선택한 것으로 알려졌다. 비금융주력자인 산업 자본과는 달리, 금융주력자는 무제한 자금 투입이 가능하다는 점을 활용해 숨통을 열겠다는 계산인 것이다. 케이뱅크의 한 주주사 관계자는 “케이뱅크가 주요 주주(13.79%)인 우리은행은 물론, 지방은행 쪽에 지분 50%를 확보해 최대주주가 되는 안을 제시해 협상 중인 것으로 안다”고 밝혔다. 현재 협상이 진행 중인 지방은행은 DGB대구은행과 BNK금융지주인 것으로 전해졌다. 만약 이 같은 케이뱅크의 복안이 계획대로 성공한다면 자금력은 대폭 확충될 전망이다. 그러나 인터넷전문은행 1호 기업이 사실상 시중 은행의 자회사로 전락하는 모양새가 된다. 한 대형 은행 관계자는 “인터넷전문은행 도입 초기 은행들이 긴장했던 것이 사실”이라며 “이제는 은행을 위협할 것으로 보는 시각은 없다”고 말했다. ","인터넷전문은행에 대한 은산분리(산업 자본의 은행 자본 소유 제한) 규제 예외법안이 국회에서 장기 계류 중인 가운데, 인터넷전문은행 1호인 케이뱅크가 시중 은행에 지분 50%를 넘기는 안을 검토 중인 것으로 확인됐다. 이는 금융주력자인 한국투자금융지주에게 지분 50% 이상을 넘겨 기존 금융사의 자회사가 된 카카오뱅크 모델을 따라가는 것으로, 자금력 동원 한계를 돌파하기 위한 자구책으로 해석된다. 이에 따라 정보기술(IT) 기업이 제공하는 금융서비스에 초점을 맞춘 핀테크(금융+기술)의 총아로 주목받던 인터넷은행의 설립 취지가 퇴색돼버렸다는 지적도 나온다.

30일 금융권에 따르면 케이뱅크는 이날 본사에서 이사회를 열고 유상증자안을 논의했다. 금융권 관계자는 “구주주를 대상으로 1500억 원 이상을 증자하는 안”이라고 밝혔다. 케이뱅크는 지난해 9월 1차 유상증자에 나선 바 있는데 1년도 안 돼 다시 대규모 증자에 나선 것이다.

케이뱅크는 지난해 3월 출범 이후 기대 이상의 가파른 성장세를 보여왔다. 지난달 기준으로 여신은 1조700억 원, 수신은 1조4400억 원에 달했고 고객 수는 73만 명이었다. 고객 수가 급증하면서 자금 확보의 필요성도 예상보다 커진 것이다.

시중 은행과 경쟁을 붙여 서민들에게 비교적 낮은 금리의 대출을 제공한다는 이른바 ‘메기 효과’에 대한 기대감과 제4차 산업혁명의 핀테크 시대에 전 세계 금융권 흐름에 역행할 수 없다는 고민에 따라 문호를 연 금융위원회도 은산분리 예외 법안의 국회 통과를 추진해왔다. 그러나 오히려 더불어민주당 등 여권에서 틀어막자 국회 논의는 사실상 중단된 상태다. 은행법에 따르면 산업자본의 은행 지분율은 10%(의결권 있는 지분 4%)로 제한된다.

이에 따라 케이뱅크는 생존을 위한 방안으로 카카오뱅크 모델을 선택한 것으로 알려졌다. 비금융주력자인 산업 자본과는 달리, 금융주력자는 무제한 자금 투입이 가능하다는 점을 활용해 숨통을 열겠다는 계산인 것이다. 케이뱅크의 한 주주사 관계자는 “케이뱅크가 주요 주주(13.79%)인 우리은행은 물론, 지방은행 쪽에 지분 50%를 확보해 최대주주가 되는 안을 제시해 협상 중인 것으로 안다”고 밝혔다. 현재 협상이 진행 중인 지방은행은 DGB대구은행과 BNK금융지주인 것으로 전해졌다. 만약 이 같은 케이뱅크의 복안이 계획대로 성공한다면 자금력은 대폭 확충될 전망이다. 그러나 인터넷전문은행 1호 기업이 사실상 시중 은행의 자회사로 전락하는 모양새가 된다. 한 대형 은행 관계자는 “인터넷전문은행 도입 초기 은행들이 긴장했던 것이 사실”이라며 “이제는 은행을 위협할 것으로 보는 시각은 없다”고 말했다. 
"
인터넷전문은행,"은산분리 규제 발목에 케이뱅크 '주주 교체' 추진
","가장 좋은 시나리오는 우리은행이 지분율을 늘려 한투와 같은 역할을 하는 것이지만 우리은행은 당장 지주회사 전환 이슈에다가 국정감사에서의 특혜 논란에 대한 부담, 이광구 전 은행장이 추진했던 사안이라는 점 등을 감안할 때 난감해하는 입장이다. 우리은행 관계자는 “현재로서는 주주로서 책임감 있게 지분율만큼만 참여하겠다는 입장”이라고 말했다.","은산분리(산업자본의 은행 소유 금지) 완화가 현 정부에서 사실상 불가능하다고 판단한 인터넷전문은행 케이뱅크가 카카오뱅크와 같은 금융주력자 모델로 전환을 추진한다. 산업자본인 KT가 대주주 자리를 내놓겠다는 의미다. 하지만 현재 주주로 참여하는 우리은행뿐 아니라 지방금융사도 지분 취득을 주저하고 있어 성장에 있어 한계에 직면할 수 있다는 위기감도 강하다.

30일 금융권에 따르면 케이뱅크의 주요 주주인 KT는 이날 이사회에서 의결한 유상증자 외에 추가 자본 투입이 어렵다고 판단, 금융권에서 50% 이상의 지분을 차지할 금융주력자를 끌어들이는 방안을 타진하고 있다. 케이뱅크와 관련된 금융권 관계자는 “현재로서는 KT도 증자에 한계가 있다고 판단했다”며 “기존 주주들도 은산분리 규제가 완화되는 전제로 컨소시엄에 들어왔는데 지금 상태로는 추가 자본 투입은 이번이 마지막일 것”이라고 밝혔다.

케이뱅크는 이날 이사회를 열어 1,500억원 규모로 유상증자를 하기로 결의했다. ★본지 5월30일자 10면 참조. 일부 주주사가 불참할 경우 실권주를 주요 주주사가 인수하기 위해 신주 발행에는 전환주도 포함됐다. KT(10%), 우리은행(13.79%), NH투자증권(10%) 등 주요 주주들은 이번 증자에는 지분율만큼 참여하는 것으로 의견을 모았다. 만약 실권주가 발생한다면 새로운 백기사가 나타날 가능성도 있다. 금융권 관계자는 “국회에서 장기간 계류 중으로 사실상 물 건너간 은산분리 문제로 인해 KT가 추가 자본 투입에 한계가 있다 보니 자본력 동원을 위한 대안을 찾게 된 것”이라며 “구조적인 문제가 인터넷전문은행을 기형화시켰다”고 강조했다.

케이뱅크는 이번에 마련되는 실탄으로 기존 상품을 재정비하고 비대면 아파트담보대출 같은 신규 상품도 출시할 방침이다. 다만 자본금 5,000억원으로는 공격적인 영업을 하기 힘들고 1조~2조원까지 늘려야 한다고 주주사들은 판단하고 있어 추가 증자가 불가피하다. 게다가 20여개에 달하는 주주 구성으로 인해 증자 때마다 번번이 삐걱대면서 한국투자금융지주가 58%의 지분으로 받쳐주는 카카오뱅크의 모델을 따르려는 것이다.

지난해 3월 출범한 케이뱅크는 지난달 기준 고객 수 73만명, 여신 1조700억원, 수신 1조4,400억원으로 지난해 7월 시작한 카카오뱅크(고객 585만명, 여신 6조1,800억원, 수신 7조6,000억원)에 비해 크게 뒤떨어지고 있다. 카카오뱅크는 두 차례의 유상증자를 원활하게 마치면서 자본금을 1조3,000억원까지 확충했다.

가장 좋은 시나리오는 우리은행이 지분율을 늘려 한투와 같은 역할을 하는 것이지만 우리은행은 당장 지주회사 전환 이슈에다가 국정감사에서의 특혜 논란에 대한 부담, 이광구 전 은행장이 추진했던 사안이라는 점 등을 감안할 때 난감해하는 입장이다. 우리은행 관계자는 “현재로서는 주주로서 책임감 있게 지분율만큼만 참여하겠다는 입장”이라고 말했다.

이에 따라 BNK금융과 DGB금융 같은 지방 금융사들과도 접촉했지만 뾰족한 답이 나오지 않는 상태다. 지방은행들은 새 활로를 찾는 측면에서 관심을 가질 수는 있으나 영업 범주가 제한되고 규모가 작다는 점, 인터넷전문은행의 대주주로서의 역할에 대한 다른 주주들의 의견뿐 아니라 금융당국과의 교감도 있어야 하는 점이 관건이다. 이와 관련, 김지완 BNK 회장은 기자와의 통화에서 “내실을 다지는 데 주력할 때여서 아무것도 검토하지 말라고 했다”고 밝혔다. DGB금융 관계자도 “아직 확정된 사안은 아무것도 없다”고 말했다. 채용비리와 비자금 논란으로 어수선한 DGB금융은 차기 회장과 대구은행장이 다음달 취임해 당분간은 내부 조직을 다지는 데 주력할 수밖에 없는 상황이다.

이 같은 상황에 대해 케이뱅크 관계자는 “은산분리는 안 풀리고 자본은 있어야 하는 구조적 문제에 따라 중장기적으로 다양한 방안을 모색 중”이라고 설명했다."
인터넷전문은행,"1년 만에 사그라든 인터넷銀 돌풍… 은행산업 비중 1%에도 못미쳐
"," 케이뱅크(K뱅크)와 카카오뱅크의 지난달 말 기준 고객 수는 658만 명으로 한 달간 3.1% 증가하는 데 그쳤다. 두 인터넷은행의 고객 수 증가율은 지난해 10월까지만 하더라도 두 자릿수를 이어갔지만, 11월 한 자릿수로 떨어졌으며 올 3월부터는 3%대에 그쳤다. 수신과 여신도 마찬가지다. 지난달 말 두 인터넷은행의 수신잔액은 8조9400억원으로 6.1% 증가에 머물렀으며, 여신잔액은 7조2500억원으로 5.2% 증가에 그쳤다. 지난달 여신 증가율은 국민 신한 KEB하나 우리 등 4대 시중은행의 모바일·인터넷뱅킹(6.2%)보다도 저조하다. 두 인터넷은행이 국내 은행 전체에서 차지하는 비중은 3월 말 기준 수신은 0.49%, 여신은 0.45%에 불과하다.","인터넷전문은행의 돌풍이 1년 만에 사그라들고 있다. 가입자, 예·적금, 대출 등 주요 지표의 증가율이 일제히 둔화하고 있다. 특히 여신 증가율은 인터넷은행이 시중은행의 디지털뱅킹 채널에도 역전당했다. 금융계에선 인터넷은행 사업모델인 비대면 영업이 한계에 달한 데다 은산분리 규제가 지속되면서 혁신을 추진하지 못한 결과로 보고 있다.

28일 은행업계에 따르면 국내 1·2호 인터넷은행인 케이뱅크(K뱅크)와 카카오뱅크의 지난달 말 기준 고객 수는 658만 명으로 한 달간 3.1% 증가하는 데 그쳤다. 두 인터넷은행의 고객 수 증가율은 지난해 10월까지만 하더라도 두 자릿수를 이어갔지만, 11월 한 자릿수로 떨어졌으며 올 3월부터는 3%대에 그쳤다.

수신과 여신도 마찬가지다. 지난달 말 두 인터넷은행의 수신잔액은 8조9400억원으로 6.1% 증가에 머물렀으며, 여신잔액은 7조2500억원으로 5.2% 증가에 그쳤다. 지난달 여신 증가율은 국민 신한 KEB하나 우리 등 4대 시중은행의 모바일·인터넷뱅킹(6.2%)보다도 저조하다. 두 인터넷은행이 국내 은행 전체에서 차지하는 비중은 3월 말 기준 수신은 0.49%, 여신은 0.45%에 불과하다.

K뱅크가 출범한 지난해 4월, 카카오뱅크가 영업을 시작한 지난해 7월 등 초기만 하더라도 두 은행은 은행산업에서 ‘메기’ 역할을 할 것으로 기대됐다. 하지만 기존 은행에 자극을 준 것은 초반 잠깐에 그쳤다는 평가를 받고 있다. 한 시중은행장은 “특히 국민 메신저인 카카오톡을 배경으로 두고 있는 카카오뱅크에 주목했지만 이제 더 이상 위협으로 느끼지 않는다”고 말했다.
인터넷전문은행 또 생긴다… 20년 묵은 금융 진입규제 혁파
전문가들은 인터넷은행이 한계에 일찍 봉착한 이유를 크게 네 가지로 꼽고 있다. 먼저 인터넷은행의 고객층은 20~30대 젊은 층이 대다수다. 가입자가 600만 명을 넘다 보니 이제 더 이상 가입할 젊은 층이 없다는 얘기다. 둘째는 비대면 영업의 한계다. 대출의 절반가량을 차지하는 기업은 대부분 인터넷은행과 거래하지 않는다. 가계대출의 70%를 차지하는 주택담보대출도 아직 취급하지 못하고 있다.

셋째, 인터넷은행이 시중은행 디지털뱅킹과의 차별화에 실패했다는 점이다. 성태윤 연세대 경제학과 교수는 “인터넷은행의 상품 및 서비스가 기존 은행의 비대면 채널에 비해 크게 혁신적이지 않다”며 “현재와 같은 방식으로는 은행 고객을 끌어오는 데 한계가 있을 수밖에 없다”고 분석했다.

넷째, 지지부진한 은산분리 규제 완화다. 은산분리란 산업자본이 은행을 지배하지 못하도록 하는 게 핵심이다. 금융당국은 금융분야를 혁신하기 위해 인터넷은행엔 이 규제를 완화하는 방안을 추진하기로 했다. 하지만 문재인 정부가 들어서면서 이는 없던 일이 돼 버렸다.

오정근 건국대 금융IT학과 교수는 “인터넷은행도 국제결제은행(BIS) 기준 자기자본비율을 10% 이상 유지해야 한다”며 “현재 인터넷은행은 충분한 자본 확보가 안 돼 공격적으로 대출을 늘리기 힘들다”고 지적했다."
인터넷전문은행,"카카오뱅크, ATM 수수료 면제 6월까지…""연장 검토 중""
","그러나 현재까지 국내 모든 은행과 편의점, 지철 ATM 수수료를 무료로 제공하고 있는 카카오뱅크는 해당 서비스를 오는 30일까지만 시행할 예정이다. 사실 카카오뱅크의 수수료 무료 정책은 지난해 12월까지였다. 고객들의 성원에 힘입어 서비스 기간을 6개월 더 연장한 것이다.","평소 카카오뱅크 체크카드로 ATM(현금자동입출금기)을 이용해온 고객이라면 아래 내용에 주목해야겠다.

1일 카카오뱅크 홈페이지에 따르면 카카오뱅크의 ATM 수수료 면제 서비스가 6월 말까지만 적용된다. 

앞서 2017년 7월 27일 카카오뱅크는 귀여운 카드 디자인과 함께 높은 예금 금리, 문턱 낮은 대출 조건 등 파격적인 서비스로 수많은 사람들의 관심 속에 출범했다. 

특히 500원, 1000원 등 야금야금 올라가는 수수료에 많은 부담을 느낀 고객들은 ATM 수수료 면제에 큰 매력을 느꼈다.

그러나 현재까지 국내 모든 은행과 편의점, 지철 ATM 수수료를 무료로 제공하고 있는 카카오뱅크는 해당 서비스를 오는 30일까지만 시행할 예정이다.

사실 카카오뱅크의 수수료 무료 정책은 지난해 12월까지였다. 고객들의 성원에 힘입어 서비스 기간을 6개월 더 연장한 것이다.

서비스 만료에 앞서 혜택 기간이 다시 한 번 늘어나기를 기대하는 고객들이 적지 않다.

1,000원 내외의 적은 돈이지만 계속되면 서민들에게는 충분히 부담되는 금액이기 때문이다.

간편 송금, 수수료 면제 등의 매력으로 평소 카카오뱅크 체크카드를 이용해왔던 고객들의 아쉬움이 더욱 커지는 이유다. 

이에 카카오뱅크 측은 ""추가 연장 등 고객들에게 최대한 혜택이 갈 수 있도록 방안을 검토 중이며 조만간 결과를 발표할 예정""이라고 밝혔다.  "
