category,title,body,origin
비트코인,"비트코인 ATM기 전세계 약 3,000개 설치되다.
","비트코인뉴스에 따르면 비트코인 ATM기가 전세계 국가에서 1개 이상 설치된것으로 보이며 전체 숫자가 약 3,000개가 넘는것으로 추정된다고 전했다. 가장 많이 설치된곳은 미국이며 그 다음으로 유럽의 오스트리아가 가장 인기있는 지역이라고 밝혔다. 한편 비트코인 ATM은 여전히 높은 수수료를 지불하고 있으며 전 세계 평균 8 %의 수수료는 일반 은행거래소에 비해 높은 진입장벽이라고 밝혔다.","비트코인뉴스에 따르면 비트코인 ATM기가 전세계 국가에서 1개 이상 설치된것으로 보이며 전체 숫자가 약 3,000개가 넘는것으로 추정된다고 전했다.

가장 많이 설치된곳은 미국이며 그 다음으로 유럽의 오스트리아가 가장 인기있는 지역이라고 밝혔다.

한편 비트코인 ATM은 여전히 높은 수수료를 지불하고 있으며 전 세계 평균 8 %의 수수료는 일반 은행거래소에 비해 높은 진입장벽이라고 밝혔다."
클라우드/빅데이터,"장밋빛 기대에 찬물··· 흔한 '데이터 과학' 실수 12가지
","수집한 데이터의 양과 품질을 모두 학인하고, 이를 활용할 계획을 수립해야 한다. 데이터닷월드(Data.world)의 데이터 과학자 겸 지식 엔지니어인 조나단 오티즈는 “대부분의 시간, 때론 80%에 달하는 시간을 데이터 획득과 정리에 투자하게 된다. 그리고 추적해야 할 것들을 추적하고 있기 때문에, 데이터 과학자가 자신이 할 일을 할 수 있다고 가정하곤 한다”라고 말했다.","이미 수많은 기업과 기관들이 빅데이터와 예측 분석, 자동화된 알고리즘으로 비즈니스 프로세스와 고객 지원, 의사결정을 강화하는 데 도움을 주는 도구와 서비스를 찾고 있다. IDC에 따르면, 2018년에는 기업과 ISV 개발자 가운데 75%가 최소 1개 이상의 애플리케이션(적용 분야)에 AI나 머신러닝을 사용할 전망이다.

이렇게 데이터를 활용해 의사 결정을 내리고, 성과를 향상시키는 데 많은 관심이 쏠려 있지만, 데이터 사이언스 전문가와 전문성은 아직 부족하고 미흡하다. 특히 이제 막 데이터 사이언스를 활용하는 노력을 시작했다면, 흔히 저지르는 실수들을 주의할 필요가 있다. 

1. 데이터를 사용할 준비가 되었으며, 필요한 모든 것이 갖춰졌다고 가정한다
수집한 데이터의 양과 품질을 모두 학인하고, 이를 활용할 계획을 수립해야 한다. 데이터닷월드(Data.world)의 데이터 과학자 겸 지식 엔지니어인 조나단 오티즈는 “대부분의 시간, 때론 80%에 달하는 시간을 데이터 획득과 정리에 투자하게 된다. 그리고 추적해야 할 것들을 추적하고 있기 때문에, 데이터 과학자가 자신이 할 일을 할 수 있다고 가정하곤 한다”라고 말했다.

그렇지만 올바른 데이터를 추적하고 있어도 기록을 잘못하고 있을 수 있다. 또는 기록 방식이 시간이 지나면서 바뀔 수 있고, 데이터를 수집하는 동안 수집 시스템이 바뀔 수도 있다.
 오티즈는 “매달 조금씩 바뀌고 있다고 가정하자. 분석을 하거나, 모델을 구축할 때 데이터 전체를 사용하지 못하게 된다. 시스템이 바뀌었기 때문이다”라고 경고했다.

테크타겟(TechTarget)의 존 스타이너트 최고 마케팅 책임자(CMO)에 따르면, 올바른 데이터를 수집하고 있어도 데이터 양이 적고 독립적인 변수의 수가 많아 B2B 마케팅과 영업 같은 비즈니스 분야를 대상으로 한 예측 모델 구축이 힘들 수도 있다.

그는 “데이터 사이언스는 데이터가 많을수록 좋고, 예측 모델은 데이터가 많을수록 강력해진다. 트랜젝션 비율은 낮고 트랜젝션에 영향을 주는 독립 변수는 많으면 데이터 세트의 양은 적고 관계는 복잡해진다. 그리고 이는 예측 모델의 힘을 약화시킨다”라고 설명했다.

이를 해결하는 한 가지 방법은 ‘구매 동기(의도)’ 데이터 같은 데이터 세트를 구입하는 것이다. 물론 소속 기업에서 활용할 수 있는 데이터 세트여야 한다. 또는 데이터를 시뮬레이션 할 수도 있다.

이와 관련해 아반데(Avande)의 친탄 샤 수석 컨설턴트 겸 데이터 과학자는 시뮬레이션은 각별히 주의를 기울여 실시해야 한다고 강조했다. 샤는 “데이터가 처음 수립한 가정과 가설에 맞지 않을 수도 있다”라고 말했다.

2. 데이터를 탐구(조사)하지 않은 상태에서 데이터 사이언스를 시작한다
데이터 세트가 제시할 수 있는 것에 대한 ‘이론'과 '직관’이 있을 것이다. 그러나 데이터 팀은 데이터를 사용해 데이터 모델을 훈련하기 전에 데이터를 상세히 조사하고 탐구하는 시간을 투자해야 한다.

오티즈는 “반직관적인 무엇을 발견했다는 것은 가정(가설)이나 데이터가 부정확할 수 있다는 의미다. 데이터를 조사하고, 분류하고, 탐구적으로 분석하는 것이 가장 중요하다. 이를 생략하거나 서둘러 대충 하는 사람들이 많다. 데이터에 대해 철저히 이해를 해야 한다”라고 말했다. 이렇게 사전에 탐구를 하면, 데이터가 더 빨리 주제 전문성과 비즈니스 통찰력을 토대로 적절한 ‘스토리’를 제시한다는 사실을 확인하게 될 것이라고 그는 덧붙였다.

3. 지나치게 큰 기대를 한다
AI를 둘러싼 ‘하이프(과대 선전)’ 때문에 “컴퓨터 알고리즘에 데이터를 공급하면, 알아서 모든 것을 파악한다”라고 생각하는 사람들이 많다. 샤는 “데이터가 제 아무리 많아도, 이를 유용한 형태로 전환하기 위해서는 사람 전문가가 필요하다”라고 말했다.

기업이 과거 했던 일만 조사해서는 새로운 기회를 발굴할 수 없다. 지금까지 했던 일의 효율성을 높이는 방법만 찾을 수 있을 뿐이다. 스타이너트는 “미래를 예측하면서 과거를 많이 사용하면 새로운 기회를 찾을 확률이 낮아진다”라고 지적했다.

제품이나 서비스 수요를 찾기 위해 써드파티 데이터를 구입했다고 가정하자. 이 경우에도 제품이나 서비스 판매에 도움이 될 수 있다는 보장이 없다. 그는 “데이터 모델이 당신의 상품(서비스)과 잘 어울리는 고객 기업을 알려줄 수 있다. 그러나 해당 기업에 지금 당장 특정한 필요사항이 있는지는 알려주지 못한다”라고 덧붙였다.

오티즈는 “사람들은 과거 다른 분야와는 다르게, 데이터 과학자를 철석같이 신뢰하고 있다. 많은 리소스를 투입한다. 그리고 모든 질문에 대답을 할 것이라고 기대한다. 이런 식으로 데이터 과학자에게 큰 기대를 품고 있다. 데이터를 사용하면 질문에 대답을 하고, 의사결정을 견인할 수 있다고 생각한다”라고 말했다.

오티즈에 따르면, 데이터 과학자들은 작은 프로젝트부터 시작해 빨리 성과를 일궈내는 방법으로 기업과 기관에 가치를 입증해 보여야 한다. 그는 “쉽고 빠르게 달성할 수 있는 목표를 추구해야 한다. 기술 ‘토끼굴’에 들어가고, 정말 큰 가치가 있을 것으로 생각하는 대형 프로젝트에 많은 시간을 투자하는 방식으로 시작을 하면 안 된다”라고 강조했다.

4. 새 데이터 모델 테스트를 위해 통제 그룹을 활용하지 않는다
데이터 모델 구축에 많은 시간과 돈을 투자한다면, 투자 가치를 실현시킬 수 있는 모든 장소에서 이를 활용하고 싶어한다. 그러나 이런 방식으로는 모델이 실제 얼마나 잘 작동하는지 평가할 수 없다. 또 사용자가 모델을 신뢰하지 않으면, 이를 사용하지 않을 수도 있고, 그러면 테스트가 불가능하다.

해결책은 무엇일까? 스타이너트는 모델이 확실히 도입되도록 만드는 변화관리 프로그램, 이를 사용하지 않는 통제 그룹이라고 덧붙였다. 모델이 규명한 기회를 추구하는 그룹, 지금까지 해왔던 일을 경험과 독자적인 권한을 가지고 계속 추구하는 통제 그룹을 운영해야 한다는 의미다.

5. 가정(가설)이 아닌 목표로 시작한다
48시간 이내에 해결하는 고객 서비스 비율 80% 달성, 분기 기업 실적 10% 향상 등 특정한 성과를 제공할 수 있는 데이터 모델을 찾으려 시도하기 쉽다. 그러나 이런 매트릭스는 불충분하다. 오티즈는 다음과 같이 설명했다.

“가정(가설)으로 시작하는 것이 더 낫다. 전체 매트릭스에서 곡선이나 선을 보는 경우가 많다. 이를 옮기고 싶어한다. 좋은 비즈니스 목표가 될 수 있지만, 이를 끌어 당기기 위해 필요한 레버를 파악하기 어렵다. 향상과 개선을 가져오는 것에 대한 가정(가설)을 통제 그룹을 이용하거나, 데이터를 탐구해 테스트해야 한다.”

“통제 그룹으로 분리해 테스트를 실시할 수 있고, 두 그룹이 대표성 있는 표본을 제공한다면, 사용하고 있는 방법이 영향을 주고 싶어하는 대상에 실제 영향을 주는지 여부를 확인할 수 있다. 사실에 대한 데이터를 조사하는 것이라면, 가정(가설)으로 시작하는 것이 범위를 좁히도록 도움을 준다. 매트릭스를 10% 증가시켜야 한다면 영향을 줄 수 있는 것에 대한 가설을 수립한다. 그러면 데이터에서 이에 대해 추적하는 탐구 데이터 분석을 할 수 있다. 물으려는 질문을 명확히 하고, 테스트를 할 가설을 수립한다. 그러면 많은 시간을 절약할 수 있다.” "
클라우드/빅데이터,"오라클(Oracle), ""2018년 빅데이터 주목해야""
","오라클의 중동 및 아프리카 빅데이터 분석 디렉터 사미나 리즈완은 빅데이터에 관한 논의에는 분석(analytics), AI, IOT 및 머신러닝(machine learning)이 포함돼야 한다고 덧붙였다. 또한 빅데이터는 아직도 흥미진진한 것들이 많이 있으며 심지어 사업화되지 않은 아이템도 여전치 존재한다고 강조했다.","소프트웨어 개발업체인 오라클이 2018년은 빅데이터의 중요성이 더욱 커지는 해가 될것이라고 전했다. 오라클은 마침내 클라우드를 이용하지 않았던 많은 업체들이 클라우드 기술을 이용할 것이고 전했다.

IT웹의 로렌 케이트는 오라클의 발표를 인용해 이런 업체들이 빅데이터를 활용해 큰 이익을 얻고 더 많은 통찰력을 얻게 될 것이라고 보도했다.
오라클의 중동 및 아프리카 빅데이터 분석 디렉터 사미나 리즈완은 빅데이터에 관한 논의에는 분석(analytics), AI, IOT 및 머신러닝(machine learning)이 포함돼야 한다고 덧붙였다. 또한 빅데이터는 아직도 흥미진진한 것들이 많이 있으며 심지어 사업화되지 않은 아이템도 여전치 존재한다고 강조했다.
리즈완은 데이터의 80%가 클라우드로 이동하고 있으며 나머지 20%도 곧 클라우드로 이동할 것으로 내다봤다. 그러면서 상대적으로 경제적 변방인 중동 및 아프리카 지역에서조차 클라우드를 무시하는 곳은 없다고 전했다. 그는 오라클이 진행한 클라우드 고객들을 대상으로한 조사에서 클라우드를 능숙하게 이용하는 기업들은 데이터 분석 기술이 높고, 대부분의 데이터 유형을 연구할 수 있는 능력이 있으며, 자동화 및 시각화 기능이 뛰어나다고 밝혔다.
리스완은 중동 및 아프리카 지역의 정보 통신 및 은행업계는 얼리어답터를 활용하고 있다고 전했다. 또한 이 지역의 농업, 광업 및 철도 업계에서도 빅데이터를 전략적으로 활용한다면 높은 수익을 얻을 수 있을 것이라고 주장했다.
한편, 시장 조사 기관에서 수행한 연구 결과에 따르면 빅데이터, AI 및 사물인터넷을 활용하는 기업들은 2020년까지 매년 1조 2,000억 달러를 벌어들일 것이라고 전망했다."
클라우드/빅데이터,"하둡 창시자가 본 빅데이터의 진화와 윤리
",‘하둡의 아버지’이자 클라우데라 수석 아키텍트인 더그 커팅이 발표자로 나섰다. 더그 커팅은 빅데이터 기술이 발전해 온 지난 10여년을 돌아본 뒤 데이터 사용에 대한 윤리와 책임을 고민해야 할 시점이라고 강조했다.,"“미래를 다루는 영화를 보면 데이터를 수집하는 사람은 악당으로 나온다. 데이터 일을 하는 나는 악당이 아니라 좋은 사람이고 되고 싶다. 데이터는 사회를 진일보시키는 이점을 줄 것이다. 그러기 위해 데이터 활용을 위한 신뢰를 구축해야 하고, 윤리적 책임을 고민해야 한다.”

?클라우데라코리아(대표 강형준)는 9일 서울 삼성동에서 기자간담회를 열고 ‘머신러닝과 애널리틱스 미래를 지원하는 빅데이터 기술의 진화와 데이터의 윤리적 사용’에 대해 발표했다.

?‘하둡의 아버지’이자 클라우데라 수석 아키텍트인 더그 커팅이 발표자로 나섰다. 더그 커팅은 빅데이터 기술이 발전해 온 지난 10여년을 돌아본 뒤 데이터 사용에 대한 윤리와 책임을 고민해야 할 시점이라고 강조했다.


더그 커팅은 “기업은 이제 하둡과 다양한 오픈소스로 이뤄진 플랫폼으로 여러 사업부와 다양한 사일로 데이터를 통합해, 비즈니스나 사용자에 대한 단일 뷰를 갖게 됐다”며 “최근 몇년간 이 플랫폼에 인공지능(AI) 기술까지 올라갔고, 퍼블릭 클라우드를 통해 많은 사람, 다양한 조직 곳곳에서 새 시스템으로 새로운 문제를 빠른 속도로 해결해 나가게 됐다”고 말했다.


그는 “우리는 이제 디지털 트랜스포메이션이 이뤄지는 미래로 함께 나아가고 있으며, 모든 기업의 의사결정이 데이터를 중심으로 이뤄지게 될 것”이라며 “디지털 데이터가 사회 전반에 스며들며 점점 더 개선할 수 있도록 하고 있는 시점에 우리는 앞을 내다보고 데이터 관련 기술이 어떤 이득을 줄 것이고, 어떤 위해를 줄 것인지를 미리 생각해봐야 한다”고 강조했다.
?

오늘날 세계는 디지털 변환 시대를 맞이하고 있다. 그 시발점이 하둡 기술이었다는 점도 확실하다. 그 하둡 기술을 만든 당사자는 이제 새로운 디지털 시대, 데이터가 가져다줄 이익을 더 높이려면 윤리적 책임을 고민해야 할 때라고 진단한다.


그는 “미래를 다루는 영화를 보면 데이터를 수집하는 사람은 항상 악당으로 나온다”며 “데이터 관련 일을 내가 하고 있지만, 나는 악당이고 싶지 않고, 좋은 사람이 되고 싶다”고 말했다.

?그는 “데이터를 통해 우리가 무엇을 하는지 더 잘 이해할 수 있게 되고, 운영 전반을 개선하고, 시스템을 최적화하고, 사회를 더 좋은 사회로 만들어 갈 수 있다”며 “교육, 의료, 기후변화, 빈곤퇴치 등에서 데이터가 줄 이점이 매우 크다”고 설명했다.

?데이터 분석을 하면, 아동 교육의 맞춤화를 달성할 수 있다. 의료 분야도 개인의 건강을 한층 더 증진할 수 있다. 그러나 이런 시스템을 만드려면 데이터 수집이란 전제가 필요하다. 아동의 데이터, 개인 의무 기록, 개인 정보 등을 수집해야 하는 것이다. 사회 전반의 문제를 해결하고 더 나은 세상을 만들기 위해 데이터를 가능한 많이 수집해야 하는데 사회에서 이를 거부하면 ‘좋은 일’ 자체를 구상할 수 없게 된다.

?그는 “데이터 수집은 많은 가치를 갖지만, 데이터 수집 기관이나 사람을 신뢰할 수 있어야 한다”며 “데이터 암호화나 익명처리로 특정 데이터가 누구에 해당하는지 모르게 하는 등의 기술도 있지만 그것으로 충분치 않다”고 지적했다.

?커팅은 “인류는 역사를 통해 구체적이고 상세한 사회제도를 구축하고 개선해왔다”며 “금융시스템, 법제도, 의료치료 등과 마찬가지로 데이터 관련해서도 문화적 기법을 구축해야 한다”고 강조했다.

?그는 데이터 활용을 극대화하고 좋은 일에 쓰이게 하려면 신뢰를 구축하는 게 가장 중요하다고 밝혔다. 그리고 신뢰 구축을 위한 4가지 요소이자 원칙을 발표했다. 조직과 개인간에 데이터가 어떻게 사용될 것인지에 대한 기대치 조정(투명성), 데이터 관리를 위한 모범 사례 수립(베스트 프랙티스), 경계 설정, 정부 또는 업계 주도의 감독 및 규제 마련(검증) 등이다.

?조직은 데이터로 무얼 하는지 사전에 분명히 파악해야 데이터 수집에 대한 사람의 신뢰를 얻을 수 있다고 설명한 커팅은 “사람은 예기치 못한 방식으로 자신의 데이터가 사용되는 걸 보면 놀라워하고, 싫어하므로, 이런 효과가 없도록 사전에 어떻게 데이터를 쓸 것인지 투명하게 알려줄 필요가 있다”고 말했다.

?이어 “두번째로 산업계에서 데이터 관리 방법, 암호화, 익명화 방법, 특정 데이터 마스킹 등의 베스트 프랙티스를 분명하게 마련해야 한다”며 “세번째로 허용되는 것과 허용해선 안되는 것 사이의 선을 분명히 그어야 한다”고 강조했다.

?그는 “개인정보 노출 금지, 주소나 사생활 노출 금지 같은 사안은 이미 잘 알려진 사실이지만, 어떤 정보는 나중에 가서야 해서 안되는 것이었다고 알게 되기도 한다”며 “네번째는 검증으로, 어떤 기관이나 조직이 대외적으로 데이터 활용방안을 밝혔으면, 말한 대로 하는지 검증할 수 있어야 한다”고 말했다.

개인정보를 재배포 안 한다고 해도 정말로 재배포를 안하는지 체크할 수 있는 감독이 필요하다고 덧붙인 그는 “정부 감독기능도 있지만 더 좋은 방법은 산업별 자율규제이며, 금융업계나 증권거래소, 의사, 회계사, 변호사도 신뢰도 구축을 위해 자율규제와 감사를 하고 있는데 데이터 신뢰에도 이런 검증이 요구된다”고 밝혔다.

?미국의 경우 연방무역위원회가 소비자를 공정하게 대우해야 한다는 측면의 가이드라인을 발표했다. 유럽은 GDPR이란 소비자 개인정보 보호에 대한 법을 이번달부터 시행한다. 소비자의 데이터 권리를 존중하도록 하는 법안이 세계 곳곳에서 시도되고 있다.

더그 커팅은 정부 차원의 노력 외에 민간 차원의 노력이 절실하다고 강조했다. 상황의 변화에 정부는 느리게 움직이지만, 민간은 더 발빠르게 움직일 수 있다는 것이다.

그는 “내가 종사하는 산업은 기술에 투자하고 사람에게 기술을 제공하는 산업이다”라며 “그래서 데이터 신뢰도 문제를 많은 이가 인식하도록 하는 노력을 기울여야 하며, 그것이 우리 산업 전체의 책임이고 의무”라고 밝혔다.

?커팅은 데이터 과학을 위한 윤리 강령 마련에 대해 몇가지 조언을 내놨다. 일단, 신뢰 구축에 많은 시간이 필요하고, 어려운 과정을 거쳐야 한다는 전제를 깔았다.

?그는 “기업이나 조직의 데이터 사용을 외부의 제3자가 감사하는 게 필요하다”며 “현재는 외부인에 의한 데이터 활용 감사가 실시되지 않고 있는데 기업이 이에 대해 많은 생각을 하고 채택하기를 바란다”고 말했다.

?데이터 윤리를 고민하는 기업과 담당자에게 스스로 묻고, 남의 의견도 폭넓게 들으라는 조언도 했다. “우선 자기 자신에게 ‘남이 내게 이런 걸 해도 나는 괜찮을까’하는 질문을 하는 것이 가장 중요한 기준이 된다”면서 “다음으로 사람마다 기대치 다르고, 생각이 다르니 남에게도 똑같은 질문을 물어보고 답을 듣는 게 좋다”고 말했다.

?그는 “가장 윤리적 방향이 무엇인지 파악하는 일은 확연하지 않은 경우가 많아서 이런 질문을 해보는 게 중요하다”며 “윤리적이라고 하는 건 흑백으로 가르는 게 아니라 보통사람이 기대하는 것에서 벗어나냐 아니냐를 보고, 그 기대치에서 벗어나지 않게 하는 것”이라고 덧붙였다.

?데이터의 시대를 열어 젖힌 공로자 중 한명인 더그 커팅은 앞으로 10년, 20년 뒤 하둡과 빅데이터가 사회 전반에 좋은 영향을 미쳤다는 평가를 듣길 기대한다고 밝혔다. 그는 “앞으로 수년 안에 빅데이터 정책을 설정하면 어떤 기술이나 데이터를 사용하든 전반적으로 긍정적 영향이 도출되게 하는게 우리가 해야할 일”이라며 “머지 낳아 빅데이터 관련 윤리 협약이나 표준이 나와 오랜 기간 사용될 것인데. 그게 나오기 전인 현 시점에서 빅데이터에 대한 최상의 정책이 뭔지 잘 생각해야 10년, 20년 후에 자부심을 느끼게 될 것”이라고 말했다.

?그는 윤리 마련의 합의 도출을 위해 산업 발전이란 인센티브를 모든 이해당사자가 합의해야 한다고 밝혔다. 또, 어느나라서도 합의될 수 있는 윤리를 위해 보편적 인권을 시작점으로 삼는 게 좋겠다고도 했다.

?“데이터가 줄 가치를 잘 활용하려면 윤리 강령이 필요하다”면서 “데이터에 대한, 사용자에 대한 신뢰가 필요한데, 좋은 윤리 강령이 없으면 신뢰할 수 업고. 그렇게 되면 데이터를 쓰지 못하게 해 데이터의 이점을 누리지 못하게 될 것”이라고 강조했다."
