category,title,body,origin
클라우드/빅데이터,"공공 빅데이터 분석사업 증가세
","286개 중앙부처와 공공기관, 지자체는 5년간 모두 782건의 빅데이터 분석사업을 진행했다. 지자체 472건, 공공기관 164개, 중앙부처 146개 순이었다. 특히 2016년 140개였던 빅데이터 분석사업은 작년 447개로 급증했다. 행안부는 이 과정에서 지자체가 쉽게 빅데이터를 분석할 수 있도록 지방세 체납정보, 상수도 누수지역 탐지, 구급차 배치·운영 최적화 등 표준분석모델을 보급했다. 표준분석모델은 올해 10종을 추가 개발해 모두 26개로 늘릴 계획이다.","중앙부처와 공공기관에서 빅데이터를 활용한 분석사업이 크게 늘어났다.

행정안전부는 지난 2013년 12개에 불과한 빅데이터 분석사업이 작년 447개를 기록, 40배 이상 증가했다고 23일 밝혔다.

286개 중앙부처와 공공기관, 지자체는 5년간 모두 782건의 빅데이터 분석사업을 진행했다. 지자체 472건, 공공기관 164개, 중앙부처 146개 순이었다. 특히 2016년 140개였던 빅데이터 분석사업은 작년 447개로 급증했다. 행안부는 이 과정에서 지자체가 쉽게 빅데이터를 분석할 수 있도록 지방세 체납정보, 상수도 누수지역 탐지, 구급차 배치·운영 최적화 등 표준분석모델을 보급했다. 표준분석모델은 올해 10종을 추가 개발해 모두 26개로 늘릴 계획이다.

분야별 빅데이터 분석사업은 공공행정에서 236건으로 가장 많았다. 민원분석과 여론분석, 홈페이지 게시글 분석 등에 주로 활용했다. 이어 문화관광 131건, 재난안전 74건으로 집계됐다. 사업예산은 지난 5년간 2523억원을 투입했다. 2013년 110억원에서 작년 887억원까지 확대됐고, 1개 빅데이터 분석사업당 보통 3억2000만원이 투입됐다.

행안부 관계자는 ""국민들의 관심이 많은 생활안정과, 주민의 수요가 많은 지방행정을 빅데이터로 분석하는 노력이 활발하다""며 ""우수 사례를 지속적으로 발굴하고 일선 행정에서 데이터 기반의 행정이 정착될 수 있도록 하겠다""고 말했다."
클라우드/빅데이터,"美 MIT, 중국 AI 스타트업과 손잡았다
",레이프 총장은 23일 센스타임 사무실을 방문하고 MIT와의 인공지능 연맹을 체결했다. 글로벌 우수 인재를 모아 공동으로 인류 및 기계 지능의 미래를 모색하겠다는 취지다. 중국 내외 학자를 기용해 공동으로 인공지능 원천 기술 개발에 주력할 계획이다. ,"안면인식 전문' 센스타임..""세계 난제 풀겠다""

미국 매사추세츠공과대학(MIT)의 라파엘 레이프(Rafael Reif) 총장이 중국 스타트업과의 협력을 위해 직접 중국을 찾았다. 이 스타트업은 중국의 대표적 인공지능(AI) 안면인식 기업으로 꼽히는 센스타임(SenseTime) 이다.

레이프 총장은 23일 센스타임 사무실을 방문하고 MIT와의 인공지능 연맹을 체결했다. 글로벌 우수 인재를 모아 공동으로 인류 및 기계 지능의 미래를 모색하겠다는 취지다.

중국 내외 학자를 기용해 공동으로 인공지능 원천 기술 개발에 주력할 계획이다. 컴퓨터 비주얼, 뇌과학 스마트 알고리즘, 의료 영상, 로봇 등 분야를 막론한다. 이를 통해 세계적인 난제를 해결하면서 MIT의 인공지능 영역 크로스오버 연구 역시 지원할 수 있을 것으로 기대한다. 레이프 총장은 ""인공지능 연맹이 세계의 가장 복잡한 난제를 해결해줄 것""이라며 기대감을 표했다.

센스타임은 세계 처음으로 MIT의 '인텔리전스 퀘스트(Intelligence Quest, IQ)' 프로젝트에 참여한 기업이기도 하다. 이 프로젝트는 MIT의 뇌 연구, 인지 과학 및 컴퓨팅 과학 우위점을 활용해 인류 및 기계 지능 연구 발전을 도모하고 인류에 기여하는 것이 목표다.

재료 설계, 금융, 질병 조기 진단 등 다양한 영역에 걸쳐 연구개발을 하고 있다. 인공지능이 경제, 문화와 윤리 등 고아범위한 측면에서 영향력을 발휘할 수 있도록 하고 있다.

센스타임과 MIT의 협력은 창업자인 탕샤오어우 교수가 MIT에서 수학한 인연으로 비롯한 것이다. 홍콩중문대학 교수로 재직중인 탕샤오우 교수는 MIT에서 박사 학위를 취득했으며 당시 수중 머신 비주얼 연구 등에서 성과를 냈다.

센스타임은 최근 알리바바가 참여한 컨소시엄으로부터 6억 달러(약 6천468억 원)의 투자를 유치하면서 기업가치가 30억 달러(약 3조 2천340억 원) 규모에 이르렀다."
클라우드/빅데이터,"가트너 ""올해 AI 시장 가치 1조2천억달러""
","가트너 리서치 부사장인 존 데이비드 러브록은 “AI는 연산능력, 규모, 속도, 데이터 다양성, 심층신경망(DNN) 발전 등으로 향후 10년간 가장 파괴적인 기술으로 자리매김할 것""이며 “2017-2022년 기업들이 AI 기반 제품과 서비스를 위해 가장 주목할 부분은 한가지의 기능에 특화돼 틈새시장을 공략하는 솔루션들”이라고 설명했다.","가트너는 올해 인공지능(AI)으로 파생될 글로벌 비즈니스 가치를 전년 대비 70% 증가한 1조 2천억 달러로 전망한다고 26일 밝혔다. 글로벌 인공지능 파생 시장은 2022년 3조 9천억 달러에 달할 것으로 전망됐다.

가트너의 AI 비즈니스 가치 전망 조사는 모든 엔터프라이즈 버티컬 부문에서 AI가 갖는 전체 비즈니스 가치를 평가했다. '고객 경험', '신규 매출', '비용 절감'은 AI 비즈니스 가치의 주요 요소다.

가트너 리서치 부사장인 존 데이비드 러브록은 “AI는 연산능력, 규모, 속도, 데이터 다양성, 심층신경망(DNN) 발전 등으로 향후 10년간 가장 파괴적인 기술으로 자리매김할 것""이며 “2017-2022년 기업들이 AI 기반 제품과 서비스를 위해 가장 주목할 부분은 한가지의 기능에 특화돼 틈새시장을 공략하는 솔루션들”이라고 설명했다.

그는 “기업 경영진들은 특정한 영역에 특화된 전문 공급업체들의 AI 기반 제품에 투자할 것으로 예상된다""고 덧붙였다.

AI 비즈니스 가치의 성장은 다른 신흥 기술과 마찬가지로 전형적인 S곡선 패턴을 보인다. 2018년 성장률은 70%에 달할 것으로 보이지만, 2020년부터 2022년까지 성장률이 점차 둔화될 것으로 보인다.

러브록 부사장은 “초기 기업들은 고객 유치를 목적으로 고객과의 커뮤니케이션 강화에 AI 기술을 주로 활용했기 때문에 '고객 경험(CX)'의 개선이 AI 비즈니스의 가장 중요한 가치로 여겨졌다”며 “또한, AI가 의사결정 개선과 업무 자동화를 위한 절차 효율성 증대에 활용됨에 따라 '비용 절감'이 중요한 비즈니스 가치로 여겨지고 있다""고 밝혔다.

그는 이어 “그러나 2021년에는 '신규 매출'이 AI 비즈니스 가치에서 가장 높은 비중을 차지할 것이다. 이는 기업이 AI 비즈니스 가치를 기존 제품·서비스 매출 상승과 신제품·신규 서비스의 발굴에 중점을 둘 것이기 때문”이라며 “장기적으로 봤을 때 AI 비즈니스 가치는 신규 매출 창출 여부에 달려 있다”고 설명했다.

글로벌 AI 비즈니스 가치를 유형별로 살펴보면, 2018년 전체 글로벌 AI 비즈니스 가치 중 심층신경망(DNN)과 같은 '의사결정 지원'이 38%를 차지할 것으로 보인다. 2022년에는 의사결정 지원이 다른 AI 이니셔티브를 능가할 만큼 성장해 글로벌 AI 비즈니스 가치의 44%를 차지할 전망이다.

러브록 부사장은 “심층신경망은 기존에 수치화하거나 분류하기 어려웠던 빅데이터의 데이터마이닝과 패턴인식을 가능하게 하며, 이를 통해 기존 프로그래밍 시스템에서 사용할 수 있는 입력값을 만들어 낸다”며 “이는 데이터를 분류하던 사람의 업무를 알고리즘이 직접 처리할 수 있게 함으로써 의사결정을 돕는다""고 말했다.

그는 “이러한 기능은 기업의 의사결정과 상호작용 프로세스의 자동화에 긍정적인 영향을 끼쳐 기업의 비용과 위험을 감소시키고, 마이크로타겟팅, 세분화, 마케팅, 판매 개선을 통해 매출을 상승시킬 수 있도록 돕는다”고 덧붙였다.

'가상비서'는 콜센터, 헬프 데스크, 고객 서비스의 직원들이 처리하던 업무 중 단순 업무들을 대신 처리하고, 직원들이 보다 부가가치가 높은 업무에 집중하도록 해 인건비를 절감하도록 돕는다. 금융 서비스의 로보어드바이저는 콜센터를 통해 고객들에게 업셀링을 유도하는 방식으로 매출을 상승시킬 수 있다. 2018년 '가상비서'가 글로벌 AI 비즈니스 가치에서 차지하는 비중은 46%에 달할 것으로 전망되지만, 2022년에는 한층 성숙해진 다른 AI 유형들이 비즈니스 가치를 창출하게 됨에 따라 '가상비서'의 비중은 26%에 그칠 것으로 예상된다.

'의사결정자동화시스템'은 AI를 활용해 작업을 자동화하거나 비즈니스 프로세스를 최적화한다. 특히 음성을 텍스트로 변환하거나 텍스트를 음성으로 변환하고, 손글씨와 이미지를 처리하며, 기존 시스템에 접근이 불가능했던 데이터를 분류하는 등 다양한 업무들을 돕는다. 의사결정자동화 기술 성숙으로 기업은 비정형 데이터를 활용하고, 데이터 모호성 문제를 해결할 수 있게 된다. 이는 향후 기업이 더 많은 비즈니스 가치를 창출하도록 돕는다. '의사결정자동화'가 2018년 글로벌 AI 비즈니스 가치에서 차지하는 비중은 2%에 불과하지만, 2022년에는 16%까지 성장할 것으로 전망된다.

'스마트 제품'은 2018년 글로벌 AI 비즈니스 가치에서 18%를 차지했으나, 2022년에는 14%로 감소할 전망이다. 이는 다른 심층신경망 기반 시스템 유형이 발전하면서, 스마트 제품이 차지하는 비중을 압도하기 때문이다. '스마트 제품'은 다양한 시스템과 상호작용 과정에서 수집된 사용자 선호도 데이터를 통합할 수 있는 클라우드 시스템 형태로서 AI를 내장하고 있다. '스마트 제품'은 사용자의 선호도를 학습해 고도로 맞춤화된 경험을 제공하며, 사용자 참여를 유도한다."
IoT,"SKT, 사물인터넷 전국망 LTE Cat.M1 상용화
",LTE Cat.M1은 국제 표준화단체 3GPP에서 표준화한 저전력 광대역(LPWA) 기술로 HD급 사진과 저용량 동영상 전송이 가능한 것이 특징이다. 전력 효율이 좋기 때문에 수년 간 배터리 걱정 없이 IoT 서비스 이용이 가능하다. 통신 모듈 가격도 기존 LTE-M 대비 약 30% 저렴하다.,"SK텔레콤(대표 박정호)은 ‘로라’와 ‘LTE-M’에 이은 또 하나의 IoT 전국망 ‘LTE Cat.M1’ 상용화에 성공했다고 29일 밝혔다.?

LTE Cat.M1은 국제 표준화단체 3GPP에서 표준화한 저전력 광대역(LPWA) 기술로 HD급 사진과 저용량 동영상 전송이 가능한 것이 특징이다. 전력 효율이 좋기 때문에 수년 간 배터리 걱정 없이 IoT 서비스 이용이 가능하다. 통신 모듈 가격도 기존 LTE-M 대비 약 30% 저렴하다.?

SK텔레콤은 LTE Cat.M1 전용 요금제도 출시했다. 요금제는 1천100원부터 5천500원까지 총 5종류이며, 데이터 제공량은 회선당 5MB부터 100MB까지다.

SK텔레콤에 따르면 LTE Cat.M1 상용화 이전의 IoT 서비스는 대부분 LTE-M, NB-IoT, 로라 망을 이용해 제공됐으나, 망 간 성능 차이가 현격해 이를 절충할 수 있는 망 구축 필요성이 제기되어 왔다.

LTE-M은 전송 속도는 10Mbps로 빠르지만, 전력 효율이 좋지 않아 수 개월 마다 배터리를 교체해야 했고 통신 모듈 가격도 높았다. 로라와 NB-IoT는 전력 효율이 좋아 수 년 이상 배터리 교체 없이 사용 가능하지만, 속도가 30kbps 이하라 수치나 알림 등 소량의 데이터 전달만 가능했다.

?SK텔레콤 관계자는 ""LTE Cat.M1은 두 망의 장점을 융합한 대안이 될 것으로 전망된다""고 말했다.

SK텔레콤은 국내 통신장비 제조사인 콘텔라와 손잡고 첫 LTE Cat.M1 서비스 IoT블랙박스 서비스를 다음달 중순 출시한다고 밝혔다. 기능은 차량의 사고 통보, 충격 영상 전송, 차량 위치, 운행이력 확인, 주차위치 전송 등이 있다. 요금은 월 1천900원이며 데이터는 50MB다.

?IoT블랙박스는 사진과 영상을 스마트폰으로 확인하는데 문제 없도록 최적화해 전송한다. 기존에는 전력 효율이 낮고 통신 모듈 가격이 높아 블랙박스에 LTE를 활용하기 어려웠으나 LTE Cat.M1 상용화로 서비스 제공이 가능해졌다는 것이 SK텔레콤의 설명이다.

?허일규 SK텔레콤 IoT·Data사업부장은 ""초연결 시대를 위해 완벽한 통신망 구축과 혁신 서비스 개발에 박차를 가하고 있다""며 ""IoT파트너들과의 협업을 지속해 생태계 활성화는 물론이고 업계 선도에도 힘쓰겠다""고 말했다."
O2O & 옴니채널,"3000호점 돌파 초읽기 ‘이마트24’ 편의점 포화에도 외형 확대 ‘불안한 역주행’
","편의점 후발주자 이마트24의 출점 속도가 심상찮다. 공격적인 출점으로 미니스톱을 제치고 업계 4위로 올라서더니 올 들어서는 일평균 점포 증가 속도가 GS25를 제쳤다. 4월 내 3000호점 돌파가 확실시되고 이르면 내년 말께 5000호점 돌파도 가능할 전망이다. 단, 최저임금 인상과 심각한 매장 포화도를 감안하면 ‘너무 늦게 시동을 건 것 아니냐’는 우려가 적잖다. 점주 수익성을 감안하지 않고 외형 확장에만 몰두한다는 비판도 나온다. ","편의점 후발주자 이마트24의 출점 속도가 심상찮다. 공격적인 출점으로 미니스톱을 제치고 업계 4위로 올라서더니 올 들어서는 일평균 점포 증가 속도가 GS25를 제쳤다. 4월 내 3000호점 돌파가 확실시되고 이르면 내년 말께 5000호점 돌파도 가능할 전망이다. 단, 최저임금 인상과 심각한 매장 포화도를 감안하면 ‘너무 늦게 시동을 건 것 아니냐’는 우려가 적잖다.
점주 수익성을 감안하지 않고 외형 확장에만 몰두한다는 비판도 나온다. 

지난 3월 말 기준 이마트24는 총 2949개. 지난해 초부터 매달 60~100개씩 점포가 순증했다는 점을 감안하면 4월 내 3000호점 돌파가 확실시된다. 1만2000개가 훌쩍 넘는 CU·GS25에 비하면 아직 갈 길이 멀지만 출점 속도만큼은 업계 최상위권이다. 매경이코노미 조사 결과 편의점 5사의 최근 7개월간(2017년 9월~2018년 3월) 일평균 점포 순증 속도는 CU 3.1개, GS25 2.7개, 세븐일레븐 1.3개, 이마트24 2.9개, 미니스톱 0.4개로 나타났다. 이마트24가 전국에서 하루 2.9개씩 늘어나고 있어 업계 2위 GS25를 제치고 CU에 이어 두 번째로 출점 속도가 빠름을 알 수 있다. 업계 3위인 세븐일레븐보다 2배, 미니스톱보다는 7배 이상 빠른 속도다. 

이는 올 들어 편의점 업계가 최저임금 인상 등 업황 악화로 공격적 출점을 자제하는 분위기와 역행하는 것이라 더욱 눈에 띈다. 편의점 5사의 지난해(2016년 10월~2017년 8월 기준) 일평균 점포 순증 속도는 CU 4.7개, GS25 5.1개, 세븐일레븐 2.1개, 이마트24 2.4개, 미니스톱 0.3개였다. 빅3가 모두 출점 속도를 늦췄고 5위인 미니스톱은 겨우 0.1개 늘리는 데 그쳤지만 이마트24만 힘껏 가속 페달을 밟고 있는 형국이다. 

안 그래도 국내 편의점은 지나친 출점 경쟁으로 몸살을 앓고 있는 상황. 인구 대비 편의점 포화도를 나타내는 ‘편의점당 배후인구(인구/편의점 수)’는 한국이 1300명 이하로, 일본과 대만(약 2200명), 중국(약 3500명)보다 훨씬 적다. 

점포당 고객 수가 줄어드니 매출 하락은 당연지사다. 산업통상자원부에 따르면 편의점 점포당 매출은 지난해 2월 사상 처음 전년 동월 대비 마이너스(-3.5%)를 기록한 이후, 올해 1월까지 12개월 연속 줄었다. 

편의점 업계 전체 매출 성장률(전년 대비 기준)도 2015년 26.5%, 2016년 18.2%, 2017년 10.9%로 계속 둔화되고 있다. 1인 가구 증가 등으로 편의점 시장은 꾸준히 성장하고 있지만, 점포 증가 속도가 시장 성장 속도를 넘어서며 점포당 수익성이 급감하고 있는 것이다. 

▶한 달에 100여개씩 점포 순증 

매장수 4위, 출점 속도는 2위 

시장 포화에 점포당 매출 ‘뚝뚝’ 

그럼에도 이마트24가 출점에 열을 올리는 이유는 뭘까. 

업계에서는 이마트24의 ‘로열티 정액제’를 공격적 출점의 주요인으로 꼽는다. 이마트24는 업계 후발주자로 뛰어들면서 24시간 영업, 위약금, 로열티(정률제)가 없는 ‘3무(無) 정책’으로 차별화를 선언했다. 기존 편의점들이 점주의 투자금액에 따라 본사와 수익을 나누는 정률제 로열티 대신, 매출이 얼마든 매달 60만~150만원만 내면 된다는 게 이마트24 방침이다. 

정액제는 기존 매장 매출이 아무리 늘어도 본사 수익은 제한적이다. 때문에 본사가 수익을 늘리려면 기존 매장 매출 증대보다는 신규 출점을 통한 추가 로열티 확보에 집중할 수밖에 없다. 업계 관계자는 “정률제는 가맹점 매출이 늘어야 본사 매출도 늘어나니 가맹점 매출 관리에 신경 쓸 수밖에 없다. 반면 정액제는 본사와 가맹점의 수익 모델이 서로 달라 구조적으로 상생이 쉽지 않다. 때문에 일본 편의점도 처음에는 정액제 로열티로 시작했지만 지금은 모두 정률제로 바꿨다”고 말했다. 

그래서일까. 이마트24의 폐점률은 2015~2016년 2년 연속 10%대를 기록, 편의점 5사 중 가장 높았다. 같은 기간 3~4%대를 유지한 CU·GS25보다 2~3배 이상 높다. 이마트24는 신규 개점률도 3년 연속 업계 최고(50.2~88.7%)를 기록, 10%대를 유지한 타 브랜드 대비 월등히 높았다. 공격적인 출점으로 새로 오픈하는 점포가 많지만, 그만큼 많이 문을 닫기도 하는 ‘다산다사’ 상황이다. 이에 대해 이마트24 관계자는 “자체 조사 결과 최근 4개월 치 폐점률은 업계에서 가장 낮은 편으로 나타났다. 2017년 폐점률은 상황이 달라질 것”이라고 자신했다. 

24시간 영업을 안 하는 것에 대해서는 의견이 상충한다. 대부분 편의점이 24시간 영업을 하는 데 반해 이마트24는 가맹점의 약 70%가 야간 영업을 안 한다. 이마트24 관계자는 “이마트24는 24시간 영업을 안 해도 되니 건물주가 창업하거나 기존 편의점에서 갈아타는 경우가 적잖다. 최근 ‘브랜드 전환 창업 비중’이 전체 신규 출점의 10%를 넘어섰다. 야간 영업을 안 하고도 평균 일매출이 120만~130만원에 달해 상대적으로 높은 편”이라고 말했다. 반면 업계 관계자는 “야간 영업을 안 하면 고객이 야간에는 물론, 주간에도 안 찾는 경향이 있다. 그럼 장기적으로 전체 매출이 감소해 점포 생존력에 도움이 안 된다. 최저임금 인상 등으로 수익성이 떨어져 야간 영업을 포기하는 경우를 제외하고는 야간 영업을 하는 게 유리하다는 판단”이라고 말했다. 

이마트24가 포화된 편의점 시장에 후발주자로 뛰어들다 보니 불리한 경우도 적잖다. 목 좋은 입지를 선점당하고 기존점과 근접 출점을 불사해야 하는 게 대표적인 예다. 편의점 매출 40%를 차지하는 담배 영업권은 50m 간격으로 주어진다. 때문에 기존점과 50m 내 근접 출점하는 이마트24는 담배를 팔 수 없게 된다. 담배가 편의점 방문을 유도하는 대표 미끼상품임을 감안하면 매출의 절반가량을 포기해야 하는 셈. 

이에 대해 이마트24 측은 “점주들도 담배 영업권이 없으면 출점을 꺼린다. 때문에 담배 영업권이 없는 매장은 학원가, 원룸 건물 등 일부 상권에 한해 출점하고 있다. 이런 경우 매장을 대형화해 다른 상품 매출로 수익을 보완할 수 있게 한다”고 말했다. 

또 이마트24는 상생의 일환으로 직영점 중 매출이 잘 나오는 곳은 가맹점으로 전환하는 ‘선직영 오픈검증제’를 실시하겠다고 밝혔다. 그러나 이렇게 전환된 가맹점은 40개 대상 점포 중 20개에 불과하다. 임대료가 비싼 상권이나 입지에 출점하는 직영점 특성상 가맹점주가 들어가기는 쉽지 않다는 후문이다. 

이마트24에서 ‘노브랜드’가 철수하는 것도 아쉽다. 노브랜드는 이마트24가 다른 편의점과 상품 면에서 차별화할 수 있는 대표 무기였다. 그러나 최근 신세계가 노브랜드 전문점 출점에 나서며 이마트24 상권과 중복 논란이 일자 이마트24의 노브랜드 상품 판매를 대폭 축소하기로 했다. 정용진 신세계 부회장은 “(노브랜드 전문점과 이마트24의 상권 중복은) 뼈아픈 실책 중 하나다. 현재 3%인 상품 중복률을 연말까지 1% 미만으로 낮추겠다”고 말했다. 

전문가들은 이미 레드오션인 편의점 시장에서 이마트24의 지나친 공격적 출점이 소상공인 피해로 이어질 수 있다고 우려한다. 

강병오 중앙대 산업창업경영대학원 창업컨설팅학과장(FC창업코리아 대표)은 “편의점은 이미 과당경쟁이 심각한 시장이다.
 그럼에도 신세계라는 대기업이 추가로 뛰어들면서 경쟁이 더욱 과열되고 있다. 편의점은 점주들의 자본이 투입되는 특성상 대기업 간 경쟁이 아닌, 소상공인 간 경쟁이라는 점에서 문제가 심각하다. 편의점 강자인 CU·GS25를 무너뜨리기 위해 차별화를 한다 해도 이는 결국 기존 점주들을 문 닫게 하는 결과로 이어질 수밖에 없다. 대기업이라면 새로운 블루오션 시장을 개척하는 것이 바람직하다”고 말했다. 
"
