category,title,body,origin
비트코인,"KT, 이니텍과 블록체인 인증 서비스 이달 상용화
",KT는 정보보안·금융 IT 서비스 전문기업 이니텍과 'KT 블록체인 통합인증(SSO)' 솔루션을 공동 개발했다고 25일 밝혔다. 이니텍은 이달 말 제품을 공식 출시할 예정이다. 이 솔루션은 KT 블록체인 기술과 이니텍의 인증 솔루션 '이니세이프 넥세스'를 융합한 제품이다.,"KT는 정보보안·금융 IT 서비스 전문기업 이니텍과 'KT 블록체인 통합인증(SSO)' 솔루션을 공동 개발했다고 25일 밝혔다.

이니텍은 이달 말 제품을 공식 출시할 예정이다.

이 솔루션은 KT 블록체인 기술과 이니텍의 인증 솔루션 '이니세이프 넥세스'를 융합한 제품이다.

이니세이프 넥세스는 웹, 클라이언트·서버, 모바일 등 다양한 기업 업무 환경에서 통합인증을 지원하는 솔루션으로, KT 블록체인 기술로 인증정보와 계정정보를 블록체인에 분산 저장하게 된다.

블록체인 저장 정보는 각 노드에 실시간으로 공유돼 백업을 위한 서버 이중화 비용이 절감되고 보안성과 관리효율성이 향상된다.

KT는 블록체인 통합인증 솔루션이 기업의 통합인증뿐 아니라 다양한 영역에서 신분증을 대체할 수 있도록 적용 확대에 나설 방침이다. KT는 올해 블록체인 센터를 출범하고 블록체인 적용분야를 확장하고 있다.

KT 융합기술원 서영일 블록체인센터장은 ""이번 이니텍과의 통합인증솔루션 공동 개발로 KT 블록체인 기술이 인증 분야까지 적용됐다""며 ""KT는 앞으로 블록체인 적용을 산업 전반으로 확장해 4차산업혁명을 주도할 것""이라고 말했다."
비트코인,"빗썸 신임 대표이사에 허백영 이사 내정..단독대표 체제로
","빗썸은 최근 이사회를 열고 허백영 이사를 신임 대표이사로 내정했다. 허 신임 대표는 홍익대 기계시스템디자인공학과를 졸업하고 씨티은행, ING증권 등을 거친 금융맨이다. 지난해 빗썸에 합류해 신규사업 추진 업무를 총괄해왔다. 전수용 대표이사는 상근이사 직을 유지하며 핀테크 및 블록체인 신사업 총괄 업무를 이어나갈 예정이다.","국내 가상화폐 거래소 빗썸이 대표이사를 교체했다.

26일 업계에 따르면 빗썸은 최근 이사회를 열고 허백영 이사를 신임 대표이사로 내정했다.

허 신임 대표는 홍익대 기계시스템디자인공학과를 졸업하고 씨티은행, ING증권 등을 거친 금융맨이다.

지난해 빗썸에 합류해 신규사업 추진 업무를 총괄해왔다.

전수용 대표이사는 상근이사 직을 유지하며 핀테크 및 블록체인 신사업 총괄 업무를 이어나갈 예정이다.

빗썸 관계자는 ""허 이사는 선진 금융사 근무경험과 암호화폐 시장에 대한 높은 사업적 이해도를 바탕으로 빗썸이 글로벌 암호화폐거래소로서 경쟁적 우위를 이어나가는데 적임자""라고 설명했다."
비트코인,"한컴-IBM, 블록체인 서비스 개발 착수
","한컴은 26일 서울 삼성동 코엑스 그랜드볼룸에서 사업발표회를 열고 “오피스와 보안 등 한컴제품을 연동 할 수 있는 블록체인 서비스를 내놓겠다”고 밝혔다. 이 서비스의 이름은 한컴에스렛저로 이르면 오는 6월, 늦어도 올 연말쯤 출시될 예정이다.","한글과컴퓨터그룹(이하 한컴)이 IBM과 손잡고 블록체인 서비스 개발에 착수했다.
한컴은 26일 서울 삼성동 코엑스 그랜드볼룸에서 사업발표회를 열고 “오피스와 보안 등 한컴제품을 연동 할 수 있는 블록체인 서비스를 내놓겠다”고 밝혔다. 이 서비스의 이름은 한컴에스렛저로 이르면 오는 6월, 늦어도 올 연말쯤 출시될 예정이다.

한컴에스렛저는 한컴의 보안계열사인 한컴시큐어가 개발을 담당하며 IBM의 블록체인 플랫폼 하이퍼렛저를 활용할 계획이다. 하이퍼렛저는 참여자를 제한하는 블록체인으로 코인과 같은 보상이 없다.

한컴은 한컴오피스 등 다양한 문서작성 프로그램과 한컴의 보안솔루션에 블록체인 기술을 접목, 상품화할 예정이다. 궁극적으로 정부가 추진하는 소프트웨어 입찰 사업이나 스마트시티 등 공공 블록체인 사업에 자사 서비스를 집어넣겠다는 속내다.

한컴 관계자는 “한컴그룹은 각사가 보유한 솔루션에 블록체인 기술을 접목해 혁신적인 사업모델을 제시할 것”이라며 “블록체인 기반의 전자정부 구현 등 정부 지원 사업을 토대로 한 행정서비스뿐만 아니라 금융, 계약, 자율주행 자동차, 헬스케어 등 스마트시티 사업영역에서 적극 활용할 계획”이라고 말했다."
비트코인,"워런 버핏 ""비트코인 사는 것은 투자 아니다""
","사람들이 사는 것 중에는 실제로 투자하는 것과 그렇지 않은 것이 있는데 비트코인은 후자에 해당한다는 것이 버핏의 설명이다. 그는 ""비트코인이나 다른 가상통화를 사면 실제로 아무 것도 생산하지 못하고 단지 다른 사람이 더 많이 지불할 것만을 기대하게 된다""고 지적했다. 그러면서 버핏은 ""이런 것은 투기적인 게임이나 도박에 지나지 않다""며 ""아무도 비트코인이 무엇인지 정확히 알지 못한다""고 했다.","오마하의 현인'으로 불리는 워런 버핏 버크셔 해서웨이 회장이 다시 한 번 가상통화에 대한 부정적인 시각을 드러냈다.

가상통화 전문매체 코인텔레그래프 등 주요 외신들에 따르면 버핏은 28일(현지시간) 네브래스카주 오마하에서 야후파이낸스와 인터뷰를 하면서 ""비트코인을 사는 것은 투자가 아니다""라고 말했다.

사람들이 사는 것 중에는 실제로 투자하는 것과 그렇지 않은 것이 있는데 비트코인은 후자에 해당한다는 것이 버핏의 설명이다. 그는 ""비트코인이나 다른 가상통화를 사면 실제로 아무 것도 생산하지 못하고 단지 다른 사람이 더 많이 지불할 것만을 기대하게 된다""고 지적했다. 그러면서 버핏은 ""이런 것은 투기적인 게임이나 도박에 지나지 않다""며 ""아무도 비트코인이 무엇인지 정확히 알지 못한다""고 했다.

버핏은 올초에도 가상통화가 '거품'이라며 맹공을 퍼부었다. ""가상통화가 나쁜 결말에 이를 것이라는 확신을 갖고 있다""며 ""모든 가상통화에 대해 5년물 풋옵션(자산가격이 내려가면 이익을 얻는 파생상품)을 구할 수 있다면 기꺼이 살 것""이라는 게 그의 주장이었다. 그는 과거에도 비트코인에 대한 투자는 전혀 고려하지 않고 있다고 밝힌 바 있다.

한편 29일 국내 거래소(업비트 기준)에서 10시 현재 대표 가상통화인 비트코인은 1014만원에 거래되고 있다. 전일 보다 소폭 오른 가격이다. 해외시세도 세계 최대 거래소인 비트피넥스 기준 9400달러다."
비트코인,"""비트코인, 산업혁명·인터넷보다 큰 기회""
","드레이퍼는 비트코인이 그가 투자했던 테슬라 등과 어떻게 다르냐는 질문에 ""비트코인은 테슬라, 스카이프, 핫메일 등을 모두 합한 것보다 더 크다""며 ""앞으로 4년 안에 비트코인 가격이 25만달러(약 2억7000만원)로 오를 것""이라고 전망했다. 그는 이어 ""앞으로 5년 이내에 커피숍에서 비트코인 등 가상통화(암호화폐)가 아닌 현금으로 결제하면 웃음거리가 될 것""이라며 ""현금을 사용할 필요가 없는 시대가 임박했다""고 말했다.","""비트코인은 철기와 르네상스, 산업혁명은 물론 인터넷보다도 큰 기회다""

전기자동차 업체 테슬라, 인터넷 전화 스카이프 등에 초기 투자해 큰 수익을 남긴 유명 벤처투자자 팀 드레이퍼는 23일(현지시간) 미 경제방송 CNBC와의 인터뷰에서 ""비트코인은 상상보다 훨씬 빠르고 널리 전 세계에 영향을 끼칠 것""이라며 이같이 말했다.

드레이퍼는 비트코인이 그가 투자했던 테슬라 등과 어떻게 다르냐는 질문에 ""비트코인은 테슬라, 스카이프, 핫메일 등을 모두 합한 것보다 더 크다""며 ""앞으로 4년 안에 비트코인 가격이 25만달러(약 2억7000만원)로 오를 것""이라고 전망했다.

그는 이어 ""앞으로 5년 이내에 커피숍에서 비트코인 등 가상통화(암호화폐)가 아닌 현금으로 결제하면 웃음거리가 될 것""이라며 ""현금을 사용할 필요가 없는 시대가 임박했다""고 말했다.

현재 유통되는 가상통화가 1500여개로 너무 많다는 지적에 대해서는 ""비트코인은 시장점유율이 압도적이며, 장기적으로 다른 가상통화와의 경쟁에서 승리할 것""이라고 답했다.

CNBC에 따르면 드레이퍼는 2014년 3만개의 비트코인을 샀다. 이날 가격 기준으로 2억6800만달러(2886억원) 규모다. "
비트코인,"MIT가 말하는 '비트코인 타도' 시나리오 3가지는?
","정부가 발행하는 검증된 코인, 비트코인 지위 간단히 무너뜨릴 것
페이스북 등 거대 소셜미디어 기업도 비슷한 지배력 발휘 가능해
모든 사물의 코인화… 블록체인 기반 '물물거래'로 비트코인 무용될 수도","미국 메사추세츠공대(MIT)가 대표 가상통화(암호화폐)인 비트코인 타도 방법을 내놓았다. 정부 또는 페이스북과 같은 거대 소셜미디어기업이 코인을 발행하거나, 모든 사물을 코인화하는 것으로 지금의 비트코인 지위를 무력화할 수 있다는 주장이다.

24일(현지시간) MIT의 과학기술전문지 MIT테크놀로지리뷰는 이 같은 내용이 담긴 3가지 비트코인 타도 시나리오를 제시했다.

◆시나리오1 ""정부차원의 코인 발행""=첫 번째 방법은 정부 차원의 코인 발행이다. 이미 실물 화폐 대신 온라인 송금이 자리잡고 있는 만큼, 중간 신원 확인 과정을 블록체인 기술로 대폭 줄인 국가 발행 가상통화가 충분히 등장할 수 있다는 것이다. MIT테크놀로지리뷰는 ""예를 들어 '연방코인'과 같은 국가 차원의 가상통화가 발행된다면 비트코인보다 훨씬 효율적일 것""이라며 ""아마도 탈중앙화 기반의 가상통화 수요 자체를 없애버릴 수도 있을 것""이라고 설명했다.

몇몇 전문가들은 연방코인 발행 이후의 과정을 연구했다. 세인트루이스 지역의 연방준비제도(FRB) 연구원 데이비드 안돌파토는 이미 비트코인 블록체인을 살짝 수정한 형식의 가상통화를 중앙은행이 발행하는 상황을 제시했다. 이후 예일대에 재학중인 사힐 굽타는 연방코인과 같은 통화가 어떻게 작용하는지에 대해 연구를 진행했다.

블록체인에 거래가 기록되는 연방코인은 블록체인과 거의 유사한 방식이다. 다만 검증되지 않은 불특정 다수가 블록체인 네트워크에 참여하는 것과 달리, 페드코인은 FRB와 같은 기관에 의해 관리된다. 굽타는 ""FRB외에도 뱅크오브아메리카, JP모건 등이 네트워크에 참여해 관리할 수도 있다""라며 ""말 그대로 믿을 수 있는 기관들에 의해 운영되는 것""이라고 말했다.

캐나다중앙은행도 이미 지난 2016년 이더리움 기반의 블록체인 기반 통화에 대한 연구를 진행한 바 있다. 이 연구에서는 국립 가상통화의 효율성이 비트코인을 넘어설 수도 있다는 결과가 나왔다. 블록체인 기술을 적극적으로 연구하고 있는 영국 중앙은행도 지난 2016년 국가 중앙은행이 발행하는 가상통화를 일부만 도입해도 세금과 거래 수수료 등을 줄이면서 국가총생산(GDP)을 3% 이상 끌어올릴 수 있다는 연구결과를 발표했다.

◆시나리오2 ""모든 것의 '코인화'""=비트코인을 무너뜨리는 두 번째 방법으로는 모든 것의 토큰화(코인화)가 제시됐다. 이 시나리오에서는 모든 경제활동이 초고효율화된 물물교환 시스템으로 진화한다. 모든 기업들이 각자의 가상통화를 발행하고, 자동화 교환시스템에서 거래하는 식이다. 예를 들어 '페이스북 코인'을 '도요타 코인'으로 바꾸고 싶으면 이 시스템이 자동으로 가치를 측정하고 알맞은 비율로 교환해준다.

이 같은 움직임은 이미 나타나고 있다. 블록체인 스타트업들 사이에선 기존 가상통화 뿐만 아니라 다양한 파생 가상통화들을 거래하는 서비스 개발이 트렌드가 된 상태다. 기성 기업들도 마찬가지다. 코닥은 지난 1월 사진의 권리를 담은 '코닥코인'을 발행한 바 있다.

기업들이 내놓는 코인은 근본적으로 기존의 온라인 상품권, 마일리지 등과 다르지 않다. 다만 블록체인 기반으로 옮기고 약간의 수정을 가할 뿐이다. 때문에 각 기업들이 발행하는 코인을 소비자들은 이질감 없이 받아들일 것이라는 분석이다.

캠벨 하비 듀크대 재정학 교수는 ""FRB가 미국을 대표하는 코인을 내놓지 못한다면, 사람들이 모든 것을 코인화하는 물결을 막을 수 없을 것""이라며 ""이 같은 물물거래 기반의 시스템은 일견 비효율적일지 몰라도 모든 상품과 서비스를 블록체인 상에서 코인화 시킨 뒤 이를 거래할 네트워크가 있다면 무척 효과적일 것""이라고 설명했다.

◆시나리오3 ""페이스북의 코인 점령""=마지막 시나리오는 페이스북과 같은 거대 소셜미디어 기업이 가상통화 시장을 점령하는 내용이다. 이 시나리오는 페이스북이 전용 비트코인 전자지갑 서비스를 실시하면서 시작된다. 20억명이 넘는 이용자들이 페이스북 내에서 비트코인을 이용하도록 하면서 비트코인 생태계에 대한 지배력을 키운다는 것이다.

MIT테크놀로지리뷰는 ""이미 비트코인을 이용했던 사람들도 훨씬 편리한 페이스북으로 이동할 것""이라며 ""아직 비트코인을 접하지 않았던 이들 역시 페이스북의 광고에 노출되며 결국 페이스북 판 비트코인 생태계에 편입될 것""이라고 설명했다. 이와 같은 작업과 동시에 페이스북은 은밀하게 코인 채굴 기능도 넣을 것이라고 내다봤다.

비트코인이 페이스북 생태계에 안착하면, 페이스북 측은 비트코인에서 독립해 자체 코인으로 이용자들을 끌어들일 것이라고 주장했다. 일반 이용자들은 복잡한 기술적 세부 사항에 관심이 적은 만큼, 자연스레 페이스북 코인으로 편입될 것이라는 예상이다. 이는 비트코인의 자리를 '페이스북 코인'이 대체하는 결과로 이어진다.

한편 이 같은 타도론에도 불구하고 비트코인 가격은 다시금 상승세를 타고 있다. 25일 오전 10시 현재 국내 가상통화 거래소 업비트 기준 1045만원을 기록하고 있다. 지난 달 14일 이후 42일만에 1000만원을 돌파했다. 700만원대를 전전하던 이달 초와 비교하면 47% 이상 오른 셈이다."
클라우드/빅데이터,"데이터 공부에 의외로 도움 되는 ‘공개 정보 분석 훈련’
","데이터 과학 관련 문제 해결 모델을 개발, 분석하는 플랫폼 기업 ‘캐글(Kaggle)’은 전 세계에서 활동 중인 데이터 과학자 조사 결과를 발표한 적이 있다. 캐글이 주최하는 데이터 과학 경연에선 대개 주최 측이 문제와 함께 실제 데이터 세트(Data Set)[1]와 평가 기준을 공개한다. 경연은 종종 적지 않은 상금을 걸고 진행되며, 정해진 기한 안에 최고 성과를 거둔 기관이 수상의 영예를 누린다.","지난 회차 칼럼에선 데이터 지능을 키우는 방법 중 하나로 ‘일상(이나 업무) 관련 문제를 데이터로 해결하는 방법’에 대해 소개했다. 실제로 사람들 대부분이 자신의 문제를 데이터로 풀어가는 과정에서 해결 방안을 찾을 수 있다. 문제 해결을 원하는 고객과 문제를 직접 풀어내는 데이터 과학자의 입장을 동시에 경험할 수도 있다. 그런데 데이터로 해결할 만한 문제 자체를 발견하기 어려울 땐 어떻게 해야 할까?

다행히 최근 데이터 가치에 대한 인식이 높아지면서 시중에 다양한 공개 데이터가 나와있다. 일례로 예전엔 극소수 관계자에게만 개방됐던 공공 데이터의 상당수가 일반에 공개된 상태다. 기업도 경영 활동 도중 수집한 데이터 중 일부를 개인정보 암호화 등 소정의 절차를 거쳐 공개하고 있다. 이 밖에 과학?미디어?스포츠 등 다양한 분야에서도 공개 데이터가 쏟아지고 있다.

이번 칼럼의 주제는 ‘데이터 학습 시 공개 데이터 활용하기’다. 독자의 이해를 돕기 위해 한 가지 ‘샘플 데이터’를 예로 들어 설명할 생각이다. 데이터 과학 관련 문제 해결 모델을 개발, 분석하는 플랫폼 기업 ‘캐글(Kaggle)’은 전 세계에서 활동 중인 데이터 과학자 조사 결과를 발표한 적이 있다. 캐글이 주최하는 데이터 과학 경연에선 대개 주최 측이 문제와 함께 실제 데이터 세트(Data Set)[1]와 평가 기준을 공개한다. 경연은 종종 적지 않은 상금을 걸고 진행되며, 정해진 기한 안에 최고 성과를 거둔 기관이 수상의 영예를 누린다.

이런 경연은 특정 기업이 주최해 1회성으로 진행되기도, 캐글 같은 전문 업체에 의해 치러지기도 한다. 지난해 말 캐글은 자사 웹사이트에 가입한 데이터 과학자를 대상으로 ‘데이터 과학을 공부하고 해당 분야에서 경력을 쌓는 방법’에 대한 조사를 진행했다. 머신러닝(machine learning) 관련 경연을 주로 주최했던 기업 특성상 조사 참여자가 데이터 과학자 전체를 대변한다고 보긴 어렵다. 하지만 총 응답자 수가 1만6700명에 이르는 등 상당한 규모를 갖춘 만큼 이제 막 데이터 과학을 공부하기 시작한 이라면 충분히 흥미를 느낄 만하다.

#1단계_연령?국적?교육수준 등 ‘기본 정보 분포’ 파악하기

설문 결과를 본격적으로 살피기 전 응답자의 ‘기본 정보’를 면밀히 들여다볼 필요가 있다. 우선 나이와 거주지. 아래 두 그래프에 따르면 이 조사 응답자의 대다수는 20대 초반부터 30대 초반까지의 미국?인도 거주자다(한국 국적자는 194명으로 20위권에 해당한다). 그래프에 나타나진 않았지만 약 85%는 남성이었다.

응답자의 교육 수준은 ‘석사> 학사> 박사’ 순(順)으로 많았다. 전공은 컴퓨터과학?수학?통계학이 다수를 차지했지만 기타 전공자 수도 만만찮아 수학과 통계학 전공자 수를 훌쩍 넘어섰다. 사회학이나 경영학 등 특이 전공자가 일부 눈에 띄긴 했지만 아직은 데이터 과학 분야가 이과 전공자의 영역이란 사실을 알 수 있다.

#2단계_지도?데이터 등 시각 자료로 데이터 ‘흐름’ 살피기

이처럼 기본 정보 분포 파악은 데이터 분석 작업의 기초로서 무척 중요하다. 이 사례의 경우, 응답자의 거주지 분포 확인 과정을 거치지 않는다면 추후 대부분의 응답이 미국과 인도에서 왔단 사실을 간과하기 쉽다(이는 자칫 데이터 분석 결과에 오류를 초래할 수 있다).

그럼 이번엔 좀 더 구체적인 분석으로 들어가보자. 국가별 데이터 과학자가 느끼는 삶의 질, 그리고 그에 영향을 끼치는 요인을 살펴볼 생각이다. 판단의 기준이 될 자료는 국가별 응답자의 직업 만족도와 보수, 구직 기간의 평균치를 보여주는 아래 표다.

위와 같은 표는 하나씩 뜯어보면 이해되지만 전체 추세를 파악하긴 어렵다. 특히 이 표에서처럼 지리적 정보(국가)를 시각화할 때 가장 좋은 방법은 지도를 활용하는 것이다. 아래 지도는 국가별 급여 수준 분포를 색상으로 보여준다. 급여 수준은 녹색이 진할수록 높고 빨간색이 진할수록 낮다. 한눈에 봐도 미국과 호주, 유럽 지역에 거주하는 데이터 과학자의 보수 수준이 높단 사실을 알 수 있다.

이번엔 유사한 방식으로 직업 만족도를 확인해볼 차례다. 결과는 아래 지도와 같다. 보수 수준 분포 때와 마찬가지로 서구권 국가의 수치가 비교적 높은 걸 확인할 수 있다. 특이한 건 러시아 데이터 과학자들이다. 보수 수준이 낮은데도 직업 만족도는 높은 편이기 때문. 반면, 아시아 지역 국가들은 보수 수준과 직업 만족도 둘 다 낮게 나타났다.

이처럼 지도를 활용하면 보수 수준과 직업 만족도의 지리적 분포를 쉽게 확인할 수 있다. 하지만 여전히 두 지표 간 상관관계를 파악하기엔 역부족이다. 이 작업을 수행하려면 보다 정교한 장치가 필요하다. 아래 그래프와 같은 일명 ‘스캐터 플롯(scatter plot)[2]’이 대표적이다. 언뜻 보면 보수 수준과 직업 만족도 사이에 여전히 뚜렷한 상관관계가 없는 것 같다. 하지만 국가별 소득 수준 차를 고려하면 (소득 수준 대비) 절대적 보수 수준보다 상대적 보수 수준이 더 많은 정보를 전달하는 지표일 수 있다.

그래서 이번엔 국가별 평균 급여를 1인당 국민소득으로 나눈 상대적 보수 수준을 활용, 아래 그래프를 만들었다. 이 그래프에 따르면 대부분의 국가에서 데이터 과학자는 평균 소득의 1.5배 내지 2배를 번다. 중국?인도 데이터 과학자는 평균 소득의 곱절 이상을 벌면서도 직업 만족도가 낮았다. 이런 결과를 볼 때 직업 만족도가 오로지 소득 수준에만 좌우되는 건 아니란 사실을 짐작할 수 있다(추가 요인을 찾아내는 일은 독자의 몫으로 남겨둔다).

이상과 같이 데이터 생활화의 한 방법으로 공개 데이터 활용 요령을 살펴봤다. 적절히 시각화된 자료를 바탕으로 일정 유형(pattern)을 찾아내는 데이터 분석의 묘미를 조금이나마 느꼈길 바란다. 이처럼 분야별로 공개된 자료를 데이터 학습 재료로 활용하면 여러 가지를 배울 수 있다. 이미 정리된 자료에선 얻기 힘은 통찰력(insight)을 발견할 수 있는 건 물론, 데이터를 보는 안목도 키울 수 있다. 캐글의 경우, 이 데이터를 활용?분석한 결과물에 상금을 지급하기도 했으니 그야말로 ‘일석삼조(一石三鳥)’라 할 수 있다. 내가 운영 중인 홈페이지 ‘데이터 지능 팟캐스트’에 접속하면 공개 데이터를 구할 수 있는 웹사이트와 분석 사례가 여러 개 소개돼 있으니 관심 있는 독자라면 참고해도 좋겠다."
