category,title,body,origin
"한화생명, 한화손보, 한화증권","한화손보, 삼성화재 이어 16일부터 車보험료 0.4% 내린다
","한화손보 관계자는 ""자동차상해특약 보험료를 10%가량 인하한 요인""이라며 ""전체보험료가 개인용은 0.4%, 업무용은 0.3% 인하되는 효과가 있다""고 설명했다. 앞서 업계 1위 삼성화재도 지난달 11일부터 개인용 및 업무용 차량에 대해 보험료를 0.8% 인하했고, MG손보도 지난달 1일부터 4.5%를 낮춘 바 있다.","한화손해보험이 10개월 만에 개인용 자동차보험료를 인하한다.

11일 손해보험업계에 따르면 한화손보는 오는 16일부터 개인용 자동차보험료를 0.4% 내릴 예정이다. 자동차보험료를 인하한 건 지난해 8월 1.6% 낮춘 이후 10개월 만이다. 

한화손보 관계자는 ""자동차상해특약 보험료를 10%가량 인하한 요인""이라며 ""전체보험료가 개인용은 0.4%, 업무용은 0.3% 인하되는 효과가 있다""고 설명했다.

앞서 업계 1위 삼성화재도 지난달 11일부터 개인용 및 업무용 차량에 대해 보험료를 0.8% 인하했고, MG손보도 지난달 1일부터 4.5%를 낮춘 바 있다.

이에 지난해처럼 손보업계 전반으로 자보료 인하 행렬이 확산될 가능성이 점쳐진다.

지난해에도 삼성화재를 비롯해 현대해상과 DB손해보험, KB손보, 메리츠화재, 한화손보, 롯데손보, 악사손보, 더케이손보 등 대부분 손보사들이 차 보험료 인하 행렬에 동참했다.

자동차보험은 보험사별로 서비스 격차가 크지 않아, 가격경쟁력이 중요한 시장이기 때문이다.

특히 작년에는 자동차보험 영업손익이 지난 2001년 이후 16년 만에 흑자를 기록하기도 해 인하 가능성이 높은 상황이다.

손해율도 소폭 개선됐다. 지난해 자동차보험 손해율은 80.9%로, 2010년(79.9%) 이후 10년 만에 최저치를 기록했다.

손보업계 관계자는 ""지난해 자동차보험 영업손익을 결정짓는 사업비율과 손해율이 모두 개선됐다""며 ""손보사들은 M/S(시장점유율) 유지를 위해 자보료 인하를 검토할 가능성이 있다""고 말했다.

다만 올해는 최저임금과 정비요금 인상으로 인한 보험료 인상 요인이 있어 출혈경쟁은 경계해야 한다는 지적도 나온다.

또 다른 관계자는 ""온라인 보험 가입 활성화로 인해 가격을 기반으로 보험사를 갈아타는 수요가 늘고 있다""며 ""다만 보험료 인하 여력이 없는데도 신규 가입자를 늘리기 위해 출혈경쟁을 하는 건 경계해야 한다""고 말했다.
"
"한화생명, 한화손보, 한화증권","한화손보, 1분기 영업익 420억원…전년동기比 21%↓
",한화손해보험은 올해 1분기 영업이익(잠정)이 작년 동기보다 20.6% 감소한 419억5600만 원으로 집계됐다고 11일 공시했다. 같은 기간 당기순이익은 294억 원으로 21.3% 줄었다.,한화손해보험은 올해 1분기 영업이익(잠정)이 작년 동기보다 20.6% 감소한 419억5600만 원으로 집계됐다고 11일 공시했다. 같은 기간 당기순이익은 294억 원으로 21.3% 줄었다.
"한화생명, 한화손보, 한화증권","한화생명, 전자금융 서비스 활성화 위해 약관 개정
","한화생명은 내달 1일 전자금융 서비스 기능 확대 등을 반영해 기본약관 및 이용약관을 변경한다. 모바일을 통한 출금이 가능해지면서 거래 한도가 조정되고, 간편 인증 해지 서비스를 시행하기 위해 해당내용을 반영키로 했다.  새 전자금융거래 약관에는 선불 전자지급수단 및 전자화폐로 지급하는 경우 추가, 바이오(생체)정보 문구 추가 등의 내용을 적용할 예정이다. ","한화생명이 새로운 전자금융거래 서비스 기능 추가에 앞서 약관을 개정한다.  

11일 보험업계에 따르면 한화생명은 내달 1일 전자금융 서비스 기능 확대 등을 반영해 기본약관 및 이용약관을 변경한다. 

모바일을 통한 출금이 가능해지면서 거래 한도가 조정되고, 간편 인증 해지 서비스를 시행하기 위해 해당내용을 반영키로 했다. 

새 전자금융거래 약관에는 선불 전자지급수단 및 전자화폐로 지급하는 경우 추가, 바이오(생체)정보 문구 추가 등의 내용을 적용할 예정이다. 

한화생명 관계자는 “블록체인기술 등 새로운 인증 기술 도입과 추가될 기능에 대비해 약관을 수정하게 됐다”며 “현재 모바일앱에서 지문인증, 홍체 인증방식을 사용중인데 개인의 생체 고유 특성을 활용한 생체인증방식 도입을 추가하는 내용도 검토하고 있다”고 말했다. 

한화생명은 2016년부터 스마트폰과 태블릿PC에서 보험료 납부, 청구, 해지 등의 업무를 처리할 수 있는 앱 ‘모바일센터’를 운영하고 있다. 

고객들은 해당 앱을 통해 실손보험금 및 100만원 이하의 사고보험금은 손쉽게 청구할 수 있다. 청구서류는 스마트기기 카메라로 촬영해 전송하고 처리과정은 앱으로 실시간 조회하면 된다. 

작년 9월에는 모바일 어플리케이션 이용을 위한 바이오 인증 서비스도 도입했다. 

지문이나 홍채 등 생체인증과 금융결제원의 바이오 인증이 결합돼 생체 인증으로 본인확인 절차를 진행할 수 있도록 한 것이다. 

한화생명은 안면인식, 음성, 장문 등으로 본인 인증 방식을 다양화해 더 많은 고객이 편리하게 모바일 센터를 이용할 수 있을 것으로 보고 있다. 

이외에도 설계사들의 활동지원을 위한 ‘터치+’ 앱도 활용해 업무 효율성을 높이고 있다. 고객의 다양한 상황을 분석해 우선적으로 관리해야 할 고객들을 설계사에게 알려주고 대응하도록 하는 방식이다.  

한화생명은 지난 2012년 생보업계 최초로 전자청약 시스템을 도입해 지속적으로 확대해 나가고 있다. 올해 3월 말 기준 한화생명의 전자청약률은 81.1%를 기록했다."
"한화생명, 한화손보, 한화증권","‘한화생명?손보?증권’ 포함 한화그룹 10개사 노조 뭉쳤다
","한화그룹노동조합협의회(이하 한화노협)는 지난달 30일 대전 모처에서 한화그룹 계열사 노동조합 위원장 등 관계자 20여명이 참석해 한화노협 2기를 출범했다고 10일 밝혔다. 한화노협은 지난 2016년 9월 한화손해보험과 한화테크윈, 한화토탈 세 노조가 뭉쳐 첫발을 내딛었다. 당시 한화테크윈(舊 삼성테크윈)소속 해고자 6명에 대한 전원 복직을 이끌어내기도 했다.","한화그룹 계열사 10곳의 노동조합이 뭉쳤다. 한화그룹 제조부문을 포함해 한화생명과 한화손해보험, 한화증권 등 핵심 금융계열사도 노조 연대에 동참하면서 한화그룹 노동조합의 목소리에 힘이 실릴 것으로 보인다.

한화그룹노동조합협의회(이하 한화노협)는 지난달 30일 대전 모처에서 한화그룹 계열사 노동조합 위원장 등 관계자 20여명이 참석해 한화노협 2기를 출범했다고 10일 밝혔다.

한화노협은 지난 2016년 9월 한화손해보험과 한화테크윈, 한화토탈 세 노조가 뭉쳐 첫발을 내딛었다. 당시 한화테크윈(舊 삼성테크윈)소속 해고자 6명에 대한 전원 복직을 이끌어내기도 했다.

한화노협 2기는 제조부문에서 한화테크윈, 한화토탈, 한화종합화학, 한화케미칼1공장, 한화케미칼2공장, 한화시스템 등 6개사 노동조합이 참여한다. 금융부문은 한화손해보험과 한화생명, 한화투자증권, 한화자산운용 등 4개사 노조가 동참한다. 총 10개 계열사 노동조합을 대표하는 한화그룹의 노동조합 대표 협의체로 자리매김하게 됐다. 

한화노협 2기 의장은 한화손보 새노조의 김기범 노조위원장이 맡는다. 

한화노협은 앞으로 계열사 공동으로 노동여건 개선 등 복지관련 협상과 임금단체협상을 추진할 계획이다. 계열사별 노조의 집중 현안을 공유해 공동의 요구안도 만들고 투쟁계획도 세우기로 했다.  

특히 최근 불거진 한화손보 교섭대표노동조합 선정과정의 불법행위 논란과 관련한 행정소송에 대해서도 한화노협이 공동대응하기로 했다. 

김기범 위원장은 ""한화노협은 단단한 연대를 형성하고 서로에게 큰 울타리가 돼 전 조합원들이 회사의 주체로써 노동자 권리를 찾도록 할 것""이라며 ""각 사 현황 공유를 통해 그룹이 계열사 노사관계에 깊숙이 지배, 개입하고 있음을 확인함으로써 그룹과 직접 소통하고 실질적인 교섭을 이끌어낼 계획""이라며 포부를 밝혔다."
"한화생명, 한화손보, 한화증권","'빅5의 꿈' 메리츠화재 김용범 vs 한화손보 박윤식
",두 회사 최고경영자(CEO)는 괄목할 만한 실적 향상을 이끌어냈다는 공통점이 있다. 김용범 메리츠화재 부회장은 2015년 2월 메리츠화재 대표로 취임해 고강도 구조조정으로 체질개선과 실적향상을 이끌어 2017년 연말 인사에서 승진했다. 박윤식 한화손보 사장은 제일화재 등과 합병 후 혼란기인 2013년 6월 대표이사로 취임해 실적향상을 이끌며 2018년 3월 정기주주총회에서 3연임에 성공한 장수 CEO다. ?,"메리츠화재와 한화손해보험은 각각 업계 5위와 6위의 손해보험사다. 메리츠화재는 자기자본과 순이익 등에서 한화손보를 압도하지만 손보업의 꽃인 자동차보험에서 한화손보에 뒤지고 있다. 

 두 회사 최고경영자(CEO)는 괄목할 만한 실적 향상을 이끌어냈다는 공통점이 있다. 김용범 메리츠화재 부회장은 2015년 2월 메리츠화재 대표로 취임해 고강도 구조조정으로 체질개선과 실적향상을 이끌어 2017년 연말 인사에서 승진했다. 박윤식 한화손보 사장은 제일화재 등과 합병 후 혼란기인 2013년 6월 대표이사로 취임해 실적향상을 이끌며 2018년 3월 정기주주총회에서 3연임에 성공한 장수 CEO다. ?
 
장기 임기로 접어든 김용범 부회장과 박윤식 사장은 실적 향상 외에 2021년 시행되는 새 국제회계기준(IFRS17)에 대비하기 위해 자본 확충에 주력해야 하는 과제를 안고 있다. 또 핀테크, 모바일, 데이터 기반의 IT 활용 역량을 고도화해 하루가 다르게 변하고 있는 금융 환경에 적극 대응하는 것도 두 사람에게 내려진 중대 과제다. 
 
# 김용범, 메리츠금융그룹 핵심 경영인…매해 사상 최고 실적  

김용범 메리츠화재 부회장은 메리츠금융지주 대표를 겸임하는 등 메리츠금융그룹의 핵심 CEO다. 조정호 메리츠금융그룹 회장의 두터운 신임을 받고 있는 것으로 풀이된다. 

김 부회장은 대한생명 증권부 투자분석팀에서 직장생활을 시작해 CSFB증권과 삼성화재를 거쳤다. 2011년 메리츠종금증권으로 자리를 옮겨 2012년 대표를 맡았다. 그는 2015년 2월부터 메리츠화재 대표를 맡아 2017년 연말 인사에서 부회장으로 승진했다. 

김용범 부회장은 보험업 경력이 별로 없다는 주변의 우려를 불식시키고 취임 첫해인 2015년 당기순이익 1690억 원을 달성했다. 이후 2016년 2372억 원, 2017년 3846억 원의 순이익을 기록하며 매해 사상 최고 실적을 경신하고 있다. 

김 부회장은 실용주의 경영 스타일로 유명하다. 메리츠화재에 복장 자율화, 정시 퇴근 등을 도입하고 격식이나 의전 등을 최소화하며 실질적 보고를 중시한다.? 그의 실용주의는 영업채널 다변화로 나타났다. 타 보험사와 제휴를 통해 보험 상품을 함께 파는 독립보험대리점(GA)과 소비자가 설계사 없이 온라인을 통해 보험상품에 가입하는 다이렉트 채널을 강화한 것이다. 

그가 대표로 취임한 이후 강력한 구조조정을 통한 비용 감소로 실적 상승에 탄력을 받았다는 평가도 나온다. 구조조정을 주도하면서 노동조합의 반발을 사기도 했다. 김 부회장이 메리츠화재 대표로 취임한 이후 희망퇴직 실시 등을 통해 회사를 떠난 인원은 700여 명에 달한다. 지역본부 폐쇄와 함께 영업점도 통폐합했다. 

구조조정으로 인한 영업인력 감소 부작용도 감지되고 있다. 채이배 바른미래당 의원의 2017년 10월 국정감사 자료에 따르면 메리츠화재는 최근 5년간 전체 민원 중 60.03%를 수용하지 않았다. 손보사 중 가장 높은 수치다. 이를 두고 강도 높은 구조조정에 직원 수가 줄어들며 고객들의 권익 보호에 소홀하게 된 것 아니냐는 지적이 나왔다.  

# 박윤식, 안팎 혼란기 구원투수…자동차보험 5위 도약 

한화손보는 생명보험업계 2위인 한화생명에 비해 위상이 약한 것이 사실이다. 한화손보는 대형 손보사로 분류되는 메리츠화재와 달리 중형 손보사로 평가돼 왔다. 2009년 한화손보와 제일화재가 합병하면서 상당기간 혼란이 존재했다. 하지만 박윤식 사장이 구원투수로 투입된 이후 상황은 달라졌다. 

1957년생인 박윤식 사장은 1988년 제일은행에 입사한 이후 줄곧 금융 전문가로 활동을 해오다 2003년 동부화재(현 DB손보)로 자리를 옮겨 상무와 부사장을 역임했다. 동부화재 시절 경험을 인정받은 그는 2013년 한화손보 부사장으로 자리를 옮긴 후 같은 해 6월 대표이사에 취임해 지금까지 한화손보를 이끌고 있다. 

 박 사장이 영입될 당시 한화손보는 실적 악화와 함께 그룹 총수 부재로 비상경영체제에 돌입한 상태였다. 안팎으로 혼란스러운 시점. 그래서인지 취임 첫해인 2013년 한화손보는 436억 원의 당기순손실을 기록했다. 박 사장은 취임 후 영업 부문을 수익성 위주로 재편하고 조직 안정화에 주력했다. 그는 혁신위원회를 신설하는 등 조직개편을 진행했고 6개월 단위로 혁신활동을 전개했다. 

또한 조직 생산성을 높이기 위해 부서를 줄이고 팀제 중심으로 기구조직 개편을 단행했으며 기존 유사 업무를 통폐합했다. 법인영업 부문은 타깃시장 매출 강화를 위해 사업본부와 영업부를 시장별로 재편해 특화했으며, 다이렉트 사업본부는 자동차와 장기보험의 종목별 차별화된 영업 강화를 위해 2개 영업부 체제로 전환했다.

 한화손보는 박 사장의 지휘 아래 자동차보험 부문에서 약진했다. 한화손보는 2016년부터 원수보험료 기준으로 메리츠화재를 제치고 5위를 지키고 있다. 특히 우량 고객을 많이 모으는 방식으로 성과를 내 보험금 지급 손실을 줄이는 전략을 취해 효과를 봤다. 

2014년 한화손보는 163억 원의 순이익을 내며 흑자전환에 성공했고 2015년 953억 원, 2016년 1116억 원, 2017년 1476억 원 등 꾸준한 실적개선을 이뤄내고 있다. 이는 박 사장의 체질개선 전략이 주효했다는 게 업계의 평이다. 한편 한화손보는 지난해 말 2600만 주 규모로 진행한 유상증자를 성공적으로 마무리 해 새로운 국제회계기준(IFRS17)에 대비하고 있다. 
 전문경영인 최고경영자(CEO)의 위상과 역할을 조명하며 한국 기업의 나아갈 길을 모색해본다. ?"
"한화생명, 한화손보, 한화증권","[단독] 한화생명, 고객 보험가입내역 수집 나선다
",한화생명은 오는 7월경 자사 보험 컨설팅 시스템인 ‘피플 라이크 유’ 애플리케이션에 통합 보험계좌조회 서비스(가칭)를 탑재한다. 고객이 개인정보 제공동의만 거치면 앱을 통해 가입한 보험가입내역을 한눈에 보여주는 서비스다. 이를 위해 한화생명은 ‘스크래핑(Scraping)’ 원천기술 보유업체와 제휴를 맺고 직접 서비스 개발에 나섰다.,"한화생명이 핀테크 기술을 활용해 잠재 고객의 보험가입내역 수집에 나설 예정이면서 적잖은 논란이 예상된다.

보험업계에 따르면 한화생명은 오는 7월경 자사 보험 컨설팅 시스템인 ‘피플 라이크 유’ 애플리케이션에 통합 보험계좌조회 서비스(가칭)를 탑재한다.

고객이 개인정보 제공동의만 거치면 앱을 통해 가입한 보험가입내역을 한눈에 보여주는 서비스다. 이를 위해 한화생명은 ‘스크래핑(Scraping)’ 원천기술 보유업체와 제휴를 맺고 직접 서비스 개발에 나섰다.

스크래핑은 고객이 공인인증서를 입력하는 순간 각 금융사의 다양한 계약정보를 자동으로 추출하는 대표적인 핀테크 서비스다.

향후 서비스가 시작되면 한화생명 설계사와 접촉한 개인의 전체 보험가입내역은 모두 한화생명 서버에 저장되고, 지속적인 업데이트를 통해 한화생명의 보험영업에 사용된다. 기존 보험계약 정보를 불러와 분석하고 부족한 보장에 대한 보험을 추천하는 식이다.

보험사가 직접 핀테크 기술을 활용해 보험영업에 나서는 것은 이번이 처음이다. 보험사가 홈쇼핑이나 인터넷을 통해 잠재 고객의 휴대폰번호 등 단순 개인정보를 취득하는 것과 달리 스크래핑은 타 보험사에서 가입한 민감 정보(보험가입내역)까지 끌어 모을 수 있다.

일각에서는 보험사가 직접 수집한 보험계약정보의 부작용을 우려하고 있다. 핀테크를 활용한 새로운 금융서비스 창출이 아닌 보험영업 목적에만 치중될 수 있다는 지적이다.

한 핀테크기업 관계자는 “잠재고객 DB를 활용한 보험영업이 중요한 보험사에서 자체적으로 모든 경쟁사의 보험계약정보를 저장하고 활용할 경우 무분별한 보험영업으로 민원만 가중될 우려가 있다”며 “금융당국이 추진하는 국내 핀테크 산업 육성 방안이 시작도 못하고 사장될 가능성이 높다”고 말했다.

보험사가 핀테크 기술을 이용해 개인정보를 수집, 이익창출 수단(보험 영업)으로 활용할 수 있는지에 대한 법적 근거는 찾아볼 수 없다는 것도 금융당국 및 관련업계의 중론이다.

일부 대형보험사에서도 스크래핑 기술을 활용한 보험계약정보 집적에 관심을 보이고 있지만 최종 의사결정 단계에서 법적인 검토를 지속하고 있다.

금융당국도 한화생명의 사례처럼 금융사의 핀테크 산업 진출에 신중한 입장이다. 금융위원회가 지난 3월 발표한 ‘핀테크 혁신 활성화 방안’의 세부과제로 제시한 ‘본인신용정보 관리업’ 도입도 핀테크 기업이 다양한 금융서비스를 개발하는데 필요한 법적 근거를 마련해주기 위함이다.

현재 본인신용정보 관리업 대상에 금융사 등 대형자본이 포함될지 여부는 논의 중에 있다. 핀테크 기업들의 법적인 보호 및 생태계 발전을 위한 방안이 자칫 대형 금융사의 사익 추구에 매몰될 수 있다는 우려에서다.

금융위 신용정보팀 관계자는 “본인신용정보 관리업 도입의 원 목적은 핀테크 산업의 육성과 발전을 위해 모호했던 법적 근거를 만들어주려는 것”이라며 “대형 금융사가 본인 신용정보관리업 대상에 포함될 경우 발생할 부작용도 고려하고 있다. 적용 대상을 다각도로 검토 중”이라고 말했다.

이에 대해 한화생명 관계자는 “보험사가 스크래핑을 직접 운영할 경우 보험계약자들의 정확한 정보를 수집할 수 있고, 보안이나 비용 측면에서 외부 업체에 위탁하는 것보다 나은 결과를 만들 수 있다”며 “다만 금융당국의 핀테크 혁신 활성화 방안에 따라 본인신용정보 관리업에 지정대리인을 둬야할 경우 외부 위탁업체를 선정하는 등 상응하는 조치를 취할 것”이라고 말했다."
