category,title,body,origin
비트코인,"올해 2분기 ICO 피싱 피해 25억원 달해…대부분 '이더리움' 기반
","카스퍼스키 연구소는 암호화폐 투자자를 유인하는 피싱 사이트를 연구해 '2018 2분기 스팸 및 피싱' 보고서를 발표했다. 조사에 따르면 피싱 범죄자들은 아웃바운드 이메일에 가짜 크라우드펀딩 링크를 걸어놓는 등, 투자자가 범죄자 지갑으로 암호화 자산을 보내도록 다양한 수법을 동원했다. 한편, 사이트 대부분이 이더리움 기반 프로젝트와 관련되어 있다고 알려졌다. 카스퍼스키 연구소는 ""신규 ICO 프로젝트를 사칭해, 신규 토큰에 초기 투자하고 싶어하는 투자자들의 돈을 갈취했다. 심지어 공식 웹사이트 개설 전에 피싱 사이트가 등장하는 경우도 있다""고 설명했다.","올해 2분기 ICO 피싱 사기 피해 규모가 약 25억7,600만원(미화 230만 달러)에 달한다는 보고서가 나왔다.

19일(현지시간) CCN 보도에 따르면, 카스퍼스키 연구소는 암호화폐 투자자를 유인하는 피싱 사이트를 연구해 '2018 2분기 스팸 및 피싱' 보고서를 발표했다.

조사에 따르면 피싱 범죄자들은 아웃바운드 이메일에 가짜 크라우드펀딩 링크를 걸어놓는 등, 투자자가 범죄자 지갑으로 암호화 자산을 보내도록 다양한 수법을 동원했다. 한편, 사이트 대부분이 이더리움 기반 프로젝트와 관련되어 있다고 알려졌다.

카스퍼스키 연구소는 ""신규 ICO 프로젝트를 사칭해, 신규 토큰에 초기 투자하고 싶어하는 투자자들의 돈을 갈취했다. 심지어 공식 웹사이트 개설 전에 피싱 사이트가 등장하는 경우도 있다""고 설명했다.

최근 해커들이 보이스 및 비디오콜 앱 개발 프로젝트 '엑스퍼티(Experty)' 사이트에서 잠재 투자자 정보를 훔쳐 투자자를 유인하고, 이더리움 1억6천만원(미화 15만 달러) 상당을 빼앗은 사례도 있었다.

텔레그램 ICO는 가짜 사이트가 약 12개 발견됐으며, 프리세일 종료 시점까지 실제 프리세일 유치금액에 달하는 사기 피해가 발생한 것으로 알려졌다.

한편, 미국의 한 암호화폐 투자자는 해킹 책임을 자신의 정보를 보유하고 있던 AT&T 통신사의 '고의적 태만'에 있다고 주장하며 소송을 제기하기도 했다.

다국적 사이버보안 기업인 카스퍼스키 연구소는 유명 암호화폐 지갑 및 거래소를 사칭한 피싱 웹사이트 접속을 5만8,000건이나 막았다고 밝혔다.

카스퍼스키의 수석 안티바이러스 전문가 알렉산더 고스테프(Alexander Gostev)는 ""작년 파악된 공격은 2,000건이며, 이러한 해킹 및 피싱으로 약 3,361억원(미화 3억 달러) 피해가 났다""고 설명했다.

또한 ""보통 HTTPS 인증 사이트는 피싱 사이트로 의심하지 않는 경우가 많은데, 보안 페이지 중 피싱 사이트가 발견된 경우가 있었다""면서, 인증 방식이 허술하다고 지적했다."
비트코인,"업비트, 상반기 1억달러 수익 올려…""빗썸 확실히 제쳤다""
","CCN은 한국 금융감독원 전자공시시스템(DART)에 공시된 자료를 인용한 보도에서 업비트를 운영하는 두나무의 상반기 당기순이익이 1억 달러가 넘었다고 전했다. 한국에서 두 번째로 큰 거래 플랫폼인 빗썸(Bithumb)을 운영하는 비티씨코리아닷컴의 상반기 당기순이익은 3,900만 달러에 그쳤다.  업비트는 2017년 출시 이후 빗썸보다 거의 3배 높은 최고의 분기 거래이익을 남겼다. 반면 작년에 빗썸은 공식적으로 자사의 연간 이익을 4억 달러라고 보고했으나 2018년에는 20% 미만으로 감소했다.","약세장과 거래량 감소에도 불구하고 한국 최대의 암호화폐 거래소인 업비트(UPbit)는 올해 상반기에 1억 달러의 이익을 기록했다.

24일(현지시간) 해외 언론 CCN은 한국 금융감독원 전자공시시스템(DART)에 공시된 자료를 인용한 보도에서 업비트를 운영하는 두나무의 상반기 당기순이익이 1억 달러가 넘었다고 전했다. 한국에서 두 번째로 큰 거래 플랫폼인 빗썸(Bithumb)을 운영하는 비티씨코리아닷컴의 상반기 당기순이익은 3,900만 달러에 그쳤다. 

업비트는 2017년 출시 이후 빗썸보다 거의 3배 높은 최고의 분기 거래이익을 남겼다. 반면 작년에 빗썸은 공식적으로 자사의 연간 이익을 4억 달러라고 보고했으나 2018년에는 20% 미만으로 감소했다.

CCN은 카카오 관계사인 두나무가 업비트의 운영에 참여했다는 점에서 업비트가 주요 글로벌 암호화폐 거래소로 부상하는 데 중요한 역할을 했다고 분석했다. 또한 카카오가 제공하는 서비스는 앞으로도 계속 업비트에 긍정적인 영향을 미칠 것이기 때문에 향후 수개월 내에 업비트의 수익률은 크게 상승할 것으로 내다봤다. 실제 카카오는 최근 출시된 이후 핀테크 시장점유율의 90%를 점유하고 있는 카카오페이와 암호화폐를 통합하려는 의도를 공개했으며, 이미 카카오페이는 업비트와 호환이 되고 있다.

반면 CCN는 빗썸의 이익이 크게 감소한 이유에 대해서는 한국 암호화폐 거래 시장이 위축된 영향이기 보다는 지난 6월에 발생한 4천만 달러의 해킹 사고와 이에 따른 1개월 간의 운영 정지 탓으로 풀이했다. 실제 빗썸의 복구 작업에는 회사 자금 2천만 달러가 소요됐다.

한편 업비트는 지난 5월10~11일 사기 및 사전자기록 위작 혐의로 검찰에 의해 압수수색을 당했다. 당시 검찰은 업비트가 전산을 위조해 부당한 이득을 챙겼다고 주장했다. 현재 검찰은 업비트를 압수수색한 지 100일이 지나도록 기소하지 못하고 있어 혐의 입증에 실패한 것 아니냐는 관측이 나오고 있다. 만약 업비트가 혐의를 벗는다면 암호화폐 시장에 긍정적인 뉴스가 될 것으로 보인다."
비트코인,"중국의 이중성...블록체인은 '육성', 암호화폐는 '철퇴'
","현재 CNFRRO에서 차단을 위해 파악한 해외거래소 IP주소는 124곳으로 알려졌다. 앞서 2017년 9월 중국인민은행(People's Bank of China)이 중국내 ICO 및 암호화폐 거래를 금지한 후 온라인 상에서의 단속과 차단이 강화되고 있다. 중국 SNS 위챗(Wechat)은 지난 3월 7일 암호화폐 거래소 계정을, 8월 21일에는 암호화폐ㆍ블록체인 미디어 계정을 연이어 차단했다.  이런 암호화폐 규제와 별개로 중국 정부기관들은 블록체인 기술에 관심을 보이고 있다.","블록체인과 암호화폐에 대한 중국 정부의 방침이 이중적이다. 

23일(현지시간) 중국 국영핀테크위기관리부(China National Fintech Risk Rectification Office, 이하 CNFRRO)는 현지 매체를 통해 중국에서 해외 접속가능한 암호화폐 거래소를 차단할 것이라고 밝혔다.

현재 CNFRRO에서 차단을 위해 파악한 해외거래소 IP주소는 124곳으로 알려졌다. 앞서 2017년 9월 중국인민은행(People's Bank of China)이 중국내 ICO 및 암호화폐 거래를 금지한 후 온라인 상에서의 단속과 차단이 강화되고 있다. 중국 SNS 위챗(Wechat)은 지난 3월 7일 암호화폐 거래소 계정을, 8월 21일에는 암호화폐ㆍ블록체인 미디어 계정을 연이어 차단했다. 

이런 암호화폐 규제와 별개로 중국 정부기관들은 블록체인 기술에 관심을 보이고 있다.

앞서 4월 항저우시 지방정부는 투자사들과 16억달러(한화 1조7939억2000만원 상당) 규모의 블록체인 혁신 기금을 출범했다. 또 7월 23일 난징시 지방정부와 베이징 중관춘블록체인산업연맹은 14억5300만달러(한화 1조6295억3950만원 상당) 규모의 블록체인 산업 발전 기금을 출범했다. 같은 달 31일 중국 국가언론총국 연구센터는 블록체인 및 암호화 기술 전문가를 고용중이라 밝혔다. 8월 1일 웅안 지방정부는 이더리움 플랫폼 기반 블록체인 허브도시 개발을 진행중이라 밝혔다. 같은 달 13일에는 중국 공산당이 블록체인 기술 및 활용안 입문서를 발표했다."
비트코인,"블록체인 거품이라던 워즈니악, 블록체인 사업 시작
","워즈니악은 비트코인이 세계 공용 국제 통화가 되어야 한다고 주장하면서도 블록체인 기술에 대해서는 버블 닷컴 시대의 유행, 거품에 지나지 않는다며 폄하했었다. 그랬던 그가 블록체인 회사에 처음으로 참여했다고 밝히며 그동안 블록체인에 대해 제대로 이해하지 못했음을 인정했다. 그가 참여한 업체는 에퀴 캐피탈(Equi Capital)인데 유명 란제리 브랜드 울티모의 창업자 미셸 모네(Michelle Mone)가 설립했고 최근 추진하던 ICO 프로젝트가 어려움을 겪고 있는 것으로 알려졌다. 구체적인 사업 내용에 대해서는 설명하지 않았지만 말뿐인 가짜가 아닌 실질적인 가치를 창출할 수 있는 접근 방식을 취하고 있다며 차별화된 무언 가를 준비하고 있음을 암시했다. 두바이 부동산 사업에 투자해 큰 성과를 올린 많은 투자자들이 함께 하고 있다는 말도 덧붙였다.","불과 두 달 전까지만 해도 블록체인은 인터넷 공간에서 벌어지는 실험적 성격의 거품에 불과하다며 폄하했던 애플 공동 창업자 스티브 워즈니악이 돌연 입장을 바꿔 블록체인 사업을 곧 시작할 거라고 체인지익스체인지(ChainXChange) 블록체인 콘퍼런스에서는 21일(현지시각) 밝혔다고 CNN이 전했다.

워즈니악은 비트코인이 세계 공용 국제 통화가 되어야 한다고 주장하면서도 블록체인 기술에 대해서는 버블 닷컴 시대의 유행, 거품에 지나지 않는다며 폄하했었다. 그랬던 그가 블록체인 회사에 처음으로 참여했다고 밝히며 그동안 블록체인에 대해 제대로 이해하지 못했음을 인정했다.

그가 참여한 업체는 에퀴 캐피탈(Equi Capital)인데 유명 란제리 브랜드 울티모의 창업자 미셸 모네(Michelle Mone)가 설립했고 최근 추진하던 ICO 프로젝트가 어려움을 겪고 있는 것으로 알려졌다. 구체적인 사업 내용에 대해서는 설명하지 않았지만 말뿐인 가짜가 아닌 실질적인 가치를 창출할 수 있는 접근 방식을 취하고 있다며 차별화된 무언 가를 준비하고 있음을 암시했다. 두바이 부동산 사업에 투자해 큰 성과를 올린 많은 투자자들이 함께 하고 있다는 말도 덧붙였다.

워즈니악이 참여한 회사 본사는 지중해에 위치한 몰타(Malta)를 언급했는데 몰타는 올해 블록체인 관련 법안을 연이어 제정하고 관련 기업 유치에 힘을 쏟으며 유럽 블록체인 산업 허브가 되는 것을 노리고 있다. 오는 11월 대규모 블록체인 서밋이 준비 중으로 워즈니악의 블록체인 사업에 대한 구체적인 내용이 이때 공개될 것이라는 예상이다."
비트코인,"中 블록체인 순위, 이오스 부동 1위…비트코인 17위→10위
","중국 8월 블록체인 순위에서 이오스가 1위 자리를 지켰으며 비트코인은 17위에서 10위로 순위가 올랐다. 선정기관 CCID와 CSTC는 칭화대, 베이징대 등 중국 유수 대학의 교수진과 연구원들이 대거 참여하고 있다. 기관은 비트코인, 이더리움 등 퍼블릭 블록체인 네트워크를 응용 및 기술 측면에서 평가해 순위를 정하고 있다.","중국 정부가 지원하고, 중국 전자정보 산업개발 연구소(CCID) 및 중국 소프트웨어 테스팅센터(CSTC)가 선정한 8월 블록체인 순위가 나왔다.

20일(현지시간) CCN 보도에 따르면, 중국 8월 블록체인 순위에서 이오스가 1위 자리를 지켰으며 비트코인은 17위에서 10위로 순위가 올랐다.

선정기관 CCID와 CSTC는 칭화대, 베이징대 등 중국 유수 대학의 교수진과 연구원들이 대거 참여하고 있다. 기관은 비트코인, 이더리움 등 퍼블릭 블록체인 네트워크를 응용 및 기술 측면에서 평가해 순위를 정하고 있다.

이달에는 이오스가 1위, 이더리움은 2위, 비트코인은 10위에 올랐다. 코모도(Komodo), 네뷸러스(Nebulas), 네오(NEO), 스텔라(Stella), 리스크(Lisk), GX체인(GXChain), 스팀(Steem)은 응용 및 기술 측면에서 높은 점수를 받으며, 비트코인을 앞질렀다.

비트코인은 다른 암호화폐의 기술 발전이나 코드베이스 변화가 없는 상태에서, 가치 저장 수단으로서 가능성을 증명하며 지난 순위 17위에서 10위로 올랐다. 또한, 장기 기록 보유 및 '최초의 블록체인·암호화폐'라는 위상을 통해 '혁신 카테고리'에서 높은 점수를 받고 있다.

기관은 응용 및 기술을 핵심 평가 기준으로 삼기 때문에, 탈중앙 앱(DApps)을 지원하는 스마트 컨트랙트 프로토콜과 블록체인 네트워크가 항상 높은 순위를 점하게 된다. 응용 평가는 블록체인의 활용성을, 기술 평가는 확장성과 수용력을 고려한다.

이오스는 기타 블록체인과 비교해 큰 규모의 거래를 처리할 수 있는 지분증명(PoS) 합의 알고리즘이 높이 평가 받으며, 가장 높은 기술 점수(104.3점)를 받았다.

네뷸러스의 경우 6,800개 댑과 초당 3만5천 건의 거래를 지원하며, 6위를 차지했다."
클라우드/빅데이터,"개인정보 빅데이터 ‘판도라의 상자’가 열릴까
","정부가 데이터경제(빅데이터) 활성화 명목으로 산업계의 요구대로 ‘규제혁신’을 추진하면 이런 일들이 가능해진다. 빅데이터에 대한 규제완화가 개인정보 보호 장치 풀림을 동반하기 때문에 시민들의 일상에 미치는 영향이 크지만, 다른 규제완화 건 논의보다 상대적으로 주목받지 못했다. 정보인권 관련 시민·사회단체들이 이번 규제완화가 부를 개인정보 침해 우려에 대해 목소리를 높이는 이유다.","스마트폰 사용 과정에서 수집된 나의 위치정보나 병원 진료기록, 신용카드 결제내역, 인터넷 검색기록, 인터넷 쇼핑몰 구매 내역 등이 ‘나의 이름이 지워진’ 채로 나의 ‘동의 없이’ 다른 사람에게 넘어간다면 어떨까? 나는 전혀 알지 못하는 기업이 이런 정보를 조합해, 나에 대해서 나보다 더 잘 알고, 나에게 최적화된 서비스를 제안하면 어떤 기분이 들까?
정부가 데이터경제(빅데이터) 활성화 명목으로 산업계의 요구대로 ‘규제혁신’을 추진하면 이런 일들이 가능해진다. 빅데이터에 대한 규제완화가 개인정보 보호 장치 풀림을 동반하기 때문에 시민들의 일상에 미치는 영향이 크지만, 다른 규제완화 건 논의보다 상대적으로 주목받지 못했다. 정보인권 관련 시민·사회단체들이 이번 규제완화가 부를 개인정보 침해 우려에 대해 목소리를 높이는 이유다.
정부는 오는 23일 ‘데이터경제 활성화 규제혁신 행사’를 열어 데이터분야 규제완화에 관한 입법방향을 제시할 계획이다. 정부는 “4차 산업혁명 시대 새로운 가치 창출의 원천으로 꼽히는 데이터분야 규제혁신을 통해 산업육성과 국민 삶의 질 향상을 이끌겠다”며 규제 완화 필요성을 강조하고 있다. ‘새로운 가치’의 기본은 ‘데이터’고, ‘양질의 데이터’는 개인정보에서 나오는데, 현재 개인정보보호법이 정보주체의 ‘동의’ 없이는 제 3자 제공 등이 불가능했던 점을 개선하겠다는 것이다.
이 때문에 정부는 4차산업혁명위원회 등을 통해 행정안전부·금융위원회·방송통신위원회·과학기술정보통신부와 시민·사회단체들의 의견을 수렴해왔다. 일단 정부와 시민사회·산업계는 지난 4월 유럽연합 일반개인정보보호규정(GDPR)에서 ‘가명정보’의 개념을 가져와 개인정보보호법에 명시하고, 이를 개인정보 주체의 동의 없이도 활용 수 있도록 하자는데 합의했다. 가명정보는 개인정보를 ‘추가 정보와 결합하지 않고는 더이상 합리적인 방법으로는 특정 개인을 알아볼 수 없도록 가공처리’한 것을 말한다.
문제는 이 가명정보의 활용범위다. 정부·시민사회·산업계는 가명정보 활용범위를 “공익을 위한 기록 보존의 목적, 학술 연구 또는 학술 및 연구 목적, 통계 목적”으로 정하기로 했다. 그런데 이 가운데 연구·통계에 기업의 영리목적 활동이 포함되는지를 두고 시민사회와 정부 사이의 견해차가 좁혀지지 않은 상태다.
시민·사회단체들은 ‘학술 연구’는 말 그대로 ‘학술 목적 연구’로, 활용범위를 공익 목적으로 한정해야 한다고 주장한다. ‘가명정보’라 할지라도 추가적인 정보를 활용해 재식별해내는 것이 불가능한 것은 아니고, 기업에 맡겨둘 경우 프라이버시 침해 가능성이 높아진다는 이유에서다. 더불어민주당 원내수석부대표인 진선미 의원이 발의한 개인정보보호법 개정안도 가명정보의 활용범위를 ‘공익적 목적’으로 한정해두고 있다. 반면, 정부는 사실상 가명정보 활용을 제한없이 열어둬야 한다는 기조다. 과기정통부는 “학술을 위한 연구 뿐만 아니라 산업적 목적의 연구 및 시장조사를 위한 목적에서도 가명정보를 이용가능하다는 점을 법률에 명시적으로 규정해야 한다”며 “모든 산업 영역에서의 데이터를 활용한 신기술 발전과 산업의 활성화를 도모해야 한다”는 입장이다.
사실 이 논란은 유럽연합 일반개인정보보호규정의 문구 해석에서 시작됐다. 그런데 유럽연합은 기업의 영리목적 가명정보 활용을 허용할 것인지에 대한 명시적 언급을 한 적이 없어, 대통령 직속 개인정보보호위원회(개보위)는 활용범위에 관한 법률 개정에 신중해야 한다는 의견을 내기도 했다.
개보위는 지난 13일 김규환 자유한국당 의원이 개인정보보호법 개정안을 만들며 가명정보의 활용목적에 ‘서비스 제공 및 개선’을 포함시킨 데 대해 “서비스의 종류 또는 범위에 제한이 없이 사실상 가명정보를 무제한적으로 활용할 수 있는 것으로 해석될 수 있어 해당 목적을 예측 가능하도록 구체화할 필요가 있다”며 “유럽연합을 비롯한 주요 선진국의 개인정보보호법에도 가명정보를 영리목적으로 활용할 수 있다는 명시적 규정은 파악되지 않고 있다”고 밝혔다.
오병일 진보네트워크센터 정책활동가는 “혼란스러운 개인정보 보호 법제 정비와 감독기구 강화없이 개인정보 규제 완화와 활용만을 얘기하는 것은 이전 정부의 과오를 되풀이하는 것”이라며 “현재의 규제 완화 드라이브는 촛불 민심의 반발을 초래할 것”이라고 말했다."
