category,title,body,origin
"한화생명, 한화손보, 한화증권","한화S&C, 미래에셋생명 IT시스템 통합 완료
","한화S&C가 주관한 미래에셋생명과 PCA생명의 시스템 통합은 지난 2017년 6월부터 10개월에 걸쳐 진행됐으며, 지난 3월 5일 시스템 오픈 이후 2개월여의 안정화를 거쳤다. 금번 프로젝트를 통해 양사의 영업자동화(SFA)시스템, 홈페이지 및 방카슈랑스 등 채널계 시스템과, 업무처리를 위한 기간계 시스템, 콜센터와 그룹웨어 등 독립 시스템 등이 통합됐다.","한화S&C(대표 김경한)는 23일 여의도 미래에셋생명 본사에서 미래에셋생명과 PCA생명의 합병에 따른 'IT 시스템 통합' 사업의 완료보고회를 진행했다고 밝혔다.
한화S&C가 주관한 미래에셋생명과 PCA생명의 시스템 통합은 지난 2017년 6월부터 10개월에 걸쳐 진행됐으며, 지난 3월 5일 시스템 오픈 이후 2개월여의 안정화를 거쳤다.
금번 프로젝트를 통해 양사의 영업자동화(SFA)시스템, 홈페이지 및 방카슈랑스 등 채널계 시스템과, 업무처리를 위한 기간계 시스템, 콜센터와 그룹웨어 등 독립 시스템 등이 통합됐다.
또한, 데이터 전환과 상품 정보 반영도 성공적으로 완료했으며, 시스템 통합에 따른 개발 및 운영 환경도 구성했다.
한화S&C 관계자는 ""미래에셋생명은 금번 시스템 통합으로 비즈니스 연속성을 확보하고 고객에게 안정적인 서비스를 제공할 수 있게 됐다""며 ""비용 및 운영 효율성을 높이는 등 IT 시너지를 창출할 수 있게 됐다""고 설명했다."
"한화생명, 한화손보, 한화증권","한화생명 조재훈 부장 ""IR는 기업-시장 연결하는 종합예술""
","조 부장은 지난 2010년 3월 한화생명이 상장을 하며 IR 업무를 담당했다. IR 업무는 회사의 경영 현황을 투자자에게 긍정적으로 알려 투자를 이끌어내야 하는 고강도 업무다. 그는 IR 업무를 담당하면서 오전에는 회사에서 업무를 보고, 오후에는 기관투자자들을 일대일로 만나는 일과를 반복했다. 홍콩, 싱가포르, 런던, 뉴욕 등을 오가며 글로벌 기관투자자도 지속적으로 만났다. ","""IR(Investor Relations) 업무는 회사와 자본시장을 연결하는 종합적 행위예술이죠."" 

한화생명의 글로벌 신용평가와 해외 신종자본증권 발행 실무 총괄을 맡은 한화생명 조재훈 부장(사진)은 ""IR 업무는 회사의 경영 전반을 파악하는 동시에 이를 잘 가공해 투자자에게 알려야 하고 동시에 해박한 업무지식과 원만한 대인관계, 글로벌 감각도 요구된다""고 설명했다. 

조 부장은 지난 2010년 3월 한화생명이 상장을 하며 IR 업무를 담당했다. IR 업무는 회사의 경영 현황을 투자자에게 긍정적으로 알려 투자를 이끌어내야 하는 고강도 업무다. 그는 IR 업무를 담당하면서 오전에는 회사에서 업무를 보고, 오후에는 기관투자자들을 일대일로 만나는 일과를 반복했다. 홍콩, 싱가포르, 런던, 뉴욕 등을 오가며 글로벌 기관투자자도 지속적으로 만났다. 

이런 그에게 지난해 8월 해외 신용평가기관의 신용평가 등급을 획득하라는 특명이 떨어졌다. 그는 ""당시 북한 핵실험 등으로 한반도의 지정학적 리스크가 확대되는 시기이다 보니 무디스와 피치 등 글로벌 신용평가사를 만난 자리에서 개별기업의 신용도에 앞서 국가신용 리스크를 논의하게 됐다""면서 ""개별회사의 신용도를 넘어선 국가적 신용리스크 요인이 중요하게 작용하던 시기였기 때문에 차남규 부회장을 비롯한 경영진의 전폭적 지원이 없이는 불가능한 일이었다""고 말했다. 

조 부장은 신용등급 획득을 위한 준비를 위해 추석 연휴도 반납하는 강행군을 이어갔다. 경영진과 신용평가사 간 주요 경영현안을 논의하는 경영진 미팅을 성공적으로 마치고 신용평가사와 12월까지 신용등급 평가 과정을 진행했다. 

이 같은 노력에 힘입어 지난 1월 한화생명은 무디스로부터 A1, 피치로부터 A+ 등급을 받았다. 이후 한화생명은 새로운 회계기준에 대비해 선제적 자본확충을 위한 해외 신종자본증권 10억달러어치를 발행하기로 결정했다. 

조 부장은 숨 돌릴 틈도 없이 다시 해외 신종자본증권 발행 작업에 매진했고, 이후 한화생명은 지난 17일 해외 신종자본증권 수요예측에서 총 예정금액 10억달러를 초과하는 수요가 몰리며 성공적으로 발행을 완료했다. 

그는 ""지난해 8월부터 약 9개월간 함께한 IR파트 직원들에게 감사의 말을 하고 싶다""면서 ""직원들의 헌신적 도움이 없었다면 결코 이뤄낼 수 없는 성공적 딜(거래)이었다""고 소회를 밝혔다. 

조 부장은 최근 새로운 도전에 나섰다. 경영분석 파트장으로 자리를 옮겨 회사의 전반적 경영상태를 점검하고 분석하는 업무를 하는 조 부장은 ""해외 투자업무 경험을 살려 한화생명이 글로벌 생명보험사로 도약하는 데 일익을 담당하고 싶다""고 포부를 밝혔다. "
"한화생명, 한화손보, 한화증권","한화그룹, 지배구조 개편 '초읽기'…에이치솔루션 향방은
",오는 5월로 예정된 한화그룹 지배구조 개편은 소규모 지분 조정부터 대규모 개편까지 다양한 시나리오가 거론되는 중이다. 그도 그럴 것이 한화그룹의 지배구조 개편은 순환출자 해소와는 무관하다. 현재 공정거래위원회가 문제를 삼는 것은 한화그룹의 SI계열사인 한화S&C의 ‘일감 몰아주기’다. 한화S&C의 지분만 조정하면 대규모 개편의 필요성은 없다. ,"한화그룹이 지배구조 개편을 예고한 5월이 다가오면서 그룹 안팎의 관심이 높아지고 있다. 한화그룹의 지배구조 개편의 핵심은 ‘일감 몰아주기’의 해소다. 때문에 복잡하게 얽힌 다른 그룹사와의 대규모 지분이동이나 총수일가의 출자가 이뤄질 가능성은 제한적이다. 그럼에도 이번 지배구조 개편이 주목되는 것은 총수일가의 후계구도 때문. 김승연 한화그룹 회장의 아들들이 어떤 방식으로 후계의 그림을 그릴 수 있을지 귀추가 주목된다. 

26일 재계에 따르면 오는 5월로 예정된 한화그룹 지배구조 개편은 소규모 지분 조정부터 대규모 개편까지 다양한 시나리오가 거론되는 중이다. 그도 그럴 것이 한화그룹의 지배구조 개편은 순환출자 해소와는 무관하다. 현재 공정거래위원회가 문제를 삼는 것은 한화그룹의 SI계열사인 한화S&C의 ‘일감 몰아주기’다. 한화S&C의 지분만 조정하면 대규모 개편의 필요성은 없다. 

현대차그룹이나 현대중공업그룹 등과 달리 대규모 지분 이동이나 총수일가의 지분 변동이 필수적으로 동반되지 않는다는 이야기. 그럼에도 다양한 시나리오가 거론되는 이유는 이 지배구조 개편을 통해 한화그룹 후계구도와 밑그림을 볼 수 있을 것이란 관측 때문이다. 

가장 소규모 개편의 시나리오는 한화그룹이 한화S&C의 지분만을 조정할 가능성이다. 한화S&C는 에이치솔루션에서 분할된 SI계열사다. 이 에이치솔루션은 김승연 한화그룹 회장의 세 아들인 김동관 한화큐셀 전무, 김동원 한화생명 상무, 김동선 전 한화건설 팀장이 지분 100%를 보유 중이다. 

에이치솔루션이 한화S&C의 지분 55.36%를 보유하고 있기 때문에 문제가 됐다. 공정위는 이에 대한 위법성 판단을 유보한 상태지만 통상 총수일가의 지분이 20%를 초과할 경우 ‘일감 몰아주기’가 이뤄지고 있다고 보고 있다.  

요컨대 이 지분을 다른 계열사에 매각하거나 상장하는 방법 등으로 20% 이하로 낮춘다면 별 문제 없이 지배구조 개편을 마무리할 수 있는 셈이다. 추가적으로 계열사 매출 비중이 높은 에이치솔루션의 자회사 한화에너지 등도 조정 대상이 될 수 있다.  

반면 다른 일각에서는 에이치솔루션을 한화그룹 지배 회사인 한화와 합병하는 시나리오까지 거론하고 있다. 이때는 경우의 수가 복잡해진다. 에이치솔루션의 가치를 어떻게 평가하느냐에 따라 오너 3세가 확보하는 한화의 지분이 달라지기 때문이다.  

다만, 외형적으로 에이치솔루션과 한화의 규모 차이가 커서 경영승계로 이어질만한 지분 확보로 이어지기는 쉽지 않다. 이 때문에 일각에서는 에이치솔루션의 상장 및 한화S&C의 상장 등이 복합적으로 이뤄질 가능성도 조심스레 점치는 중이다. 상장을 통해 시가총액을 높일 경우 한화-에이치솔루션 합병이 보다 유리하게 진행될 수 있다는 기대감도 깔려있다. 

이같은 시나리오가 거론되는 가장 큰 배경에는 오너 3세의 개인 회사인 에이치솔루션이 어떤 형태로든 경영승계에 활용 될 가능성이 크다는 판단 때문이다. 여기에는 국내 대부분의 그룹이 총수일가의 개인회사나 SI 계열사를 통해 경영승계의 밑그림을 그렸다는 점도 주효했다. 물론 이 공식이 한화그룹에서 어떻게 대입될지는 아직 미지수다.  

한화그룹 관계자는 “현재 일감 몰아주기 이슈에 대한 해소를 위한 지배구조 개편을 준비 중이지만 아직까지 확정된 바는 없다”고 선을 그었다.  "
은행권 동향,"신한은행 ""단순 반복업무 로봇이 대신""
","로봇 소프트웨어인 RPA(Robotics Process Automation)를 ▲외환 수수료 등록 ▲퇴직연금 지급·접수·등록 ▲파생상품 거래 한도 점검 등 은행 업무 전 영역으로 적용을 확대한다. 신한은행은 지난해 8월 여신 지원 업무에 RPA 기술을 도입했다. 신한은행 관계자는 ""RPA 를 확대하면 수작업으로 처리하던 일을 줄일 수 있어 연간 수억원의 경비 절감이 가능하다""고 말했다.","신한은행이 단순 반복적인 업무를 자동으로 처리할 수 있는 로봇 소프트웨어를 올해 3분기까지 은행 업무 전반에 도입한다.?

24일 신한은행에 따르면 로봇 소프트웨어인 RPA(Robotics Process Automation)를 ▲외환 수수료 등록 ▲퇴직연금 지급·접수·등록 ▲파생상품 거래 한도 점검 등 은행 업무 전 영역으로 적용을 확대한다.?

신한은행은 지난해 8월 여신 지원 업무에 RPA 기술을 도입했다.

신한은행 관계자는 ""RPA 를 확대하면 수작업으로 처리하던 일을 줄일 수 있어 연간 수억원의 경비 절감이 가능하다""고 말했다.

신한카드도 지난 1월 RPA 조직을 신설하고 카드 분실 신고, 습득 카드 처리 등 13개 업무에 RPA 시스템을 적용하고 있다. 사람의 근무량으로 환산하면 월간 1천700여 시간을 로봇 소프트웨어가 대신하는 것으로 파악하고 있다."
은행권 동향,"우리은행, 지문인증 이체 '먹통'…금감원 보고도 아직
","우리은행 앱에서 지문이나 홍채 인증 서버에 오류가 생기면서, 계좌 이체가 되지 않고 있다. 로그인 후에 이체를 하려면 '생체 인증 거래 시 오류가 발생했다'는 안내와 함께 이체가 안된다. 우리은행 모바일 앱 자체에 생체 인증이 설치돼 있으면, 자금 이체 전 최종 확인 단계에서 생체 인증만 적용돼 문제가 커지고 있는 상태다. 은행 뱅킹 앱 내에서 생체 인증을 해지하려고 하면 아무런 인증 절차를 거치지 않고 바로 폐기된다. 앞서 다른 은행들은 사용자가 저장한 인증서를 없애고자 할 때는 한번 더 본인 확인 절차를 진행한다.","우리은행 모바일 애플리케이션(앱)에서 생체 인증 기반 계좌 이체가 5시간째 먹통이다.?

25일 오전 10시 30분께부터 우리은행 앱에서 지문이나 홍채 인증 서버에 오류가 생기면서, 계좌 이체가 되지 않고 있다. 로그인 후에 이체를 하려면 '생체 인증 거래 시 오류가 발생했다'는 안내와 함께 이체가 안된다. 

우리은행 측은 오전 11시께 정상화될 것이라고 밝혔으나 발표와 달리 수 시간째 계좌 이체가 되고 있지 않다.?

우리은행 관계자는 ""은행과 한국정보인증에서 정보를 교환하는 과정에서 에러가 났으며, 이후에는 정상화됐다""면서 ""다만 트래픽이 과하게 몰리면서 아직도 생체인증 기반 계좌 이체 처리가 안되고 있다""고 설명했다.?

이 관계자는 ""공인인증서와 보안카드나 OTP를 활용한 인터넷 뱅킹 이체는 문제없이 처리되고 있다""고 덧붙였다.?

하지만 우리은행 모바일 앱 자체에 생체 인증이 설치돼 있으면, 자금 이체 전 최종 확인 단계에서 생체 인증만 적용돼 문제가 커지고 있는 상태다. 은행 뱅킹 앱 내에서 생체 인증을 해지하려고 하면 아무런 인증 절차를 거치지 않고 바로 폐기된다. 앞서 다른 은행들은 사용자가 저장한 인증서를 없애고자 할 때는 한번 더 본인 확인 절차를 진행한다.

우리은행 모바일 뱅킹 사용자인 회사원 권도훈(38)씨는 ""급여 계좌와 카드 자동 이체 계좌가 달라서 애를 먹고 있다. 급한데로 다른 계좌 이체 앱을 활용했다""며 분통을 터뜨렸다.

또다른 사용자들은 우리은행의 미온적인 태도가 문제를 키웠다고 지적하고 있다. 회사원 김여진(29·여)씨는 ""오전 10시부터 계좌 이체가 되지 않아 애꿎은 휴대전화만 몇번이고 껐다 켰다""고 답답해했다. 우리은행은 오전 11시께 보도가 나간 이후, 확인 작업에 착수했으며 모바일 뱅킹 앱에 '생체기반 공인인증서 서버 장애로 현재 정상적인 서비스 제공이 어렵다'는 팝업 공지를 띄웠다.

수 시간째 먹통임에도 불구하고 우리은행은 금융감독원에 이렇다할 전산 및 서버 오류로 인한 사용자 불편사항을 보고하지 않은 상태다. 은행 측 문제로 사용자들이 차질을 빚을 경우 은행은 금감원에 해당 내용을 보고해야 한다.

?계좌 이체 문제가 해결되더라도 이번 우리은행 측 오류로 인한 손해배상은 사실상 어려울 전망이다. 금감원 관계자는 ""이체를 해야만 하는데 오류로 하지 못했다는 것을 입증해야 하는데, 이 입증이 쉽지 않을 것""이라고 설명했다.

"
은행권 동향,"KEB하나은행, 급식업체 대금 정산 자동화 플랫폼 구축
",서울시농수산식품공사는 약 6조원 규모의 가락시장을 포함 강서·양곡 등 서울시 농수산물 도매시장의 관리 및 운영을 담당하고 있는 서울시청 산하 공기업이다. 서울시의 학교 급식 지원사업을 위해 산하 단체인 서울친환경유통센터를 설립해 운영하고 있다.,"KEB하나은행은 27일 오전 서울 강서구 소재 서울친환경유통센터에서 서울시농수산식품공사와 학교 급식업무 정산 자동화 플랫폼 구축을 위한 업무 협약을 체결했다고 밝혔다.

?서울시농수산식품공사는 약 6조원 규모의 가락시장을 포함 강서·양곡 등 서울시 농수산물 도매시장의 관리 및 운영을 담당하고 있는 서울시청 산하 공기업이다. 서울시의 학교 급식 지원사업을 위해 산하 단체인 서울친환경유통센터를 설립해 운영하고 있다.

KEB하나은행과 공사는 이번 업무협약을 통해 서울시내 800여 학교의 급식대금 수납과 128개 협력업체에 대한 대금지급 업무를 자동화하는 새로운 협력 시스템을 구축하게 됐다.

양사는 지난 3월부터 효율적 시스템 연계 방안에 대한 논의를 시작해 최적화 방안을 확정, 일선 학교 및 협력업체 대상 설명회를 거친 뒤, 5월말부터 새로운 정산 플랫폼을 운영할 예정이다.

기존에는 식자재 생산업체가 납품업체를 통해 판매대금을 수령해 왔으나, 새로운 정산 플랫폼에서는 공사가 생산업체에 판매대금을 직접 지급하기 때문에 보다 신속하고 안정적인 대금 수납이 가능해진다. 납품업체도 대금 수납을 위해 공사를 직접 방문해야만 했던 번거로운 절차를 피할 수 있게 된다."
보험업계 동향,"메리츠화재 김용범號, 3년 성적표 ‘A+’
",메리츠화재의 설계사 정착률(13회차)은 ▲2015년 45.4% ▲2016년 47.0% ▲2017년 48.2%로 지속적으로 높아지고 있다. 정착률이 높아지자 계약유지율(25회차)도 ▲2015년 64.0% ▲2016년 64.4% ▲2017년 70.8%로 좋아지고 있다.,"김용범 메리츠화재 대표(부회장)는 지난 2015년 취임한 후 영업조직을 개편하는 구조조정을 단행했다. 또 법인보험대리점(GA)를 중심으로 장기보험 영업을 강화했다.  그 결과 순이익이 증가한 것은 물론 설계사 정착률, 계약유지율 등 주요 경영지표가 모두 좋아졌다.  24일 보험업계에 따르면 메리츠화재의 설계사 정착률(13회차)은 ▲2015년 45.4% ▲2016년 47.0% ▲2017년 48.2%로 지속적으로 높아지고 있다. 정착률이 높아지자 계약유지율(25회차)도 ▲2015년 64.0% ▲2016년 64.4% ▲2017년 70.8%로 좋아지고 있다. 

정착률은 보험사의 건전성을 판단하는 간접 지표다. 설계사가 소득 등이 만족스러워 1년 이상 이직이나 퇴직을 하지 않는다는 것을 의미한다. 정착률이 높아지면 유지율도 높아진다. 유지율 향상은 보험사의 신뢰도와 소비자만족도를 높인다. 요컨대 회사의 수익성 지표가 선순환 하는 셈.

메리츠화재의 당기순이익은 ▲2013년 1353억원에서 ▲2014년 1127억원으로 226억원 줄었다. 하지만 ▲2015년 1713억원 ▲2016년 2578억원 ▲2017년 3551억원 등으로 급증했다. 이 같은 선순환은 김용범 부회장이 메리츠화재를 이끌면서 나타난 변화다.  김 부회장은 2015년 사장 취임 후 일선 영업조직을 대거 개편했다. 비용 절감과 함께 효율성을 높이기 위해서다. 또 2016년에 지역본부 12곳을 없애고 점포 221개를 100여개로 통폐합, 대규모 점포로 만들었다. 

2015년 이후 감축된 인원은 600여명. 지역본부-지역단-영업점이었던 조직체제도 지역본부-영업점 단순화됐다. 성과에 따라 인센티브를 지급하는 사업가형 본부장 체제도 도입했다.

당시 업계는 이런 메리츠화재의 급격한 변화를 우려의 시각으로 바라봤다. 증권업계 출신인 김 부회장이 보험업의 특성을 이해하지 못한 채 무리하게 조직을 망가뜨린다고 지적도 나왔다. 하지만 3년만에 시각이 완전히 바뀌었다. 

대형 손해보험사 고위 관계자는 “2016년 대규모 점포를 도입할 때까지만 해도 실패할 것이라고 보는 관측이 지배적이었다”면서도 “지금은 메리츠화재의 전략에 귀를 기울일 수밖에 없다”고 말했다. 

경영지표 개선과 함께 업계 변화를 주도한 덕분에 김 사장은 올해 초 부회장으로 승진했다. 임기도 2020년으로 늘었다. 

이번 임기 말까지 김 부회장이 해야 할 것은 업계 평균보다 낮은 정착률과 유지율 등을 평균 이상으로 끌어올리는 것. 또 장기보험에 치중되어 있는 포트폴리오를 자동차보험과 일반보험 등으로 확대하는 것이다. 

보험업계 또 다른 고위 관계자는 “메리츠화재는 현재 GA와 협업을 통해 장기보험 중심으로 성장하고 있다”며 “대형사로 발돋움하려면 전속조직을 더 강화하고 자동차와 일반보험의 비중을 늘려야 할 것”이라고 말했다. 이어 “다만 최근 성장세 덕분에 사기는 갈수록 높아지고 있는 모습”이라며 “성공하는 조직으로 메리츠화재를 바꾼 것이 김용범 부회장의 최대 업적이 될 것”이라고 덧붙였다.  "
보험업계 동향,"'영업 실험 성공' 메리츠화재, 보험료 올리나
",지난해 국내 종합 손해보험사들이 GA 판매 채널을 통해 유치한 신계약은 총 366만600건으로 집계됐다. GA는 한 보험사에 종속되지 않고 여러 보험사와의 제휴를 통해 다양한 상품을 파는 대리점이다. 보험사별로 보면 GA 판매 손해보험 신계약 가운데 메리츠화재가 차지한 비중이 20.9%(76만3787건)으로 단연 높았다. 이는 전년(17.3%) 대비 3.6%포인트 상승한 수치로 손보업계에서 유일하게 20%를 넘어서며 1위 자리를 굳건히 했다,"메리츠화재가 독립법인대리점(GA)을 중심으로 한 영업 확대 실험의 성공에 힘입어 사상 최대 실적을 거뒀다. 최근 메리츠화재는 이른바 보험백화점으로 불리는 GA에서 체결된 국내 손해보험 계약 5건 중 1건 이상을 독식하며 이 시장에서의 선두 굳히기에 나서는 모습이다. 동시에 이 과정에서 불어난 사업비 지출은 향후 고객들의 보험료 인상 요인이 될 것이라는 우려가 배어나오고 있다.

24일 손해보험협회에 따르면 지난해 국내 종합 손해보험사들이 GA 판매 채널을 통해 유치한 신계약은 총 366만600건으로 집계됐다. GA는 한 보험사에 종속되지 않고 여러 보험사와의 제휴를 통해 다양한 상품을 파는 대리점이다.

보험사별로 보면 GA 판매 손해보험 신계약 가운데 메리츠화재가 차지한 비중이 20.9%(76만3787건)으로 단연 높았다. 이는 전년(17.3%) 대비 3.6%포인트 상승한 수치로 손보업계에서 유일하게 20%를 넘어서며 1위 자리를 굳건히 했다.

이어 ▲DB손해보험 14.0%(51만2087건) ▲KB손해보험 13.5%(49만3811건) ▲현대해상 12.0%(44만523건) ▲한화손해보험 10.4%(37만9878건) ▲삼성화재 10.2%(37만2503건) 등 손보사들이 10%대 점유율을 기록했다.

메리츠화재가 GA 판매 시장에서 이 같은 영향력을 확보할 수 있었던 배경에는 적극적인 확장 전략이 있었다. 메리츠화재는 GA를 주력 영업 창구로 육성하기 위해 지난해 GA에게 보험업계 최고 수준의 수수료를 지급하는 등 공격적인 마케팅을 진행했다. 또 지난해 하반기에는 메리츠화재 상품만 파는 GA를 선보이기도 했다.

그 결과 메리츠화재의 영업에서 GA가 차지하는 비중은 경쟁 손보사들보다 상당히 큰 편이다. 지난해 메리츠화재가 모든 판매 채널에서 새롭게 유치한 모든 신계약 중 GA를 통해 맺어진 계약의 비율은 59.9%에 달했다. 57.5%였던 전년보다도 2.4%포인트 오른 수치다.

국내 빅5 손보사 가운데 이처럼 GA에 대한 신계약 의존도가 절반을 넘는 곳은 메리츠화재뿐이다. 그나마 KB손보가 지난해 전체 신계약 가운데 GA 비중이 43.2%로 높은 편이었고, 이어 현대해상(34.2%)·DB손보(30.4%)·삼성화재(20.0%) 순이었다.

이런 GA 정책이 효과를 발휘하면서 메리츠화재의 성적은 수직 상승했다. 메리츠화재의 지난해 영업이익은 5136억원으로 전년(3143억원) 대비 63.4%(1993억원) 급증했다. 당기순이익 역시 3846억원으로 같은 기간(2372억원) 대비 62.1%(1474억원) 늘었다. 영업수익도 7조1520억원에서 7조9335억원으로 10.9%(7815억원) 증가했다.

문제는 메리츠화재가 GA 영업 확산에 힘을 쏟는 와중 사업비 지출도 함께 불고 있다는 점이다. 메리츠화재의 지난해 순사업비율은 23.1%로 KB손보(20.9%)와 현대해상(20.3%), 삼성화재(20.1%), DB손보(19.2%) 등 5대 손보사 가운데 가장 높았다. 전년(21.1%)과 비교하면 2.0%포인트 상승했다. 순사업비율은 보험사의 보유보험료 대비 사업비 지출 규모를 보여주는 지표다.

즉, 순사업비율이 높다는 것은 그만큼 해당 보험사가 가입자들을 위한 보장보다 상품 판매와 유지에 쓰는 돈이 많다는 의미다. 그만큼 고객들에게 많은 부담이 전가되고 있는 셈으로, 향후 보험료 인상 압박 요인으로 작용할 수도 있는 요소다.

보험업계 관계자는 ""GA에 집중한 메리츠화재의 영업 전략은 회사 실적 측면에서 보면 분명 성공적""이라면서도 ""다만 사업비 지출이 계속 늘면 향후 보험료가 오를 가능성이 커지는 만큼 장기적 성장성 확보를 위해서는 비용 측면에 좀 더 신경을 쓸 필요가 있다""고 말했다"
