category,title,body,origin
카드업계 동향,"현대카드, '실용성·혁신성'으로 차별화된 디지털 서비스 제공
",가장 최근 출시한 7번째 '디지털 현대카드' 서비스는 전용 앱을 통해 저렴한 수수료로 간편하게 외화를 송금할 수 있는 회원전용 해외송금 서비스다. 이 서비스의 특징은 저렴한 수수료로 은행의 10% 수준인 3000원의 송금수수료만 지불하면 된다는 점이다. 일반적인 해외송금이 최대 5일까지 걸리는데 비해 이 서비스는 송금시간이 최대 3일로 소요시간도 짧다. 현대카드 아이디로 로그인 한번이면 회원 본인의 카드 결제계좌에서 간편하게 송금할 수 있다.,"2015년 10월부터 현대카드가 선보이고 있는 '디지털 현대카드' 시리즈는 고객들이 바로 체감할 수 있는 실제적 편익을 제공한다. 카드 결제 정보를 활용한 혁신성으로 차별화도 꾀하고 있다.

가장 최근 출시한 7번째 '디지털 현대카드' 서비스는 전용 앱을 통해 저렴한 수수료로 간편하게 외화를 송금할 수 있는 회원전용 해외송금 서비스다. 이 서비스의 특징은 저렴한 수수료로 은행의 10% 수준인 3000원의 송금수수료만 지불하면 된다는 점이다. 일반적인 해외송금이 최대 5일까지 걸리는데 비해 이 서비스는 송금시간이 최대 3일로 소요시간도 짧다. 현대카드 아이디로 로그인 한번이면 회원 본인의 카드 결제계좌에서 간편하게 송금할 수 있다.

현대카드의 '가상 카드번호'와 '페이샷' 서비스도 주목할 만한다. 가상 카드번호 서비스는 정보유출에 대비해 실제 카드번호 대신 고객이 별도로 생성한 가상의 카드번호를 사용할 수 있는 서비스다. 페이샷은 사전 등록한 PC에서 옥션, 11번가, SSG 등 제휴 쇼핑몰을 이용할 때 해당 쇼핑몰 로그인만으로 결제가 가능한 간편결제 서비스다. 

'현대카드 카멜레온'은 각기 다른 여러 장의 카드 혜택을 한 장에 담아 활용할 수 있다. '현대카드 버디'는 카드 혜택과 현대카드에 대해 궁금한 점을 실시간으로 상담해주는 인공지능(AI) 챗봇 서비스다.

지난달 현대카드가 베타 버전으로 내놓은 '피코'(PICO)는 패션을 테마로 카드 결제 데이터 분석과 검색 서비스를 접목시킨 최초의 앱이다. 피코는 현대카드가 자체 개발한 검색 알고리즘을 적용해 ‘인기 있는’, '최근 뜨는’, ‘내게 맞는’으로 구성된 3가지 형태의 검색 결과를 제공한다. 성별과 스타일, 쇼핑몰 유형, 가격, 국가 등에 따라 더욱 정교한 검색도 가능하다. 1800여 곳에 달하는 해외 패션 사이트를 한글로 검색할 수 있도록 한글 검색 기능을 탑재하고 있다.

현대카드는 기업 내부에서도 '데이터 사이언스'라는 새로운 패러다임을 통해 사업을 재정의하고 확장해 나가고 있다. 현대카드는 기존 일반적인 고객 기반 마케팅에서 탈피해 머신러닝 등을 통해 700만 회원의 '행동정보'를 정교하게 분석하고 개별 고객에게 최적화된 마케팅을 시행할 수 있도록 준비 중이다. 이 같은 작업을 위해서 필수적이라 할 수 있는 데이터를 체계적으로 정제하는 작업에 박차를 가하고 있다."
핀테크 일반,"핀테크 시장에 금융 대기업이 뛰어든다면
","토마스 강 엠닥(M-daq) 글로벌 총괄은 규제와 인프라 미비에서 이유를 찾았다. “아시아 10개국을 합치면 평균은 높지만, 나라 간 GDP차이가 크다. 각 나라의 규제가 아시아 포텐셜을 막고 있다. 아울러 공항 등 인프라도 부족하다. 그것이 아시아가 선진국 수준으로 못 가는 이유다. 또 유로처럼 어딜가나 통하는 화폐단위도 없고, 종교 이슈도 무시할 수 없다. 미국편에 서야할지, 중국편에 서야할지 정치적 선택도 관건이다.”라고 설명했다.","스타트업 붐이 계속 되는 가운데 유망한 국내 스타트업을 아시아 시장에 진출시키기 위한 다양한 프로그램이 진행되어 왔다. 국내 대기업과 외국계 VC가 손을 잡기도 했고 정부차원의 지원사업도 있었다. 하지만 유의미한 성과는 많지 않았다.

토마스 강 엠닥(M-daq) 글로벌 총괄은 규제와 인프라 미비에서 이유를 찾았다. “아시아 10개국을 합치면 평균은 높지만, 나라 간 GDP차이가 크다. 각 나라의 규제가 아시아 포텐셜을 막고 있다. 아울러 공항 등 인프라도 부족하다. 그것이 아시아가 선진국 수준으로 못 가는 이유다. 또 유로처럼 어딜가나 통하는 화폐단위도 없고, 종교 이슈도 무시할 수 없다. 미국편에 서야할지, 중국편에 서야할지 정치적 선택도 관건이다.”라고 설명했다.

이어 “하지만 힘들기 때문에 기회가 있는 것이다. 동남 아시아는 로컬이 중요하니 현지 파트너와 소통과 관계형성을 신경써야 한다. 아울러 업무비용, 인력관리도 필요하다. 싱가포르를 테스트 배드로 해 진출하는 것을 권한다.”고 조언했다.

토마스 강이 몸담고 있는 테크핀 스타트업 엠닥은 알리바바그룹의 피투자사로 누적 투자금만 9870만 달러(약 1,067억 원)에 달한다. 고젝이 등장하기 전까지 동남아시아에서 가장 많은 투자를 받은 기업이었다.

30일 서울 역삼동 디캠프에서 토마스 강 총괄을 비롯해 해외송금 전문회사 모인의 서일석 대표, 센트비 최성욱 대표, 김홍일 디캠프 센터장이 핀테크 분야 현안을 주제로 노변정담 시간을 가졌다. 이하 관련내용 정리.

핀테크, 혹은 테크핀시장에 기존 금융기업이 뛰어든다면.

토마스 강 엠닥 비즈니스 총괄 : 핀테크가 왜 생겼는지 고민해야 한다고 본다. 기존 금융권의 고객 경험이 안 좋았기에 핀테크 스타트업이 생겨났다고 본다. 손님이 떠났는데 새로운 사업을 하는 것에 큰 의미를 찾기 어렵다. 하지만 핀테크 산업이 커질려면 금융권이 참여해야 한다. 은행 등 금융권에 기대하는 것은 핀테크가 클 수 있는 액셀러레이터, 인큐베이터 역할이다.

모인 서일석 대표 : 많이 듣는 질문이다. 은행은 자금력이 있고 오프라인에 강점이 있다. 금융권도 해외송금이나 간편결제를 하고 싶을거고 할 수도 있을거다. 은행과 핀테크 스타트업의 가장 큰 차이점은 DNA와 기술이라고 생각한다. 핀테크 기술은 금융회사 구조상 어렵다. 현재까진 하청업체를 통해 빨리만 만드는데만 신경썼을 뿐 유저 사용성에 대한 고민이 적다.

잘하고 못 하고를 떠나 조직의 차이라고 본다. 금융기업과 핀테크 스타트업은 조직의 성격, 강점이 다르다. 스타트업은 기술기반인 반면에 은행은 아니다. 금융회사는 테크베이스가 아니기에 필요성을 못 느꼈을거다. 10년 전 대기업에서 소프트웨어 연구를 했다. 능력있는 사람도 많았고 대우도 좋았다. 하지만 10년이 지난 현재 아무도 그 기업이 기술을 잘 한다고 생각하지 않는다. 물론 그 대기업은 스타트업이 할 수 없는 다른 강점이 있다.

솔직하게 이야기하면 무섭다. 금융 대기업은 자금력도 풍부하고, 법과 규제에 대한 발언권도 세다. 모든 스타트업이 그리 생각할거라 본다.

센트비 최성욱 대표 : 모든 산업 영역에서 대기업을 상대할 수 있는 스타트업의 무기는 속도밖에 없다. 금융은 특히 그렇다. 3~5년이 아니라 6개월, 주 단위로 트렌드가 바뀌는 분야이기 때문이다. 하지만 규제 역시 강하다. 빠르게 테스트하고 서비스를 출시하는데 난관이 많다. 해외 금융기업은 핀테크 스타트업에 투자하거나 협업해서 회사를 키우는 반면 국내는 그런 경향이 많지 않다. 금융기업의 시도 중 형식적인 것도 없잖아 있다.

고객 편의성을 기존 은행권이 못 따라가는 것이 문제의 시작이다. 2010년 미국 자료를 보니. 가장 신뢰하지 않는 기업 상위권 대부분이 은행이더라. 가장 신뢰하는 기업은 아마존이었고. 2018년 유니콘 핀테크 업체가 26개다. 마켓밸류 총액이 716억 달러에 달한다. 이 분야 관계자 입장에서 인상깊게 본 기업이 있다면.

강 : 토스가 은행이 잘 안하고 못 하는 부분을 잘 하고 있다. 결국 유저경험은 핀테크 기업이 가져갈거라 본다. 아마도 은행권은 기업금융을 흔드는B2B기업이 등장하는 것을 가장 두려워 할거다.

서 : 여러 블록체인 회사가 눈에 띈다. 블록체인을 통해 크로스보더를 바꾸는 회사들이다. 특정지어 언급하긴 어렵지만, 근래 투자유치를 많이 한 회사들이다. 그들을 눈여겨 보라 말하고 싶다.

국내는 IT공룡이 금융업으로 넘어왔음에도 불구하고 아직까진 인상적이지 않다. 하지만 중국 대기업, 투자사가 동남아시아에 진출해 결제 인프라를 확장하고 있다. 유저와 사용성에 대한 고민을 많이하는 기업들이다. 이들이 금융 영역에서 기존 플레이어를 앞지를거다.

최: 특정 국가에서 성공했다고 해서 다른 지역에서도 같은 결과가 나온다는 보장은 없다. 국가마다 다른 규제가 있기 때문이다. 그래서 로컬업체를 인수하거나 투자를 하는 등 방식으로 진출한다. 이를 배경으로 블록체인 기술이 도입된 여러 혁신 서비스가 나오고 있다.

규제나 제약 중 반드시 해결해야만 하는 것 하나만 이야기해 준다면. 

강: 유럽에선 한 국가에서 핀테크 관련 인허가를 취득하면 전유럽 시장에서 통용된다. 이런 방식이 아시아에도 도입되면 좋겠다. 아시아는 각 나라마다 허가를 별도로 받아야 한다. 단계로 놓고보면 해외는 디지털 혁신의 3단계로 가고 있다. 마켓과 함께 키워가는 과정이다. 하지만 한국은 아직 기초단계에 머물러 있다.

서 : 규제와 관련해서는 2시간 정도 쉼없이 이야기할 수 있을 정도로 많다. 핀테크 규제에 대한 법 개정이 이제서야 논의되고 있다. 이 영역은 신생아 수준의 산업이다. 은행권에 비해 스타트업은 규제와 법에 있어 불평등한 부분이 있다. 스타트업이라고 해서 더 해달라는 것이 아니다. 기존 플레이어와 동등하게 해주길 바란다. 스타트업에게만 무지막지한 다른 룰이 적용된다. 우리같은 소액결제 업체는 연간 2만달러 이상 이체할 수 없다(외국환거래법 개정안). 같은 운동장에서 싸워도 경기의 룰이 다르다.

최: 4차 산업혁명을 논하며 핀테크를 언급하지만, 국가에서 진짜 키우려는 의지가 있는지는 모르겠다. 중소기업이 클 수 있는 환경이 미비한 상황에서 정책이 진행되는 것 같아 아쉽다."
핀테크 일반,"“수수료 낮추고 더 편리하게”... 해외송금 시장 ‘춘추전국’
","수십 년 간 은행들은 국제 은행간 결제시스템인 ‘스위프트(SWIFT)망’을 이용해 해외송금 업무를 처리했다. 국내 은행에 돈을 입금하면 중개은행을 거쳐 외국 수취은행에 도달하는 방식인데, 각 단계별로 발생하는 수수료는 모두 소비자에게 부과됐다. 국내 은행에 내는 환전 및 송금수수료, 해외은행과 전신문을 주고받는 데 드는 비용인 전신료, 중개은행 및 수취은행에 내는 수수료 등이다. 송금액이 5,000달러면 수수료 비용이 많게는 5만~6만원이 발생하는 구조다. 더구나 송금 완료까지는 4~5일가량 소요된다. 국내 해외송금 시장 규모가 2012년 93억8,000만달러에서 2016년 103억5,000만달러로 늘었지만 송금 방식은 최근까지 큰 변화가 없었다.","직장인 박모(58)씨는 미국에서 대학을 다니는 아들에게 매달 100만원의 용돈을 보낸다. 시중은행에서 송금하면 수수료가 대략 4만원. 은행 방문 외엔 돈을 보낼 마땅한 방법을 몰라 ‘울며 겨자먹기’로 비싼 수수료를 물어온 박씨는 올해 초부터 송금일엔 스마트폰을 꺼내든다. 지인의 추천으로 인터넷전문은행 해외송금 서비스를 이용하면서 수수료가 5,000원으로 대폭 줄어들었고 은행에 가는 수고도 덜었다.

금융권의 해외송금 시장 경쟁이 치열해지고 있다. 시중은행이 독식해온 시장에 인터넷전문은행을 필두로 카드사, 핀테크(IT기술을 접목한 금융서비스) 업체 등이 도전장을 내밀고 있는 것이다.

29일 금융권에 따르면 지난 수십 년 간 은행들은 국제 은행간 결제시스템인 ‘스위프트(SWIFT)망’을 이용해 해외송금 업무를 처리했다. 국내 은행에 돈을 입금하면 중개은행을 거쳐 외국 수취은행에 도달하는 방식인데, 각 단계별로 발생하는 수수료는 모두 소비자에게 부과됐다. 국내 은행에 내는 환전 및 송금수수료, 해외은행과 전신문을 주고받는 데 드는 비용인 전신료, 중개은행 및 수취은행에 내는 수수료 등이다. 송금액이 5,000달러면 수수료 비용이 많게는 5만~6만원이 발생하는 구조다. 더구나 송금 완료까지는 4~5일가량 소요된다. 국내 해외송금 시장 규모가 2012년 93억8,000만달러에서 2016년 103억5,000만달러로 늘었지만 송금 방식은 최근까지 큰 변화가 없었다.

해외송금 수수료 인하 경쟁의 포문을 연 것은 인터넷전문은행이었다. 특히 지난해 7월 출범 전부터 “해외송금 수수료를 시중은행의 10분의 1 수준으로 낮추겠다”고 공언한 카카오뱅크는 현재 송금액 5,000달러 이하를 기준으로 수수료를 5,000원으로 낮추며 경쟁을 주도하고 있다. 해외송금 누적건수는 지난달 말 16만1,000건을 넘어섰다. 카카오뱅크 관계자는 “출시 초반엔 이용자 증가 속도가 완만했지만 사용이 편리하고 수수료가 저렴하다는 점이 알려지면서 상승 곡선이 가팔라졌다”고 설명했다. 케이뱅크도 출범 1년을 맞은 지난달 송금 액수와 상관 없는 단일 수수료(건당 5,000원), 대폭 간소화된 송금 절차를 내세우며 시장에 뛰어들었다.


현대카드도 지난달 카드사 중 처음으로 자사 회원을 대상으로 수수료 3,000원의 해외송금 서비스를 선보였다. 핀테크 업체들이 대거 해외송금 서비스에 뛰어들면서 경쟁은 더욱 뜨거워진 상태다. 금융감독원에 등록된 소액 해외송금 업체는 3월 말 기준 18곳에 달한다. 지난해 7월 외국환거래법 시행령 개정은 이들 업체의 시장 진입을 원활하게 했다는 평가다. 그간 금융사가 아니면 단독으로 해외송금 서비스를 운영할 수 없었지만, 시행령 개정으로 일정 요건(자기자본 20억원 이상, 외환전문인력, 외환전산망 연결 등)을 갖추면 건당 3,000달러 이하, 연간 2만 달러 한도에서 소액 해외송금업을 할 수 있게 됐기 때문이다.


해외송금 시장이 이처럼 춘추전국시대로 돌입한 데는 정보통신(IT) 기술 발달로 글로벌 금융망 이용이 용이해지고 송금 방법도 다양해졌기 때문이다. 실제 카카오뱅크는 세계 주요국에 지점을 갖고 있는 씨티그룹과 직접 연결하는 방식으로 결제망을 간소화해 전신료와 중개ㆍ수취수수료를 없앴다. 핀테크 업체들은 고객들의 해외송금 요청을 여러 건 모아 하루에 한번 보내는 ‘풀링’ 방식 등을 사용해 수수료를 대폭 낮췄다. 따로 송금했다면 각자 냈어야 할 수수료를 1회분으로 줄이고 이를 여러 명이 나눠내는 셈이다.

블록체인 기술은 보다 간편하고 빠른 해외송금 서비스 출현을 예고하고 있다. 가상화폐 거래소 코인원은 자회사인 코인원트랜스퍼를 설립하고, 블록체인 기업 리플과 ‘엑스커런트(xCurrent) 솔루션’ 도입 계약을 맺었다. 엑스커런트는 스위프트를 대체할 수 있는 블록체인 기반의 차세대 해외송금 솔루션으로, 상용화될 경우 해외 송금 과정이 1시간 이내로 단축될 것이란 기대를 받고 있다. 코인원트랜스퍼는 올해 하반기 해외송금 서비스에 솔루션 적용을 완료한다는 방침이다.

시중은행들도 대응에 나섰다. 상대방의 전화번호나 송금번호, 이름만 알면 간편하게 돈을 보낼 수 있는 간편 해외송금 서비스를 도입하는가 하면, 모바일 송금 수수료를 5,000~8,000원 수준으로 낮추며 수성에 나서고 있다. 신한ㆍKB국민은행 등은 글로벌 은행과 공동으로 블록체인 기술을 활용한 국제 송금ㆍ결제 플랫폼 개발에도 나선 상태다. 주혜원 국제금융센터 연구원은 “은행권도 외화 사업 부문의 유지를 위해 해외송금 수수료 인하이나 비(非)가격경쟁력 개선에도 주력할 것이고, 이 과정에서 시장이 한층 업그레이드 될 것으로 기대된다”고 말했다."
핀테크 일반,"블록체인 기반 해외송금 도입 '걸음마'
","우리은행은 SBI 리플 아시아의 해외 송금 솔루션을 통해 일본은행으로의 송금 테스트를 성공적으로 마치고, 올 하반기 상용화를 검토 중이다. 우리은행 관계자는 ""리플 프로젝트에 참가해 테스트 송금에 성공했다""면서 ""서비스 도입에 대해선 현재 검토하고 있다""고 말했다. 신한은행도 SBI 리플 아시아에 참여해 파일럿 테스트를 진행 중이다. 또한 신한·KEB하나·KB국민·우리은행 등은 20여개 글로벌 은행과 공동으로 블록체인 기술을 활용한 국제 송금·결제 플랫폼 개발 프로젝트 '아전트(Argent)'에 참여하고 있다.","시중은행들이 해외송금서비스에서 블록체인 기술을 활용하는 방안을 적극 검토하고 있다. 이미 블록체인 기술 상용화가 우리보다 앞선 일본업체들이 국내 해외송금시장 진출을 본격화하고 있어 발 빠른 대응이 필요하다는 지적이다.

30일 은행권에 따르면 우리은행은 SBI 리플 아시아의 해외 송금 솔루션을 통해 일본은행으로의 송금 테스트를 성공적으로 마치고, 올 하반기 상용화를 검토 중이다. 우리은행 관계자는 ""리플 프로젝트에 참가해 테스트 송금에 성공했다""면서 ""서비스 도입에 대해선 현재 검토하고 있다""고 말했다. 신한은행도 SBI 리플 아시아에 참여해 파일럿 테스트를 진행 중이다. 또한 신한·KEB하나·KB국민·우리은행 등은 20여개 글로벌 은행과 공동으로 블록체인 기술을 활용한 국제 송금·결제 플랫폼 개발 프로젝트 '아전트(Argent)'에 참여하고 있다.

블록체인 기술이 적용된 해외 송금 시스템은 기존 방식과 달리 실시간 해외 송금이 가능하다. 기존 스위프트(SWIFT)망을 이용한 해외 송금은 은행 사이에 중계은행을 거쳐 송금되는 탓에 평균적으로 2~3일 정도가 소요됐지만 은행간 블록체인망이 구축될 경우 중계 절차 없이도 해외 자금이체가 가능하다. 또 중계은행의 개입이 없기 때문에 기존 해외송금에서 붙는 수수료도 절감할 수 있다.

국내 시중은행들이 블록체인을 활용한 해외송금서비스 도입 단계에 들어섰지만 이미 상용화에 성공한 일본업체들의 도전에 직면한 상태다.

일본은 송금, 본인인증, 소액결제 등의 분야에서 블록체인 관련 기술 실용화단계다.

내우외환 일원화 컨소시엄은 암호화폐인 리플 플랫폼을 클라우드 서버에 이식한 후 이를 국내·외 송금에 활용하고 있다. 개발단계부터 송금시스템으로서의 기능을 전제로 한 리플을 클라우드상에 이식하고, 이를 송금플랫폼으로 하는 'RC 클라우드'를 지난해 3월 구축했고. 12월엔 우리은행, 신한은행과 외환컨소시엄 내 37개 은행간 RC 클라우드를 통한 해외송금 실험에 성공했다. 이어 지난 3월 RC클라우드 2.0에 기반한 개인간 송금어플리케이션 '머니 탭'을 출시하고 SBI스미신인터넷은행, 스루가은행, 라소나은행 등 3개 은행을 대상으로 상용화가 완료됐다.

이런 가운데 일본업체들이 해외송금 시장이 일본의 2배인 한국 시장에 눈독을 들이기 시작했다.

세계은행에 따르면 2016년 우리나라의 해외 송금액은 103억4600만달러로, 일본의 해외 송금액은 50억6500만달러에 2배 이상이다. 일본 SBI홀딩스는 국내에 송금전문업체 SBI코스머니를 설립하고 기존 은행권 해외송금수수료의 7분의 1 수준의 낮은 수수료율을 마케팅 포인트로 내세우며 한국 송금시장 진출을 발표했다. SBI 코스머니는 지난 1월 해외송금업 등록도 완료했다. 업계에선 일본업체의 추가적인 진출이 있을 것으로 예상하고 있다.

산업기술리서치센터 정석완 연구원은 ""현재 일본은 블록체인에 기반한 분산원장기술을 송금, 외환, 실명인증, 계약 체결 등의 분야에 상용화하는 것을 추진하고 있다""면서 ""한국은 일본보다 늦게 본인인증 분야에서부터 기술 도입을 진행하고 있으며, 일본업계의 시장진입 등 도전에 직면해 있다""고 말했다."
핀테크 일반,"저축은행 해외송금 신사업 진출 발만 동동
","DB저축은행은 소액해외송금업체와 업무 협약을 맺은 지 10개월이 지났지만 외환송금 관련 사업을 진행하지 못하고 있다. 앞서 DB저축은행은 지난해 8월 소액해외송금 전문 핀테크 업체인 센트비와 업무 협약을 맺은 바 있다. 센트비는 지난해 7월 개정된 외국환거래법에 따라 지난해 12월 기재부에 소액해외송금업자로 등록을 완료했다. 저축은행들은 해외송금 시장에서 지지부진한 이유로 금융당국의 강력한 규제를 꼽고 있다. 저축은행은 금융당국의 포지티브 규제를 적용받아 '상호저축은행 표준업무방법서'에 열거된 19가지의 업무만 추진할 수 있다. 표준업무방법서에 따라 추진할 수 있는 사업은 상품권 및 복권 판매대행, 펀드 판매 등으로 해외송금 업무는 포함되지 않는다. ","저축은행업계가 신사업 발굴의 일환으로 해외송금업을 추진하고 있지만 지지부진한 상황이다.

28일 저축은행업계에 따르면 웰컴저축·DB저축은행 등이 해외송금업과 관련해 청사진을 계획하거나 핀테크업체와 제휴를 맺어 추진하고 있지만 만족할 만한 성과를 내지 못하고 있다.

웰컴저축은행은 지난달 16일 출시한 모바일 플랫폼인 웰컴디지털뱅크에 해외송금서비스를 추가하는 계획을 논의했지만 실행으로 이어지지 못했다. 현재는 달러, 유로, 엔화, 위안화 등 4개 통화 환전 서비스만 시행하고 있다. 

DB저축은행은 소액해외송금업체와 업무 협약을 맺은 지 10개월이 지났지만 외환송금 관련 사업을 진행하지 못하고 있다. 앞서 DB저축은행은 지난해 8월 소액해외송금 전문 핀테크 업체인 센트비와 업무 협약을 맺은 바 있다. 센트비는 지난해 7월 개정된 외국환거래법에 따라 지난해 12월 기재부에 소액해외송금업자로 등록을 완료했다.

저축은행들은 해외송금 시장에서 지지부진한 이유로 금융당국의 강력한 규제를 꼽고 있다. 저축은행은 금융당국의 포지티브 규제를 적용받아 '상호저축은행 표준업무방법서'에 열거된 19가지의 업무만 추진할 수 있다. 표준업무방법서에 따라 추진할 수 있는 사업은 상품권 및 복권 판매대행, 펀드 판매 등으로 해외송금 업무는 포함되지 않는다. 

저축은행을 제외한 비은행 금융사인 핀테크 업체와 카드사들이 속속 해외송금시장에 진출하고 있는 것과 큰 대조를 보이고 있다. 

저축은행 업계는 해외송금 시장에서 기존 제도권 금융사로서의 노하우를 활용할 수 없다는 점에서 발만 동동 구르고 있다. 

한 저축은행 관계자는 ""저축은행은 핀테크 업체보다 오래된 제도권 금융이기도하고, 오랜 경험과 노하우를 가지고 있는데 진출하지 못해 아쉽다""고 설명했다. 또다른 저축은행 관계자도 ""올해 법정최고금리 인하와 예대금리 등 전방위적인 규제가 있는 가운데 저축은행 업계가 해외송금이라는 새로운 활로를 찾을 수 있는 방안도 마련해줘야 하는 것 아니냐""며 말했다."
