category,title,body,origin
핀테크 일반,"핀테크 활용한 보험금 간편청구 못할 이유 없다
","건강보험 회사들이 디지털 기술을 활용해 더 빠르고 쉬운 서비스를 제공하고자 하는 도전을 하고 있다. 보험사별로 앱을 개발하고 스마트폰의 사진기를 활용하면 병원에서 진료받은 뒤 간단하게 보험금을 청구할 수 있다. 하지만 보험 가입자는 여전히 서류를 인쇄해 전달해야 하고, 보험사는 수동으로 그림파일을 분석해 보상액을 결정해야 한다. 디지털 정보가 병원에서 보험사로 바로 전송된다면 디지털화된 보험계약 정보와 연동돼 오류 없고 빠른 보상시스템을 구축할 수 있을 텐데 말이다. 문제가 우려된다면 조금 더 진보적으로 문제가 생기지 않을 시스템을 고민해보고, 가보지 않은 길이 걱정된다면 ‘규제 샌드박스’ 아래서 시범 운영 등을 고려해볼 수 있을 것이다.","2000년대 초 미국에 처음 갔을 때 일이다. 금융 선진국이라는 나라에서 예상 밖의 충격적인 방식으로 계좌이체를 하고 있었다. 종이 수표에 금액을 적어 서명하고, 봉투에 넣어 우표를 붙여 보내야 했다. 이후 많은 은행에서 종이 수표 사진을 찍어 앱(응용프로그램)으로 전송하면 직접 은행이나 현금자동입출금기(ATM)를 찾아가지 않아도 입금할 수 있는 서비스가 제공되기 시작했다.


하지만 이 시스템으로 절차가 간편해졌다 해도 여전히 종이에 쓰고 보내야 했다. 그러던 중 변방의 핀테크 업체가 종이도 공인인증서도 필요 없는 전혀 다른 송금·결제시스템을 제공하기 시작했다. 모바일로 비밀번호 몇 개를 누르면 실시간으로 계좌 간 이체가 되는 시대가 열린 것이다.

이베이 전자상거래 결제시스템으로 등장한 페이팔은 전자결제가 경제 전반으로 확산되면서 이베이를 넘어서는 회사로 성장했고, 중국의 알리페이는 중국을 현금 없는 사회로 탈바꿈시키고 있다. 영국의 조파, 미국의 렌딩클럽은 ‘개인 간 거래(P2P) 대출’이라는 예전에 존재하지 않던 형태의 플랫폼 금융서비스를 제공하기 시작했다.

우리는 이들을 핀테크 기업이라고 부른다. 핀테크는 기술과 금융의 결합으로 존재하지 않던 서비스를 제공한다. 이들 기업은 여전히 금융서비스를 제공하므로 금융당국의 규제 영역에 속해야 하지만 존재하지 않던 형태의 비즈니스 모델인 만큼 기존 법제 아래서 존재하는 틀에 맞춰 관리하기는 쉽지 않다.

이와 같은 빠른 성장과 적절한 규제의 부재 속에 중국의 투롱지아와 같은 P2P 대출 회사들의 갑작스러운 파산으로 큰 피해를 입은 금융소비자 이야기가 들려오기도 한다. 기술과 산업의 성장을 장려하는 것도 중요하지만 적합한 규제와 소비자 보호도 함께 고려하는 것이 중요하다는 것을 알려주는 대목이다. 그럼에도 불구하고 기존 시스템에 최적화된 규제들은 전에는 없던 기술과 비즈니스 모델, 산업이 생겨나면 더 이상 적합하지 않은 것이 될 수밖에 없다. 따라서 시장에 미칠 영향이나 소비자 보호 등의 중요한 이슈가 있는 것이 아니라면 변화하는 규제가 혁신을 막고 서 있을 필요는 없다.

최근 건강보험 회사들이 디지털 기술을 활용해 더 빠르고 쉬운 서비스를 제공하고자 하는 도전을 하고 있다. 보험사별로 앱을 개발하고 스마트폰의 사진기를 활용하면 병원에서 진료받은 뒤 간단하게 보험금을 청구할 수 있다. 하지만 보험 가입자는 여전히 서류를 인쇄해 전달해야 하고, 보험사는 수동으로 그림파일을 분석해 보상액을 결정해야 한다. 디지털 정보가 병원에서 보험사로 바로 전송된다면 디지털화된 보험계약 정보와 연동돼 오류 없고 빠른 보상시스템을 구축할 수 있을 텐데 말이다. 문제가 우려된다면 조금 더 진보적으로 문제가 생기지 않을 시스템을 고민해보고, 가보지 않은 길이 걱정된다면 ‘규제 샌드박스’ 아래서 시범 운영 등을 고려해볼 수 있을 것이다.

이미 우리는 정보를 꼭 인쇄해 전달해야 하는 시스템에 어색하고, 기다림을 받아들이기 어려워하는 시대를 향해 나아가고 있다. 비밀번호 몇 자리 누르면 거의 실시간으로 계좌이체할 수 있는 기술이 있는데, 오랫동안 해왔기 때문에 종이 수표에 이체 금액을 적고 서명해서 전달하는 것을 강요할 필요는 없다. 병원에서 진료받는 즉시, 또는 비밀번호 몇 자리 누르고 전송하면 실시간으로 보험금이 입금되는 날이 빨리 오기를 꿈꿔 본다."
핀테크 일반,"'핀테크 왕국' 중국도 50%만 생존...신규업체 진입 금지
","중국에서 P2P금융은 최근 몇년 새 폭발적으로 성장했다. P2P금융 시장은 약 1조4900억 위안(약 245조원) 규모로, 전 세계 다른 국가 P2P금융시장을 다 합쳐도 중국에 못 미친다.  P2P금융의 급성장 원인은 자금난을 겪고 있지만 국유은행 등 제도권 금융의 문턱을 넘지 못한 서민들과 영세사업자들이 P2P 대출로 몰렸기 때문이다. 업체들은 대부분 단기·고금리 대출을 제공한다.  ","중국은 '핀테크 왕국'으로 불린다. 특히 개인 간(P2P) 금융은 서민들의 자금줄 역할을 하며 세계 최대 규모로 성장했다. 

하지만 최근 들어 업체들의 도산이 이어지고 있다. P2P금융 부실이 전체 금융시장에 부정적인 영향을 줄 수 있다는 위기감도 퍼지고 있다. 급기야 중국 정부는 대대적인 실태조사 끝에 관련 지침을 마련했다. 

◆세계 1위 P2P 시장 중국, 부실로 50%만 살아남아 

중국에서 P2P금융은 최근 몇년 새 폭발적으로 성장했다. P2P금융 시장은 약 1조4900억 위안(약 245조원) 규모로, 전 세계 다른 국가 P2P금융시장을 다 합쳐도 중국에 못 미친다.  

P2P금융의 급성장 원인은 자금난을 겪고 있지만 국유은행 등 제도권 금융의 문턱을 넘지 못한 서민들과 영세사업자들이 P2P 대출로 몰렸기 때문이다. 업체들은 대부분 단기·고금리 대출을 제공한다.   

문제는 안정적인 경영을 펼치는 업체가 2년 전에 비해 절반 수준으로 줄었다는 점이다. 올해 7월 기준 정상 운영 중인 P2P대출 플랫폼은 1842개로 전달 대비 14.84% 감소했다. 7월 한 달에만 신규 적발된 부실 플랫폼은 263곳으로 지난해 같은 기간 대비 345.76% 급증했다. 올해 말에는 P2P대출업체가 1000개사까지 줄어들 것이라는 전망이 나오고 있다. 

P2P업체의 도산이 늘어난 건 투자자들의 자금 인출이 불가능해졌거나 경영진의 도주, 경영 비리 등으로 경찰 수사를 받는 업체가 늘어난 탓이다. 또 시진핑 국가주석 집권 이후 금융 리스크 방지 차원에서 그림자 금융에 대한 단속과 규제가 강화된 것도 한 요인이다. 중국의 실물경제가 둔화된 것도 무시할 수 없다. 

시장조사업체 아이메이 리서치에 따르면 올 1~7월 영업중단 등 문제가 발생한 부실 P2P 인터넷대출업체는 850개가 넘는다. 부실 액수만 8000억 위안이 넘으며 1500만명 이상의 이용자가 피해를 입었다.

불신도 커지고 있다. 중국 누리꾼의 약 55%가 P2P대출이 안전하지 않다고 여기는 것으로 조사됐다. 안전하다는 응답은 18%에 그쳤다.

실제 P2P대출도 줄고 있다. 중국 P2P대출 통계업체인 제일인터넷대출에 따르면 7월 말 중국 인터넷 대출잔액은 1조4900억 위안으로 지난해 같은 기간 대비 1.46%, 전달 대비 2.87% 줄었다. 잔액이 5개월 연속 감소세를 보인 건 이번이 처음이다.  

◆중국 정부 팔 걷어붙였다··· ""신규 업체 진입 금지""

최근에는 파산하는 업체가 급증하면서 돈을 떼인 투자자들이 베이징으로 집단 상경해 시위를 벌이는 상황까지 벌어졌다. 중국 정부도 사태의 심각성을 인지하고 P2P대출 문제에 적극적으로 대처하기 시작했다.

중국인민은행을 주축으로 비상대책위원회를 구성하고 전방위적인 실태조사를 진행했다. 이를 바탕으로 지난해 8월 비상대책위원회는 투자자가 과도한 손실을 볼 수 있는 영업 행태를 금지하는 온라인 P2P 대출영업 지침을 처음으로 마련했다.  

여기에는 △원금보장 금지 △신규 투자자로부터 모집한 자금을 기존 투자자에 대한 원리금 지급으로 유용하는 행위 금지 △등록면허권자인 지역 감독당국에 거래내역 보고 의무화 등의 내용이 담겼다. 이 중 거래내역 보고 의무화는 무기한 연기된 상태다. 자료 집계와 절차상 애로 등의 문제가 해결되지 않은 탓이다. 

최근에는 P2P대출 신규업체 설립을 금지하는 강경안을 검토 중이다. 또 P2P대출업체의 시장퇴출 절차 법적 제도화, P2P대출업체 불법행위 단속 처벌강도 강화, P2P대출업체 주주 연대책임 강화 등에 대한 논의에도 착수했다. 이처럼 중국 정부가 태도를 바꾼 것은 P2P대출 부실이 경제 뇌관으로 대두될 수 있다는 불안감 때문이다.   

중국 전체 시장에서 P2P대출 잔액은 총 1조3000억 위안(약 1900억 달러)으로 중국 상업은행 대출잔액의 1% 수준에 불과하다. 전체에서 차지하는 비중은 미미하다. 하지만 잠재 리스크가 크다는 게 대체적인 시각이다. 특히 P2P업체들이 신용대출뿐 아니라 부동산 대출, 자동차 대출 등으로 사업 포트폴리오를 확장할 경우 금융 불안정성은 더 커질 수 있다. 

한국금융연구원은 '중국 온라인 P2P대출업체 파산 증가 및 시사점' 보고서에서 ""저신용자나 한계기업 등 취약차주들은 다중채무자일 가능성이 높다""며 ""은행이나 다른 금융회사들의 신용공급을 축소하거나 중단할 경우 P2P대출 상환이 어려워질 수밖에 없다""고 지적했다. 

보고서는 ""중국 불법 플랫폼이나 부실 업체는 시장에서 퇴출되도록 하면서 은행 대출이 어려운 취약계층에 대한 신용공급 기능은 활성화될 수 있는 방향으로 관리감독체계와 규제를 정비할 필요가 있다""고 강조했다."
핀테크 일반,"해외송금 왜 은행만 하나…저축은행 규제에 발동동
","기획재정부는 지난해 7월 외국환거래법을 개정해 해외송금업에 대해 핀테크업체 등 비금융사의 해외송금업을 허용했다. 그 전 까지는 해외송금업무를 하려면 반드시 시중은행을 거쳐야 했다. 하지만 법 개정에 따라 핀테크 업체가 기재부에 소액해외송금업으로 등록하면 건당 3000달러, 1인당 연 2만달러까지 해외로 돈을 보낼 수 있다. 기재부에 등록된 핀테크 해외송금업체는 20여곳이다. 이들 업체가 해외송금시장에 속속 진출하는 사이 저축은행은 정부 논의만 기다리고 있다.","저축은행이 소비자와 접점을 넓히고 새 활로를 찾기 위해 해외송금사업을 추진하고 있지만 규제에 막혀 답보 상태에 빠졌다. 

22일 저축은행중앙회 현황을 보면 웰컴저축·DB저축은행 등이 해외송금업과 관련, 핀테크 업체와 제휴를 맺고 사업을 추진중이다. 하지만 정부 논의가 공회전을 거듭해 손발이 묶인 상태다.

기획재정부는 지난해 7월 외국환거래법을 개정해 해외송금업에 대해 핀테크업체 등 비금융사의 해외송금업을 허용했다. 그 전 까지는 해외송금업무를 하려면 반드시 시중은행을 거쳐야 했다. 하지만 법 개정에 따라 핀테크 업체가 기재부에 소액해외송금업으로 등록하면 건당 3000달러, 1인당 연 2만달러까지 해외로 돈을 보낼 수 있다. 기재부에 등록된 핀테크 해외송금업체는 20여곳이다. 이들 업체가 해외송금시장에 속속 진출하는 사이 저축은행은 정부 논의만 기다리고 있다.

저축은행은 포지티브 방식의 규제가 적용돼 ‘상호저축은행 표준업무방법서’에 나열된 19가지 업무만 추진할 수 있는데, 해당 업무에 해외송금이 포함되지 않기 때문이다. 저축은행 중앙회 관계자는 “자본력이 충분한 대형 저축은행을 중심으로 핀테크 업체와 협업하면 서로 윈윈할 수 있는 사업인 만큼 당국의 답변만 기다리고 있는 상태”라고 전했다. 정부가 핀테크 활성화에 나서면서 시중은행이 독점하던 해외송금의 진출 문턱이 낮아지고 업권 간 경쟁으로 소비자 편익이 증대할 것이라는 것이 업계의 설명이다. 이에 따라 저축은행 중앙회는 기재부에 해외송금업무를 허용해 달라는 내용의 의견서를 여러 번 건의했다. 저축은행 뿐 아니라 금투업계 사정도 같다. 외환 거래를 원하는 투자자들이 증권사들과 거래를 피하고 있어서다. 

기재부는 여러 관계기관과 의견 수렴이 더 필요하다는 입장이다. 기재부 관계자는 “저축은행 뿐 아니라 다른 업권과의 관계를 금융위 등 관련기관과 검토하고 있어 단기간에 풀 수 있는 문제가 아니다”며 “혁신성장이나 규제완화를 추진하는 정부 방향과 별개로 자금세탁방지 등 부작용에 대해 종합적인 논의를 더 진행해야 한다”고 말했다. 

금융권 관계자는 “리스크 관리 능력이나 자기자본 등의 규모가 핀테크업체 보다 낫고 제도권 금융사로 경험과 노하우를 갖고 있는데 규제에 막혀 아쉽다”며 “리스크가 부담이라면 은행 수준의 외환건전성 기준을 만들어 새 플레이어들이 들어올 수 있는 돌파구를 찾으면 되는데, 그런 의지가 보이지 않는다”고 지적했다. 


한편 해외송금시장은 인터넷전문은행과 핀테크 업체 등의 진출로 금융시장의 격전지가 됐다. 해외 유학과 외국인 노동자들이 늘어 개인 외화송금액이 지난 2015년 83억달러에서 2017년 123억달러로 증가해, 금융권은 해외송금시장이 더 커질 것으로 보고 있다. "
핀테크 일반,"SGA그룹, 핀테크업체 '소다크루' 지분 투자…""기술적 시너지 창출""
","GA블록체인 관계자는 ""소다크루는 토종 해외송금업체 가운데 유일하게 미국시장에서 성공했고 글로벌 사업 영역을 넓혀가고 있다""며 ""이번 투자를 통해 SGA그룹의 가치를 높일 수 있을 것으로 판단했다""고 말했다.  소다크루는 2015년 12월 설립됐다. 크로스보더 P2P 송금서비스인 소다트랜스퍼(SodaTransfer)와 크로스보더 결제 솔루션 소다페이(SodaPay) 등 두 가지 서비스를 선보이고 있다. 설립 1년 만에 출시한 소다트랜스퍼는 10개월 동안 1만5000여명의 베타회원이 가입하는 등 월 20% 성장률을 기록했다. 지난해 12월 미국 내 해외송금 라이선스를 보유한 사업자와 파트너십을 체결하며 미국시장에서의 입지를 확고히 하고 있다.","SGA(55530 -5.13%)그룹이 해외송금서비스 스타트업인 소다크루에 투자를 결정했다고 23일 밝혔다. 해외송금서비스시장에서 차별화된 서비스를 제공하는 소다크루에 투자를 통해 기업과 주주 가치를 높이겠다는 전략이다.

SGA는 소다크루에 전략적 투자자(SI)로 참여한다. 그룹 내 투자주체는 SGA블록체인으로, 단순 지분투자를 넘어 기술적 시너지를 창출하기 위한 목적이라고 회사 측은 설명했다.

SGA블록체인 관계자는 ""소다크루는 토종 해외송금업체 가운데 유일하게 미국시장에서 성공했고 글로벌 사업 영역을 넓혀가고 있다""며 ""이번 투자를 통해 SGA그룹의 가치를 높일 수 있을 것으로 판단했다""고 말했다. 

소다크루는 2015년 12월 설립됐다. 크로스보더 P2P 송금서비스인 소다트랜스퍼(SodaTransfer)와 크로스보더 결제 솔루션 소다페이(SodaPay) 등 두 가지 서비스를 선보이고 있다. 설립 1년 만에 출시한 소다트랜스퍼는 10개월 동안 1만5000여명의 베타회원이 가입하는 등 월 20% 성장률을 기록했다. 지난해 12월 미국 내 해외송금 라이선스를 보유한 사업자와 파트너십을 체결하며 미국시장에서의 입지를 확고히 하고 있다. 

소다크루의 핵심 경쟁력은 ▲경쟁사 대비 낮은 수수료 ▲차별화한 시스템을 통한 거래시간 단축 ▲글로벌 사용자 편의를 위한 다국적 언어 지원 등이다. 미국시장에 안착한 소다크루는 국내에서 해외로 송금할 수 있는 아웃바운드서비스도 출시할 예정이다. 미국에 이어 베트남 ·중국 ·유럽 등으로 서비스 지역의 확대도 준비 중이다.

SGA와의 기술적 협업은 인증과 블록체인 부문에서 이뤄질 예정이다. 특히, 거래 투명성을 높이는 데 블록체인 기술을 활용할 방침이다. 국내외 금융기관은 거래가 자금세탁 등 불법행위에 이용되지 않도록 고객에 적절한 주의를 기울이도록 하는 KYC(Know your customer, 고객알기제도)를 강조하고 있기 때문이다. 

또 무역거래의 결제 시스템에 스마트컨트랙트(smart contract)를 접목하는 등 서비스도 추진한다. 스마트컨트랙트는 계약 조건을 실행하는 컴퓨터 트랜잭션 프로토콜이다. 블록체인 기술을 기반으로 계약 조건을 코딩하고, 조건에 부합하면 계약 내용이 이행되는 방식이다. 거래의 정확도를 높이는 동시에 후선 업무 비용도 절감할 수 있다.

은유민 SGA블록체인 사장은 ""다수 레퍼런스를 통해 검증된 SGA의 블록체인 기술력과 소다페이의 금융 노하우 간 시너지는 상당할 것으로 기대된다""며 ""두 회사는 개발자와 사용자 모두에게 안전하고 편리한 서비스를 내놓기 위해 노력할 계획""이라고 강조했다."
핀테크 일반,"김대윤 한국핀테크산업협회장 ""금융혁신지원 특별법 조속 추진해야""
","김대윤 한국핀테크산업협회장은 은산분리 완화와 핀테크 규제 개혁을 담은 금융혁신지원특별법 제정이 조속히 시행돼야 한다고 설명했다. 최근 협회에서는 규제 대시보드를 운영한다고 밝혔다. 김 회장은 “분야별 스타트업간 규제 이슈가 있는데 매월 어떤 규제가 있는지 대시보드를 만들어 확인한다”면서 “규제를 어떻게 풀 것인지 실행방안, 입법, 유권해석에 대한 자세한 내용을 공유하고 정부에 전달하는 채널”이라고 소개했다.","“핀테크산협회는 금융위원회가 인가한 유일한 핀테크 사단법인입니다. 회원사만 280여개를 넘어섰고, 다양한 분야 스타트업이 존재합니다. 정부 금융혁신지원특별법 제정 관련 부처와 여러 협의를 진행 중입니다. 그 첫 번째가 대시보드 운영입니다”

김대윤 한국핀테크산업협회장은 은산분리 완화와 핀테크 규제 개혁을 담은 금융혁신지원특별법 제정이 조속히 시행돼야 한다고 설명했다. 최근 협회에서는 규제 대시보드를 운영한다고 밝혔다. 

김 회장은 “분야별 스타트업간 규제 이슈가 있는데 매월 어떤 규제가 있는지 대시보드를 만들어 확인한다”면서 “규제를 어떻게 풀 것인지 실행방안, 입법, 유권해석에 대한 자세한 내용을 공유하고 정부에 전달하는 채널”이라고 소개했다. 

과거 정부부처에 핀테크 전담부서가 없어 해당 기업이 애로를 겪었다. 금융위 뿐 아니라 기획재정부, 공정거래위원회도 마찬가지였다. 

최근 금융위 산하에 금융혁신과가 설립되고 기획재정부 등은 옴브즈만을 운영하는 등 규제를 바라보는 시각이 전향적으로 바뀌었다고 설명했다. 

김 회장은 “협회 차원에서 법제화가 필요한 부분을 지속 건의해 현재 핀테크 규제 혁신 관련 법안이 4개 국회에 상정됐다”면서 “최근까지 정무위원회 법안 심사소위와도 미팅을 진행해 업계 의견을 전달했다”고 말했다. 

이어 “블록체인 산업에 대한 정확한 기준이 아직 마련되지 않았고, P2P법안도 법제화하기엔 다소 시간이 걸릴 것으로 보인다”면서 “이 같은 문제에 대해 금융당국과 여러 의견을 나누고 전향적 결과가 나올 수 있으리라 기대한다”고 설명했다. 

특히 은산분리 관련 핀테크 기업 입장도 내놨다. 김 회장은 “그간 핀테크 산업에서 기존 금융사 역할은 매우 중요하지만 스스로 철옹성을 쌓은 부분이 있다”면서 “은산분리 완화가 돼야 전통 금융사가 기득권에 위협을 받는 구조가 되고 이 시점이 바로 스타트업에게 다양한 기회가 된다”고 설명했다. 

인터넷은행 IT기반 사업이 확대되면 기존 은행도 다양한 핀테크 기업과 협업을 하게 될 것이고 IT를 융합한 혁신서비스가 창출될 수 있다고 강조했다. 

그는 “카카오뱅크와 케이뱅크는 다양한 금융서비스를 스타트업과 함께 추진 중”이라면서 “인터넷은행 대주주에 IT기업 등이 들어오면 사업운영방식 자체가 바뀔 것”이라고 말했다.

금융혁신지원 특별법에 규제 샌드박스 사후 운영관리 방안과 데이터산업 활성화가 반드시 포함돼야 한다고도 제시했다. 

김 회장은 “정부부처가 규제 샌드박스를 여러 부문에 적용했지만 시행 후 어떻게 운영되느냐가 중요하다”면서 “'이런 회사는 되고 이런 회사는 안 됩니다'식 방식이 아니라 특별법 통과 후에도 세부 규제 샌드박스가 운영되도록 가이드라인을 만들어야 한다”고 설명했다.

데이터 산업 고도화에 따른 역차별 논란도 해소하고 가야 한다. 최근 스크래핑 금지 논란에 대해 “규제 방향으로 다른 업종이 피해를 보는 건 안될 일”이라면서 “금융당국이 소프트랜딩하는 최적 방안을 찾길 바란다”고 말했다. "
간편결제,"삼성 페이, 출시 3주년 맞아 전세계 6대륙 서비스 확대
","각 지역에 특화된 서비스로는, 홍콩에서 교통카드 업체인 옥토퍼스社와 파트너십을 통해 교통 카드뿐 아니라 상점에서 삼성 페이로 결제를 할 수 있고, 브라질에서는 혜택카드 업체인 Ticket社와 파트너십을 통해 기업 및 기관용 복지 카드로 임직원들이 상점, 극장, 슈퍼 등에서 결제할 수 있다. 또한, 삼성 페이는 현지 결제 서비스들과의 협업을 통해 각 지역에서 인기 있는 모바일 결제 플랫폼과 통합해 해당 모바일 결제 서비스를 삼성 페이에서 바로 편리하게 사용할 수 있게 했다.","출시 3주년을 맞은 삼성페이가 전세계 6대륙에서 고객의 편리한 결제 수단으로 자리잡고 있다. 

삼성전자는 22일 삼성페이 3주는을 맞아 21일(현지시간) 남아프리카공화국에 삼성 페이를 출시, 전세계 6대륙 24개국 및 시장으로 서비스를 확대하고 글로벌 결제 건수 13억을 돌파했다고 밝혔다. 

삼성 페이는 현지 파트너사들과 긴밀한 협력을 통해 각 시장의 소비자들이 원하는 다양한 혜택들을 제공하며 모바일 결제 서비스 시장을 확대해 나가고 있다. 

각 지역에 특화된 서비스로는 홍콩에서 교통카드 업체인 옥토퍼스사와 파트너십을 통해 교통 카드뿐 아니라 상점에서 삼성페이로 결제를 할 수 있고, 브라질에서는 혜택카드 업체인 티켓(Ticket)사와의 제휴로 기업 및 기관용 복지 카드로 임직원들이 상점, 극장, 슈퍼 등에서 결제할 수 있다. 

또한 삼성 페이는 현지 결제 서비스들과의 협업을 통해 각 지역에서 인기 있는 모바일 결제 플랫폼과 통합해 해당 모바일 결제 서비스를 삼성 페이에서 바로 편리하게 사용할 수 있게 했다.. 

주요 금융 파트너로는 페이팔(미국), 체이스페이(미국), 페이코(한국), 알리페이(중국), 위챗페이(중국), BHIM UPI(인도), 나파스(베트남) 등이 있다. 

삼성전자 IM부문장 고동진 사장은 ""삼성 페이는 출시 후 3년 동안, 보다 편리하고, 안전하고, 어디서나 사용할 수 있는 모바일 결제 플랫폼(mobile wallet platform)으로 지속 확장해 왔다""면서 ""모바일 결제 서비스 뿐 아니라 삼성 리워즈 포인트로 소비자들에게 더 많은 혜택을 제공하고 빅스비와 연계해 보다 편리한 결제 서비스를 경험할 수 있도록 계속해서 진화하고 발전해 나갈 것""이라고 강조했다."
