category,title,body,origin
카드업계 동향,"빅데이터ㆍ코딩… 카드사 ‘디지털’ 열공
",교육에 참여한 직원들은 ▦건강 ▦골프 ▦쇼핑 등 16개 분야의 취미 생활을 분류한 뒤 고객들의 구매 이력을 분석해 각각의 영역에 대해 점수를 매겨 개개인에게 가장 적합한 쿠폰을 발급하는 과정을 체험했다. 전략가맹점팀 소속 직원은 “단순히 카드 사용 분석을 통해 매출이 큰 가맹점에 쿠폰이나 할인 서비스를 제공하는 수준인 줄로만 알았는데 실제로 데이터 활용 과정을 접해보니 생각보다 복잡한 분석 기법이 적용되고 있었다”고 말했다.,"신한카드의 ‘빅데이터 오픈 워크’ 행사가 열린 지난 24일 임직원 20여명은 고객에게 맞춤형 쿠폰을 발급하는 과정을 체험했다. 특히 그 동안의 구매 이력과 비슷한 연령대의 다른 고객 선호도 등을 분석해 가맹점을 추천하고 그 가맹점의 쿠폰을 발급하기까지 모든 과정에서 신한카드가 보유한 빅데이터가 활용됐다.

교육에 참여한 직원들은 ▦건강 ▦골프 ▦쇼핑 등 16개 분야의 취미 생활을 분류한 뒤 고객들의 구매 이력을 분석해 각각의 영역에 대해 점수를 매겨 개개인에게 가장 적합한 쿠폰을 발급하는 과정을 체험했다. 전략가맹점팀 소속 직원은 “단순히 카드 사용 분석을 통해 매출이 큰 가맹점에 쿠폰이나 할인 서비스를 제공하는 수준인 줄로만 알았는데 실제로 데이터 활용 과정을 접해보니 생각보다 복잡한 분석 기법이 적용되고 있었다”고 말했다.


카드업계가 모바일로 빠르게 옮겨가는 결제 환경 등에 적극 대응하기 위해 디지털화에 승부를 걸고 나섰다. 개발이나 데이터 분석 부서는 물론 영업이나 마케팅 등 직접 연관이 없는 부서 직원들도 코딩 또는 빅데이터 강좌를 듣거나 교육을 받고 있다. 큰 도움이 된다는 게 일반적인 반응이지만 일부 직원들은 어려움도 호소하고 있다.

신한카드는 최근 업무상 빅데이터와 관련 없는 부서의 직원 102명을 대상으로 빅데이터 시연 행사를 펼쳤다. 신한카드는 각 개인의 생애주기에 따라 빅데이터를 접목하는 개인화 작업뿐 아니라 ▦마케팅 성공사례 ▦지리정보시스템 이용 방법 등에 대한 교육을 진행했다. 현업 부서 직원들도 최소한의 빅데이터 소양을 갖추고 빅데이터 관련 부서와의 시너지를 낼 수 있도록 하기 위해서다. 교육에 참석한 신한카드 관계자는 “평소 데이터를 다루는 부서에 있지 않아 빅데이터로 서비스를 만들어 내는 과정이 복잡하게 느껴졌는데 체험을 통해 개념을 명확하게 이해할 수 있었다”고 말했다.

모든 임직원들에게 디지털 문화를 뿌리 내리기 위한 작업은 다른 카드사에서도 일어나고 있다. 현대카드는 사내 시설물의 안내문구를 프로그래밍 언어인 ‘파이썬’으로도 병기해 직원이나 방문자들이 업무 과정에서 자연스레 코딩을 체감할 수 있도록 하고 있다. 하나카드도 전 직원들에게 매일 디지털 용어를 설명하는 ‘데일리 디지털 키워드’를 발송하고 있다. 최근에는 직원 80명을 선발해 ‘디지털 유니버시티’ 과정에 투입했다. KB국민카드는 전 직원이 수강하는 기초 단계(레벨 1)부터 시장 전문가 양성 과정(레벨 4)까지 4단계로 구성된 ‘디지털 핵심인재 아카데미’를 운영 중이다.

카드사들의 이러한 행보는 모든 직원의 디지털화를 통해 결제 시장의 디지털 변화에 적극 대응함으로써 궁극적으로는 경쟁에서 살아남기 위해서다. 한국은행의 전자지급서비스 이용 현황에 따르면 지난해 하루 평균 간편결제서비스 이용 금액은 672억원으로, 2016년(260억원)보다 160%나 증가했다. 현대카드 관계자는 “디지털이 접목된 환경에서 일하는 것과 그렇지 않은 곳에서 일하는 것은 사고방식에서 차이가 날 수 밖에 없다”고 말했다. "
카드업계 동향,"현대카드, 21개국·3개 통화 송금 가능한 해외송금 서비스 출시..송금 수수료 3000원
","현대카드는 현대카드 해외송금 서비스를 시작한다고 지난 16일 밝혔다. 현대카드 해외송금은 전용 모바일 애플리케이션(응용프로그램)을 통해 외화를 송금할 수 있는 현대카드 회원 전용 서비스다. 현대카드 해외송금은 송금 수수료 3000원만 내면돼 고객들의 수수료 부담을 크게 낮췄다. 일반적으로 해외 송금에는 송금 수수료 외에도 전신료, 중개수수료 등 부대 비용이 포함돼 5000~3만원 가량의 수수료가 발생한다.","현대카드가 낮은 송금 수수료를 앞세운 해외송금 서비스를 출시해 인기를 끌고 있다.

현대카드 제공
현대카드는 현대카드 해외송금 서비스를 시작한다고 지난 16일 밝혔다. 현대카드 해외송금은 전용 모바일 애플리케이션(응용프로그램)을 통해 외화를 송금할 수 있는 현대카드 회원 전용 서비스다. 현대카드 해외송금은 송금 수수료 3000원만 내면돼 고객들의 수수료 부담을 크게 낮췄다. 일반적으로 해외 송금에는 송금 수수료 외에도 전신료, 중개수수료 등 부대 비용이 포함돼 5000~3만원 가량의 수수료가 발생한다.

송금 시간도 빠르다. 일반적인 해외 송금은 1~5일 가량 걸리지만, 현대카드 해외송금을 이용하면 1~3일 정도면 충분하다. 건당 최대 미화 3000달러, 연 최대 2만달러까지 송금할 수 있다. 현재는 미국 달러를 포함해 유로화, 영국 파운드화 등 3가지 통화를 사용해 21개국에 돈을 보낼 수 있다.

별도 계좌 개설, 공인인증서 설치, 영업점 방문 등 복잡한 절차도 생략했다. 현대카드 아이디로 로그인만 하면 회원 본인의 카드 결제 계좌에서 간편하게 송금할 수 있다. ‘즐겨찾기’ 기능도 만들어 쉽고 빠르게 재송금이 가능하고 ‘송금내역’을 통해 송금의 진행 상태 확인 및 취소·변경까지 가능하다.

현대카드 해외송금 앱은 구글 플레이스토어, 애플 앱스토어에 순차적으로 업로드 될 예정이며, 서비스 이용을 원하는 고객은 앱을 다운로드 받아 사용하면 된다. 현대카드는 서비스 출시를 기념해 오는 5월 31일까지 수수료 면제 이벤트도 진행한다. 이 기간 현대카드 해외송금 서비스를 이용하는 고객은 송금 수수료 3000원을 전액 면제 받을 수 있다."
카드업계 동향,"'혁신가' 정태영 현대카드 부회장
","페이스북 팔로어가 11만 명에 달할 정도로 유명인사인 정 부회장은 2003년에 현대카드 대표이사에 오른 뒤 혁신적인 시도를 거듭해 ‘한국의 스티브 잡스’라고 불기기도 하며, 금융에 공연과 예술을 접목시킨 차별화된 전략으로 '문화 마케팅 전문가'로 지칭되기도 한다. ","세상에는 수많은 기업이 있고 그만큼 많은 리더들이 존재한다.

애플의 설립자이자 혁신의 아이콘인 스티브 잡스(1955~2011)는 여전히 최고의 리더이자 CEO로 꼽히는데 부족함이 없다.

이미 세상을 떠났지만 그가 남긴 업적은 여전히 우리에게 편의와 영감을 주고 있으며, 특히 그가 프레젠테이션, 대학교 졸업식 등에서 남긴 말들은 명언, 어록으로 많은 이들에게 회자되고 있다.

반면, 리더의 자리에서도 잘못된 언행으로 물의를 빚고, 영원히 부정적인 꼬리표를 달고 사는 경우도 분명 존재한다.

우리는 리더들의 말에서 신념과 사상을 엿보기도 하며, 때로는 교훈을 얻기도 한다.

컨슈머치는 리더들의 말과 그들에 대한 제 3자의 평가들을 바탕으로 그들을 새롭게 조명해보고자 한다."
카드업계 동향,"비씨카드, FIDO 기반 '안면인증 서비스' 도입
",비씨카드는 국내 최초로 피도(FIDO) 기반의 범용자체 안면인증 서비스를 도입한다고 26일 밝혔다.  피도 기반의 안면인증 서비스는 ▲고객의 얼굴에서 추출 가능한 특징점 데이터화 ▲인증 시 얼굴 움직임을 통한 사진·영상자료 판독 ▲회원 본인이 최초에 등록한 데이터와의 일치여부 확인 등의 순으로 제공된다.,"비씨카드는 국내 최초로 피도(FIDO) 기반의 범용자체 안면인증 서비스를 도입한다고 26일 밝혔다. 
피도 기반의 안면인증 서비스는 ▲고객의 얼굴에서 추출 가능한 특징점 데이터화 ▲인증 시 얼굴 움직임을 통한 사진·영상자료 판독 ▲회원 본인이 최초에 등록한 데이터와의 일치여부 확인 등의 순으로 제공된다.
이 서비스는 적외선 인식용 카메라가 탑재된 일부 기기에서만 이용할 수 있었던 기존 서비스와 달리 스마트폰 전면의 일반 카메라를 통해 사용할 수 있도록 범용성을 높였다.

또 스마트폰의 운영체계 구분 없이 서비스 제공이 가능하며 지문의 건조·물기, 외부소음 등의 문제로 생체인증 서비스를 사용하기 어려운 환경에서도 사용 가능해 편의성을 높였다.

안면인증 중 표정, 동작 등의 수행 과정을 거쳐야 하는 인증방식과 회원이 인증을 요청한 기기가 최초에 등록된 기기와 동일 여부를 검증하는 피도 인증 방식 2가지 모두를 통과해야 인증이 진행돼 보안성이 강화된 것도 특징이다.

현재 안면인증 서비스는 ‘페이북’(paybooc) 애플리케이션 로그인 시 이용할 수 있으며 향후 결제도 가능하도록 서비스를 확대할 예정이다.

김진철 비씨카드 마케팅부문장은 ”안면인증은 향후 활용 가능성이 높은 생체인증 방식”이라면서 “비씨카드 고객에게 다양하고 고도화된 서비스를 제공하기 위해 안면인증 서비스를 출시하게 됐다”고 밝혔다."
간편결제,"SSG페이, 음식 배달 서비스 '쓱배달' 론칭
","SSG페이는 SSG페이 앱 속 ‘생활쓱’ 영역을 통해 음식 배달 주문 및 결제할 수 있는 ‘쓱배달’ 서비스를 시작한다고 26일 밝혔다. 현재 쓱배달에서는 멕시카나 치킨과 피자알볼로, 피자헤븐 등의 메뉴를 주문부터 결제까지 원스톱으로 이용할 수 있다. 이와 더불어 5월 중으로 치킨플러스, 스쿨푸드 등 배달 가능한 브랜드를 점차 확대해 나간다는 계획이다.","신세계백화점 상품권을 SSG머니로 전환해 결제 가능
신세계그룹의 간편결제 서비스 SSG페이가 배달 중계 운영사 푸드테크와 손잡고 배달 서비스를 론칭한다.

SSG페이는 SSG페이 앱 속 ‘생활쓱’ 영역을 통해 음식 배달 주문 및 결제할 수 있는 ‘쓱배달’ 서비스를 시작한다고 26일 밝혔다.

현재 쓱배달에서는 멕시카나 치킨과 피자알볼로, 피자헤븐 등의 메뉴를 주문부터 결제까지 원스톱으로 이용할 수 있다. 이와 더불어 5월 중으로 치킨플러스, 스쿨푸드 등 배달 가능한 브랜드를 점차 확대해 나간다는 계획이다.


SSG페이는 지난 3월부터 ‘생활쓱’ 내에 꽃 배달 운영사 더블룸랩과 제휴를 통해 꽃 배달 서비스인 ‘쓱플라워’ 서비스도 선보이고 있다. ‘쓱플라워’ 역시 꽃 주문부터 결제까지 원스톱으로 진행된다.

쓱배달과 쓱플라워 서비스는 SSG페이의 결제 수단인 SSG머니, 신용카드, 계좌결제로 이용할 수 있다. 특히, 스크래치형 신세계 상품권을 SSG머니로 전환할 수 있어 SSG페이를 활용하면 신세계 상품권을 음식 배달과 꽃 배달 서비스에 사용할 수 있게 됐다.

문준석 신세계아이앤씨(신세계I&C) 플랫폼마케팅팀 팀장은 “O2O서비스 영역 확대로 고객들의 일상생활과 밀접한 배달 서비스도 SSG페이를 보다 편리하게 사용할 수 있게 됐다”며, “이번 제휴를 통해 SSG페이와 제휴사의 서비스가 함께 성장할 수 있는 환경을 구축했다는 점에서 의미가 깊다”고 말했다."
간편결제,"교보생명 '카카오페이 본인인증·보험료송금' 도입
","26일 오후 광화문 교보생명 본사에서 열린 교보생명과 카카오페이의 업무제휴 협약식에서 교보생명 김욱 디지털혁신담당 전무(왼쪽 다섯번째), 카카오페이 이진 사업총괄이사(오른쪽 다섯번째) 등이 기념촬영을 하고 있다. ","교보생명이 보험업계 최초로 카카오페이와 포괄적 업무협약(MOU)을 맺고 인슈어테크에 박차를 가한다.

양사는 26일 광화문 교보생명 본사에서 교보생명 김욱 디지털혁신담당 전무, 카카오페이 이진 사업총괄이사 등이 참석한 가운데 MOU 체결식을 진행했다.

이번 업무협약은 새로운 인슈어테크 기술을 한 발 앞서 보험업무에 적용하고 고객들에게 한층 편리한 서비스를 제공하기 위해 마련됐다. 

우선 다음달부터 보험업계 최초로 모바일웹 보험계약대출에 ‘카카오페이 인증’이 도입된다. 고객이 스마트폰으로 보험계약대출을 이용할 때 별도의 앱이나 공인인증서가 없어도 카카오톡으로 전달된 메시지를 통해 전자서명(비밀번호)을 입력하면 본인인증이 완료된다.

교보생명 모바일창구 앱에서는 국내 최초로 공인인증서 대신 카카오페이 인증과 휴대폰 인증만으로도 지문인증과 PIN인증을 등록할 수 있어 고객 편의성이 크게 증대될 전망이다.

또한 ‘카카오머니(카카오페이 內 전자지갑) 송금’을 활용해 보험료를 납부하거나 보험금이나 보험계약대출을 받을 수 있도록 운영한다.

내년에는 청구서를 등기우편 대신 카카오톡으로 받아볼 수 있도록 ‘청구 알림톡’ 서비스를 도입하고, 카카오 청구서에서 보험료를 실시간으로 납부할 수 있도록 운영할 예정이다."
간편결제,"간편결제도 포인트적립·수수료 인하 검토
","김 부위원장은 간담회에서 ""우리나라는 온라인 시장에서는 모바일을 통한 간편결제가 활성화 돼 있지만, 오프라인 시장에서는 아직 규모가 크지 않고 신용카드 기반으로 결제가 이뤄지고 있다""고 지적했다. 이에 따라, 금융위는 모바일 결제 서비스를 확산시키기 위해 소득공제 및 각종 세제혜택을 지원할 방침이다. 당국은 우선, 모바일 결제시에도 포인트 적립 등이 가능하도록 할 방침이다. 또한 모바일결제 시에도 소득공제 등 세제 혜택을 지원하기 위해 소관 부처인 기획재정부와 협의를 진행중이다.","소득공제등 세제혜택 지원위해
소관 부처 기재부와 협의 진행
금융당국이 삼성페이, 카카오페이, 네이버페이 등 스마트폰으로 결제할 수 있는 간편결제 시장 활성화를 위해 가맹점 수수료 인하와 소득공제를 검토하고 있다.

28일 금융위원회는 이날 오후 정부서울청사 금융위원회에서 김용범 금융위 부위원장 주재로 금융사, 핀테크 기업 등이 참가한 가운데 '모바일 결제 활성화' 간담회를 가졌다.

김 부위원장은 간담회에서 ""우리나라는 온라인 시장에서는 모바일을 통한 간편결제가 활성화 돼 있지만, 오프라인 시장에서는 아직 규모가 크지 않고 신용카드 기반으로 결제가 이뤄지고 있다""고 지적했다.

이에 따라, 금융위는 모바일 결제 서비스를 확산시키기 위해 소득공제 및 각종 세제혜택을 지원할 방침이다. 당국은 우선, 모바일 결제시에도 포인트 적립 등이 가능하도록 할 방침이다. 또한 모바일결제 시에도 소득공제 등 세제 혜택을 지원하기 위해 소관 부처인 기획재정부와 협의를 진행중이다.

이와 함께, 금융위는 새로운 방식의 도입을 억제하는 규제나 기존 신용카드에 유리하게 적용되는 제도 및 법규를 폐지 또는 조정하기로 했다.

또한 금융사와 핀테크 기업에 규제 완화와 제도적 지원을 위한 건의사항을 듣고 이들이 다양한 모바일 결제 서비스를 도입할 수 있도록 지원할 방침이다. 금융위는 ""거래비용은 낮고 편의성과 보안성은 높은 결제수단이 활성화될 수 있도록 기반을 마련하겠다""고 밝혔다.

간편결제 서비스는 공인인증서나 OTP(One Time Password)없이 비밀번호만으로 간편하게 결제할 수 있는 신종 전자지급 서비스다. 간편결제는 지급 카드 정보 등을 모바일 기기에 저장해두고 비밀번호를 입력 후 단말기만 접촉해 결제할 수 있어 사용이 매우 편리한 장점이 있다.

그러나 우리나라의 경우, 신용카드의 영향력이 절대적이어서 국내 최대 간편결제 서비스인 삼성페이도 신용카드 기반 의 모바일 서비스를 지원하고 있다. 이 때문에 선불충전·예치방식인 에스크로(Escrow)기반의 페이팔과 알리페이 같은 간편결제 서비스는 제공되지 못하고 있다. 반면 중국은 이미 현금결제에서 카드결제를 거치지 않고 핀테크 기업 중심의 계좌기반 모바일 결제서비스 확산되고 있다.

한편 이날 간담회 참석자들은 모바일 간편결제 시장 확산을 위해 과감한 규제완화를 주문했다.

이날 간담회에 참석한 업계 관계자는 ""아직 초기 단계에 머물러 있는 모바일 간편결제 시장의 활성화를 위해 정부가 더 적극적인 육성책과 규제완화 노력을 해달라고 요구했다""고 분위기를 전했다."
간편결제,"간편결제, 거리로 나가다..""오프라인 결제 강화""
","NHN엔터테인먼트의 간편결제 서비스인 '페이코'가 내달 삼성페이와 손잡고 오프라인 결제처 확산에 나선다. 삼성페이는 카드단말기 대부분에 설치된 '마그네틱보안전송(MST)'을 사용하기 때문에 신용카드 결제가 가능한 곳 어디서나 쓸 수 있다. 페이코는 삼성페이의 이 같은 '범용성'을 확보하고 대신 온라인 부문에서 삼성페이와 협력할 것으로 알려졌다. 페이코는 오프라인에서 근거리무선통신(NFC) 서비스를 사용하기 때문에, 이 단말기가 있는 제한된 곳에서만 결제가 가능한 단점이 있었다.","페이코, 삼성페이와 손잡고 오프라인 결제처 확산
카카오페이 역시 알리페이와 함께 QR코드 결제 도입
온오프라인 범용성 확보해 레드오션 온라인 간편결제 시장 돌파

간편결제 빅4 업체가 오프라인 결제 시장에서 한판 승부를 예고하고 있다. 온라인 결제 시장이 빠르게 성장하고는 있지만 여전히 오프라인 생태계를 장악하지 않고서는 승산이 없다는 판단이다.

25일 업계에 따르면 NHN엔터테인먼트의 간편결제 서비스인 '페이코'가 내달 삼성페이와 손잡고 오프라인 결제처 확산에 나선다. 삼성페이는 카드단말기 대부분에 설치된 '마그네틱보안전송(MST)'을 사용하기 때문에 신용카드 결제가 가능한 곳 어디서나 쓸 수 있다. 페이코는 삼성페이의 이 같은 '범용성'을 확보하고 대신 온라인 부문에서 삼성페이와 협력할 것으로 알려졌다. 페이코는 오프라인에서 근거리무선통신(NFC) 서비스를 사용하기 때문에, 이 단말기가 있는 제한된 곳에서만 결제가 가능한 단점이 있었다.

24일 인터넷기업협회가 주최한 간편결제 관련 토론회에서 만난 정상민 NHN엔터테인먼트 부장은 ""페이코가 NFC와 바코드에 이어 MST 방식을 지원함으로써 온ㆍ오프라인 결제 범용성을 확보하게 될 것""이라며 ""오프라인 내 간편결제 시장에서의 선점효과를 기대한다""고 말했다.

카카오도 오프라인 생태계 확산에 적극적이다. 내달 중순 중국 알리페이와 손잡고 QR코드를 활용한 결제 시스템을 선보인다. 판매자가 스마트폰에서 가격 정보 등이 담긴 QR코드를 보여주면 소비자가 자신의 스마트폰으로 이를 읽어낸 뒤 결제를 승인하는 방식이다. 이진 카카오페이 사업총괄이사는 ""230만 가맹점에서 쓸 수 있는 카카오페이 카드를 출시한 데 이어 QR코드 결제 시스템까지 도입하는 등 카카오페이의 오프라인 결제 확장에 큰 힘을 쏟고 있다""고 말했다.

현재 국내 간편결제 시장은 삼성페이와 네이버페이ㆍ페이코ㆍ카카오페이 등 4개사가 주도하고 있다. 이들이 오프라인 무대에 집중하는 이유는 온라인 결제 시장과의 절대적 규모 차이 때문이다. KT경제경영연구소에 따르면 2016년 국내 오프라인 신용카드 결제 규모는 700조원으로 80조원 수준의 온라인 결제 시장의 9배에 달한다. 시장 규모의 차이가 여전히 큰 만큼, 오프라인 시장에서의 경쟁력 강화 및 온ㆍ오프라인 범용성 확보가 필수적이란 것이다.

현재 국내 간편결제 시장은 중국에 비해 크게 뒤처져있다는 평가가 많다. 불필요한 금융규제, 정부 지원 부족 등이 문제점으로 꼽힌다. 또한 신용카드를 사용하기 '너무 편한' 환경도 한 몫 하고 있다. 정 NHN엔터테인먼트 부장은 ""신용카드 인프라가 잘 구축돼 있어 '지문인식ㆍ비밀번호 입력' 등이 번거로운 간편결제를 꼭 이용해야 하느냐는 거부감이 있다""며 ""간편결제 업체들의 가장 큰 숙제는 소비자 인식 전환""이라고 했다.

지난달 금융위원회는 '핀테크 혁신 활성화 방안'을 발표하고 인센티브 지급을 통해 앱투앱 결제를 적극 육성하기로 했다. 앱투앱이란 스마트폰 앱을 통해 물건값을 치르는 결제 서비스다. 카카오페이가 알리페이와 함께 준비하는 신규 서비스도 앱투앱의 일종이다. 밴사와 같은 카드 결제대행사를 거치지 않아 수수료를 낮출 수 있는 장점이 있다. 정 부장은 ""오프라인 간편결제 시장을 활성화하기 위해서는 카드 기반의 앱투앱에 대한 정책적 지원도 마련돼야 할 것""이라고 말했다."
인터넷전문은행,"카카오뱅크도 토스로 간편 송금 가능해져..계좌 잔고 확인은 미지원
","토스는 이번 연동으로 시중 은행 20개, 증권사 8개로 총 28개 금융 기관과 연동이 가능해졌다. 카카오뱅크 사용자는 토스 계좌탭에서 계좌 추가하기 메뉴를 통해 카카오뱅크 계좌를 등록하고 간편 송금 서비스를 이용할 수 있다.","간편 송금 서비스 토스 운영사 비바리퍼플리카는 26일 카카오뱅크와 연동이 가능해졌다고 밝혔다.

토스는 이번 연동으로 시중 은행 20개, 증권사 8개로 총 28개 금융 기관과 연동이 가능해졌다. 카카오뱅크 사용자는 토스 계좌탭에서 계좌 추가하기 메뉴를 통해 카카오뱅크 계좌를 등록하고 간편 송금 서비스를 이용할 수 있다.

업계에서는 카카오뱅크가 카카오페이를 통한 간편 송금 서비스가 있는 인터넷 은행으로서 기존 간편 송금 서비스이자 금융 플랫폼인 토스와 연동은 없을 것으로 예상했다. 하지만 많은 토스 사용자들 요청과 두 업체 제휴로 간편 송금 서비스 이용이 가능해졌다.

간편 송금 서비스는 이용할 수 있지만 계좌 확인 서비스는 아직 이용할 수 없다. 비바리퍼블리카 관계자는 “별도 응용프로그램인터페이스(API) 개발이 필요 아직 계좌 확인 서비스를 제공하지 않고 있다”며 “향후 확인 가능하도록 할 예정”이라고 말했다.

이승건 토스 대표는 “그 동안 많은 사용자들이 기다려온 카카오뱅크와 정식으로 연동돼 많은 분들이 반길 것으로 기대한다. 앞으로도 토스는 고객의 편리한 금융 생활을 지원하는데 최선을 다하겠다”고 말했다."
